项目名称,项目URL,提交ID,提交者,提交时间,提交信息,提交链接
curl/curl,https://github.com/curl/curl,b5265b2,bttrfl on github,2025-11-23T03:55:16Z,"speedcheck: do not trigger low speed cancel on transfers with CURL_READFUNC_PAUSE  When a trasfer is paused from a read callback with a CURL_READFUNC_PAUSE code, it should be excluded from the speedcheck. Currently only transfers paused from write callbacks are excluded, because the code only checks for ""recv direction"" of the transfer. This commit adds a check for ""send direction"".  Issue similar to https://github.com/curl/curl/issues/6358  Closes #19653",https://github.com/curl/curl/commit/b5265b24b059c1d37512d76b767ff832a68ab817
curl/curl,https://github.com/curl/curl,4d04a03,renovate[bot],2025-11-23T18:23:32Z,GHA: update ngtcp2/nghttp3 to v1.13.0 from v1.12.0  Closes #19654,https://github.com/curl/curl/commit/4d04a0301629d1d37476e312202c0c62b5db309e
curl/curl,https://github.com/curl/curl,74cf772,renovate[bot],2025-11-23T09:37:41Z,GHA: update ngtcp2/ngtcp2 to v1.18.0 from v1.17.0  Closes #19655,https://github.com/curl/curl/commit/74cf7725d7c47cb66818063bbb1773b4fc6e1247
curl/curl,https://github.com/curl/curl,29b3b1a,Stefan Eissing,2025-11-23T15:59:40Z,"wolfssl: fix cipher list, skip 5.8.4 regression  - adjust cipher list in infof() statement for min/max TLS version  - skip test_17_07 for wolfSSL 5.8.4 when CHACHA20 is negotiated   due to regression with homebrew build on ARM systems.  Fixes #19644 Reported-by: Viktor Szakats Closes #19662",https://github.com/curl/curl/commit/29b3b1ae6d7ce561700cfe81aaba3b3ebc8a7a6a
curl/curl,https://github.com/curl/curl,74f7505,Daniel Stenberg,2025-11-23T13:42:59Z,asyn-ares: remove hostname free on OOM  The freeing of the already allocated hostname is done by Curl_async_shutdown(). This extra free in the RR code path made a double-free.  Presumably not detected because the CI torture tests don't run HTTPS-RR enabled?  Follow-up to 8d0bfe74fb Closes #19658,https://github.com/curl/curl/commit/74f7505974836f633c955dbce7514f12f78ddc5b
curl/curl,https://github.com/curl/curl,f13f320,Daniel Stenberg,2025-11-22T21:44:39Z,tool_msgs: make voutf() use stack instead of heap  For printf()ing the message to show.  Closes #19651,https://github.com/curl/curl/commit/f13f320dee7ea37bc01cc7b4282450b6165373c9
curl/curl,https://github.com/curl/curl,36b9987,Daniel Stenberg,2025-11-22T18:09:42Z,"tool_operate: fix a case of ignoring return code in operate()  If get_args() returns error, do not overwrite the variable in the next call.  Also, avoid allocating memory for the default user-agent.  Closes #19650",https://github.com/curl/curl/commit/36b9987acbc42734b1dab0e3f96d64aba1350839
curl/curl,https://github.com/curl/curl,4ebef2f,Daniel Stenberg,2025-11-22T17:03:40Z,"tool_operate: fix case of ignoring return code in single_transfer  When glob_url() returns error, stop.  Closes #19649",https://github.com/curl/curl/commit/4ebef2f0d9e3d14c31bdc342235863ef30bdf7d1
curl/curl,https://github.com/curl/curl,7d75c72,Daniel Stenberg,2025-11-20T22:57:04Z,KNOWN_RISKS: known risks when running and using curl and libcurl  Closes #19631,https://github.com/curl/curl/commit/7d75c728a65be961c63169fcf9f307c3324e440b
curl/curl,https://github.com/curl/curl,905b718,Daniel Stenberg,2025-11-21T15:53:51Z,"Revert ""GHA: update gnutls/gnutls to 3.8.11 from 3.8.10""  This reverts commit a439fc0e372c3de7df3b8ae3ca7752bc3cbca826.  It requires a version of libnettle that is not included in these Ubuntu versions: ""Libnettle 3.10 was not found""  Closes #19642",https://github.com/curl/curl/commit/905b718de3fb9287c7c0037b2737aa395f01ad3c
curl/curl,https://github.com/curl/curl,18b9429,Viktor Szakats,2025-11-18T00:48:04Z,"curlx: replace `mbstowcs`/`wcstombs` with `_s` counterparts (Windows)  They are used in Windows-specific `fopen()`, `freopen`, `open()` and `curlx_get_winapi_error()` calls, and in `fix_excessive_path()` in Unicode builds.  Refs: https://learn.microsoft.com/cpp/c-runtime-library/reference/mbstowcs-mbstowcs-l https://learn.microsoft.com/cpp/c-runtime-library/reference/mbstowcs-s-mbstowcs-s-l https://learn.microsoft.com/cpp/c-runtime-library/reference/wcstombs-wcstombs-l https://learn.microsoft.com/cpp/c-runtime-library/reference/wcstombs-s-wcstombs-s-l  Also ban these functions via checksrc.  Co-authored-by: Jay Satiro  Closes #19581",https://github.com/curl/curl/commit/18b94293133c1e035b5ac5b4fde854d1f17418a3
curl/curl,https://github.com/curl/curl,acfcc2b,Viktor Szakats,2025-11-21T14:57:17Z,"checksrc: ban `_tcsncpy`, `wcscpy`, `wcsncpy`  Follow-up to eaa7651374898cef89e5783b0219bdffcc0eb60e #19589  Closes #19641",https://github.com/curl/curl/commit/acfcc2b28806a1be7e027205673b1a33618ddfb5
curl/curl,https://github.com/curl/curl,a439fc0,renovate[bot],2025-11-20T05:59:59Z,GHA: update gnutls/gnutls to 3.8.11 from 3.8.10  Closes #19613,https://github.com/curl/curl/commit/a439fc0e372c3de7df3b8ae3ca7752bc3cbca826
curl/curl,https://github.com/curl/curl,e2be568,Stefan Eissing,2025-11-20T09:58:54Z,multi: make max_total_* members size_t  Check size_t conversion on setting these members via CURLMIPT_*. Use members without casting.  Closes #19618,https://github.com/curl/curl/commit/e2be5689744716b63477d2e250b53fcac1f8c3b4
curl/curl,https://github.com/curl/curl,047b36d,Daniel Stenberg,2025-11-21T13:34:31Z,"smb: fix a size check to be overflow safe  In smb_send_message, although it could never actually overflow it might as well be done correctly. Also do the check earlier.  Closes #19640",https://github.com/curl/curl/commit/047b36d7a698c952b7d76ea3ce303a3d58ae637a
curl/curl,https://github.com/curl/curl,6aa8fa3,Stefan Eissing,2025-11-21T12:06:00Z,"apple-sectrust: always ask when `native_ca_store` is in use  When OpenSSL fails to verify the peer certificate, we checked for one specific reason code and did not ask Apple SecTrust for any other failure.  Always ask Apple SecTrust after OpenSSL fails when the `native_ca_store` is enabled. If the user configures a CAfile or CApath, the native store is disabled, so this does not affect use cases where users asks curl to use a specific set of trust anchors.  Do the same for GnuTLS  Fixes #19636 Reported-by: ffath-vo on github Closes #19638",https://github.com/curl/curl/commit/6aa8fa3fdfdb1a0d4d022cc04e478f13e2b6b880
curl/curl,https://github.com/curl/curl,9e6f1c5,Viktor Szakats,2025-11-21T11:43:54Z,"build: add build-level `CURL_DISABLE_TYPECHECK` options  Usage: - autotools: `--disable-typecheck` (or `--enable-typecheck` (default)) - cmake: `-DCURL_DISABLE_TYPECHECK=ON`.  To disable `curl_easy_setopt()`/`curl_easy_getinfo()` type checking with supported (new) gcc and clang compilers. It is useful to improve build performance for the `tests/libtest` target. In particular the CodeQL analyzer may take above an hour to compile with type checking enabled, and disabling it brings it down to seconds. On local machines it may also cut build times in half when build testdeps, depending on platform and compiler.  Other than these cases, we recommend leaving type checking enabled.  Ref: fdacf34aaeac79ad14fa48dcafae24a6de68823d #19632  Also: - GHA/codeql: use it. - test1165: check in `include/curl`. - lib1912: delete stray todo comment. - spelling and comment nits.  Closes #19637",https://github.com/curl/curl/commit/9e6f1c5efb7a70e1f33e467a738f3e3f652f3174
curl/curl,https://github.com/curl/curl,eaa7651,Viktor Szakats,2025-11-17T22:49:15Z,"lib: replace `_tcsncpy`/`wcsncpy`/`wcscpy` with `_s` counterparts (Windows)  Replace: - curl_sspi: macro `_tcsncpy()` with `_tcsncpy_s()`. - curlx/fopen: `wcsncpy()` with `wcsncpy_s()`. - curlx/fopen: `wcscpy()` with `wcscpy_s()`.  Use of the pre-existing functions were safe. This patch aims to use the recommended Windows CRT functions. Handle errors returned by them. Also to avoid the compiler warnings silenced via `_CRT_SECURE_NO_WARNINGS`:  ``` lib/curl_sspi.c(152): warning C4996: 'wcsncpy': This function or variable may be unsafe. Consider using wcsncpy_s instead. To disable deprecation, use _CRT_SECURE_NO_WARNINGS. lib/curlx/fopen.c(161): warning C4996: 'wcsncpy': This function or variable may be unsafe. Consider using wcsncpy_s instead. To disable deprecation, use _CRT_SECURE_NO_WARNINGS. lib/curlx/fopen.c(162): warning C4996: 'wcscpy': This function or variable may be unsafe. Consider using wcscpy_s instead. To disable deprecation, use _CRT_SECURE_NO_WARNINGS. lib/curlx/fopen.c(174): warning C4996: 'wcsncpy': This function or variable may be unsafe. Consider using wcsncpy_s instead. To disable deprecation, use _CRT_SECURE_NO_WARNINGS. lib/curlx/fopen.c(175): warning C4996: 'wcscpy': This function or variable may be unsafe. Consider using wcscpy_s instead. To disable deprecation, use _CRT_SECURE_NO_WARNINGS. ```  Refs: https://learn.microsoft.com/cpp/c-runtime-library/reference/strncpy-strncpy-l-wcsncpy-wcsncpy-l-mbsncpy-mbsncpy-l https://learn.microsoft.com/cpp/c-runtime-library/reference/strncpy-s-strncpy-s-l-wcsncpy-s-wcsncpy-s-l-mbsncpy-s-mbsncpy-s-l https://learn.microsoft.com/cpp/c-runtime-library/security-features-in-the-crt  Cherry-picked from #19581 (in part) Closes #19589",https://github.com/curl/curl/commit/eaa7651374898cef89e5783b0219bdffcc0eb60e
curl/curl,https://github.com/curl/curl,3561f2c,x2018,2025-11-19T15:25:57Z,lib: cleanup some whitespace nits  Closes #19588,https://github.com/curl/curl/commit/3561f2c7bfe8d6c4d535a038b67d5f731fe0012f
curl/curl,https://github.com/curl/curl,dd36dac,Stefan Eissing,2025-11-20T12:17:03Z,"openssl: no verify failf message unless strict  If verifypeer and verifyhost are disabled, to not generate a failf() message for failed verifications.  Fixes #19615 Reported-by: ncaklovic on github Closes #19625",https://github.com/curl/curl/commit/dd36dacd3e1518c1744e233d4aa3ec5a3a1c7bbc
curl/curl,https://github.com/curl/curl,de7ee1c,Daniel Stenberg,2025-11-21T08:19:21Z,"GHA: disable TLS in the linux-old build  There are no supported TLS libraries left in ""stretch"".",https://github.com/curl/curl/commit/de7ee1c96265013c71a367575abbcf97b843fde3
curl/curl,https://github.com/curl/curl,49ab46c,Daniel Stenberg,2025-11-19T14:05:17Z,gtls: drop support for GnuTLS < 3.6.5  Release date 2018-12-01. Has TLS 1.3 support.  Closes #19609,https://github.com/curl/curl/commit/49ab46c9c50511dcc304a92f3a2e458d4a9fa131
curl/curl,https://github.com/curl/curl,529f613,Marc Aldorasi,2025-11-19T16:12:31Z,gnutls: implement CURLOPT_CAINFO_BLOB  This adds support for in-memory CA certs using CURLOPT_CAINFO_BLOB to the GnuTLS backend.  Closes #19612,https://github.com/curl/curl/commit/529f61388f8c235fc250aa466163396a8965b362
curl/curl,https://github.com/curl/curl,fd23d95,Viktor Szakats,2025-11-20T16:39:53Z,"src: move `memdebug.h` to be the last include  `memdebug.h` must be included last within each source. This breaks when including it in a header, which ends up being included in the middle of other headers, and `memdebug.h` also ending up in the middle of includes.  Follow-up to c255d2fdcbf27b4bfd668ae3784bb657449d6889 #19602  Closes #19629",https://github.com/curl/curl/commit/fd23d9505c7263814bfb2963e9c406a53b0295a2
curl/curl,https://github.com/curl/curl,b4220bd,Viktor Szakats,2025-11-21T02:52:04Z,"GHA/checksrc: switch xmllint job to Linux (from macOS)  macOS was chosen because xmllint comes preinstalled, saving the prereq install step. But, macOS's xmllint jobs sometimes doesn't finish in 1m (instead of under 1 second) and gets cancelled, causing flaky failures. Go with Linux and an install phase (of 15s) instead.  Examples: https://github.com/curl/curl/actions/runs/19558021722/job/56004334495  Closes #19634",https://github.com/curl/curl/commit/b4220bde0ba79486c63e60de71037df912134dfb
curl/curl,https://github.com/curl/curl,fdacf34,Viktor Szakats,2025-11-21T01:44:08Z,"GHA/codeql: add tweak to successfully build libtests for CodeQL  Turns out the cause of CodeQL hangs (or probably just extreme long compile) is the header `curl/typecheck-gcc.h`. By accident I noticed that the preprocessed output of libtests.c is 75 MB (megabytes). This is much higher than the amounf of source code hinted, also compared to e.g. units.c or other build targets. The reason for the extreme size is each easy option call pulling in the large checker logic defined in this header.  By compiling with `-DCURL_DISABLE_TYPECHECK`, preprocessed output drops to 2.2 MB (34x), and the libtests target builds without issues.  Also build all tests and examples with the Linux HTTP/3 config, covering 3 more files.  With these, CodeQL C coverage is 893 out of 930 (96%) (was: 645 69%)  Follow-up to 71fc11e6bbf530b90bf6e93a02cb32bdaecc933b #18695 Follow-up to a333fd4411b95fc0c3061b2d675de9287b6123e0 #18557 Follow-up to b4922b1295333dc6679eb1d588ddc2fb6b7fd5b7 #18564  Closes https://github.com/vszakats/curl/pull/11 Closes #19632",https://github.com/curl/curl/commit/fdacf34aaeac79ad14fa48dcafae24a6de68823d
