项目名称,项目URL,提交ID,提交者,提交时间,提交信息,提交链接
curl/curl,https://github.com/curl/curl,7a10f49,Viktor Szakats,2025-11-21T12:46:53Z,badwords: make some words match case-insensitively  Also: - wcurl.md: sync with upstream to pass the badwords check.  Ref: https://github.com/curl/wcurl/commit/11f840cddd840e03b4281cb7408b246c0d09da0f Ref: https://github.com/curl/wcurl/pull/79  Closes #19713,https://github.com/curl/curl/commit/7a10f493222cad24a1625bfb283523e73647a6f0
curl/curl,https://github.com/curl/curl,eae2df8,Viktor Szakats,2025-11-27T12:02:49Z,runtests: fix showing `nghttpx-h3` in the `Env:` log when detected  Ref: #19723 Closes #19728,https://github.com/curl/curl/commit/eae2df837e8927bc43ab5b8994252f8b0b0f097a
curl/curl,https://github.com/curl/curl,71e9920,Viktor Szakats,2025-11-27T13:19:48Z,GHA: add timeouts to mitigate hung brew install step  Ref: https://github.com/curl/curl/actions/runs/19736703410/job/56550251534?pr=19723  Closes #19726,https://github.com/curl/curl/commit/71e9920fcd2683bc63ba1f227307560010ce7deb
curl/curl,https://github.com/curl/curl,bbb9291,Stefan Eissing,2025-11-27T12:18:09Z,curlx_base64_encode: use uint8_t* for input  Change `inputbuff` parameter from `const char *` to `const uint8_t *` to reflect the binary nature of the input bytes. Half the code was casting unsigned char to signed already in calling.  Closes #19722,https://github.com/curl/curl/commit/bbb929112b13643842eb9dbfa060bd83a5b5cf03
curl/curl,https://github.com/curl/curl,fd5a117,Stefan Eissing,2025-11-27T11:50:04Z,ws: use uint8_t  Convert `unsigned char` use to `uint8_t`.  Closes #19721,https://github.com/curl/curl/commit/fd5a117a6715326749b0e0d18362c50d767e8268
curl/curl,https://github.com/curl/curl,c4f29cc,Stefan Eissing,2025-11-26T13:05:46Z,"ip_quadruple/proxy: make port uint16_t  Make `port` member in these struct of type `uint16_t`.  add `uint8_t transport` to `struct ip_quadruple  Define TRNSPRT_NONE as 0. By assigning a valid transport only on a successful connection, it is clear when the ip_quadruple members are valid. Also, for transports not involving ports, the getinfos for `CURLINFO_PRIMARY_PORT` and `CURLINFO_LOCAL_PORT` will now always return -1.  Make all `transport` members and parameters of type `uint8_t`.  Document the return value of `CURLINFO_LOCAL_PORT` and `CURLINFO_PRIMARY_PORT` in this regard. Add tests that writeout stats report ports correctly.  Closes #19708",https://github.com/curl/curl/commit/c4f29cc5081b4b70ba435c64bd8ee81f02b3ceeb
curl/curl,https://github.com/curl/curl,feea968,Stefan Eissing,2025-11-03T12:12:50Z,conncontrol: reuse handling  Add protocol handler flag `PROTOPT_CONN_REUSE` to indicate that the protocol allows reusing connections for other tranfers. Add that to all handlers that support it.  Create connections with `conn->bits.close = FALSE` and remove all the `connkeep()` calls in protocol handlers setup/connect implementations. `PROTOPT_CONN_REUSE` assures that the default behaviour applies at the end of a transfer without need to juggle the close bit.  `conn->bits.close` now serves as an additional indication that a connection cannot be reused. Only protocol handles that allow reuse need to set it to override the default behaviour.  Remove all `connclose()` and `connkeep()` calls from connection filters. Filters should not modify connection flags. They are supposed to run in eyeballing situations where a filter is just one of many determining the outcome.  Fix http response header handling to only honour `Connection: close` for HTTP/1.x versions.  Closes #19333,https://github.com/curl/curl/commit/feea96851230c7a5a11feaffa0a5e4a4d30e5e63
curl/curl,https://github.com/curl/curl,a9e7a02,Stefan Eissing,2025-11-27T09:23:43Z,"vquic: do_sendmsg full init  When passing a `msg_ctrl` to sendmsg() as part of GSO handling, zero the complete array. This fixes any false positives by valgrind that complain about uninitialised memory, even though the kernel only ever accesses the first two bytes.  Reported-by: Aleksei Bavshin Fixes #19714 Closes #19715",https://github.com/curl/curl/commit/a9e7a027ed866b791c12a3c701dc40304f4e00cb
curl/curl,https://github.com/curl/curl,9bb5c05,Stefan Eissing,2025-11-27T11:11:39Z,"ngtcp2+openssl: fix leak of session  Fix return value indicating to OpenSSL if reference to session is kept (it is not), so OpenSSL frees it.  Reported-by: Aleksei Bavshin Fixes #19717 Closes #19718",https://github.com/curl/curl/commit/9bb5c0578b39e5b086b6a9db5c6eb299a0fe1c5c
curl/curl,https://github.com/curl/curl,c273de1,Daniel Stenberg,2025-11-25T15:14:43Z,"test433: verify ""Note: Read config file from...""  Which was added in fc09a2da4ad0595292  Closes #19699",https://github.com/curl/curl/commit/c273de193e6072c4123c4aa95cae316cd728a69f
curl/curl,https://github.com/curl/curl,9ea6f2b,Yedaya Katsman,2025-11-26T13:58:40Z,docs: add rustls to supported backends for CERT and KEY  Followup to 1c8c93ae15c692c547e3238c4f067f76616a53e8  Closes #19709,https://github.com/curl/curl/commit/9ea6f2bc6979addeaaab94f8012ad96ae5abfc83
curl/curl,https://github.com/curl/curl,94ce87c,Stefan Eissing,2025-11-26T11:02:02Z,types: remove curl_int64_t/curl_uint64_t  These types and the definitions surrounding them are no longer needed.  Closes #19706,https://github.com/curl/curl/commit/94ce87c39124d9845aa1e3ce170b9b227ddece89
curl/curl,https://github.com/curl/curl,0b09ad8,Viktor Szakats,2025-11-26T11:56:44Z,examples/multi-uv: simplify passing `uv` struct  Reported-by: st751228051 on github Follow-up to c722346518365c401b572f8dbe5fa6792ba923cd #19538 #19462 Closes #19707,https://github.com/curl/curl/commit/0b09ad8ecbb1e80bc5f621fc012080ab2abf61c4
curl/curl,https://github.com/curl/curl,c722346,BANADDA,2025-11-15T02:08:10Z,"examples/multi-uv: fix invalid req->data access  The on_uv_timeout callback was trying to access req->data as a curl_context pointer, but uv.timeout.data was never initialized, making it always NULL. This rendered the code inside the if(context) block unreachable.  Fixes #19462 Closes #19538",https://github.com/curl/curl/commit/c722346518365c401b572f8dbe5fa6792ba923cd
curl/curl,https://github.com/curl/curl,2acdc4f,Viktor Szakats,2025-11-26T01:03:29Z,autotools: add nettle library detection via pkg-config (for GnuTLS)  Also: - fix to restore full state when gnutls canary function is not found. - fix indentation.  Closes #19703,https://github.com/curl/curl/commit/2acdc4f549ac4aee691ed5782b32a1c5c9f86dbe
curl/curl,https://github.com/curl/curl,0d2bb9c,Daniel Stenberg,2025-11-26T10:01:09Z,"http: fix OOM exit in Curl_http_follow  Spotted by ""strict torture"" tests.  Closes #19705",https://github.com/curl/curl/commit/0d2bb9c7c6d6ccdc48bb0414b80204acbd29f923
curl/curl,https://github.com/curl/curl,cb722b3,Daniel Stenberg,2025-11-26T07:23:04Z,urlapi: handle OOM properly when setting URL  Closes #19704,https://github.com/curl/curl/commit/cb722b32ad163ecdf12b408f2ea86346fe83e199
curl/curl,https://github.com/curl/curl,ea7df8d,Daniel Stenberg,2025-11-25T23:47:04Z,docs: spell it Rustls with a capital R  I believe this is how the project itself uses it.  Closes #19702,https://github.com/curl/curl/commit/ea7df8d07671240536f6ab03eaee5ffb49ddc5f7
curl/curl,https://github.com/curl/curl,4041eea,Viktor Szakats,2025-11-25T01:34:26Z,"GHA/http3-linux: build nettle manually for GnuTLS 3.8.11+  GnuTLS 3.8.11 started requiring a nettle version new enough to be missing from Ubuntu LTS released a year ago. To keep up testing it, build nettle from source. Besides the necessary one time effort this has the downside that nettle updates now need to be done manually a couple of times per year when renovate detects one. (if I got the renovate formula correct to catch the tag format).  Also: - switch the local GnuTLS build to use the release tarball instead of   the Git repo and calling the script `bootstrap`. The script could   potentially download source code using the cleartext `git:` protocol.   It's also downloading lots of content, including a full OpenSSL repo.  Ref: https://github.com/gnutls/gnutls/blob/955f7a7fc223642d1ede6d55f094961cb97bfa68/NEWS#L41-L44 Follow-up to 905b718de3fb9287c7c0037b2737aa395f01ad3c #19642 Follow-up to a439fc0e372c3de7df3b8ae3ca7752bc3cbca826 #19613  Closes #19680",https://github.com/curl/curl/commit/4041eea61edd8cf66c6f85c47a430bb5774f017c
curl/curl,https://github.com/curl/curl,31b1527,Daniel Stenberg,2025-11-25T22:03:33Z,hostip: only store negative response for CURLE_COULDNT_RESOLVE_HOST  Follow-up from ce06fe77710525  This allows us to drop the 'keep_negative' variable completely.  Closes #19701,https://github.com/curl/curl/commit/31b1527c1d78d7d91c60abdd132f0d788ec95cfd
curl/curl,https://github.com/curl/curl,4701a6d,Stefan Eissing,2025-11-25T10:33:38Z,lib: change uint sets to operate on uint32_t  - clarify names and change types - make multi's `mid` a uint32_t - update documentation  Closes #19695,https://github.com/curl/curl/commit/4701a6d2ae9f0b66a0feac4061868e944353449b
curl/curl,https://github.com/curl/curl,bb63518,Stefan Eissing,2025-11-25T12:39:35Z,openssl-quic: use stdint types  Use int64_t and uint64_t directly without needing to cast to curl_int64_t and curl_uint64_t.  Closes #19698,https://github.com/curl/curl/commit/bb63518ba71c3d7bb58e6eb605bb0a5962d7835e
curl/curl,https://github.com/curl/curl,ef4f791,Stefan Eissing,2025-11-25T12:21:25Z,quiche: use stdint types  Use int64_t and uint64_t directly without needing to cast to curl_int64_t and curl_uint64_t.  Closes #19697,https://github.com/curl/curl/commit/ef4f791337cd13da7dd39e1867e7b038ee98f3a5
curl/curl,https://github.com/curl/curl,0f6ad5a,Stefan Eissing,2025-11-25T12:03:04Z,ngtcp2: use stdint types  Use int64_t and uint64_t directly without needing to cast to curl_int64_t and curl_uint64_t.  Closes #19696,https://github.com/curl/curl/commit/0f6ad5ab7d040bf1b9dcc16d12430209079378a6
curl/curl,https://github.com/curl/curl,7e5f379,Stefan Eissing,2025-11-25T09:24:14Z,bufq: use uint8_t  instead of unsigned char  Closes #19690,https://github.com/curl/curl/commit/7e5f379d71b60f35f2a6b24e4bd5cf1935400c13
curl/curl,https://github.com/curl/curl,16b44f6,Stefan Eissing,2025-11-19T10:54:36Z,"multi: simplify admin handle processing  Fold the special connection pool shutdown handling in multi the things the admin handle cares about. Add the admin handle to the 'process' bitset, deduce it from the 'running' count.  The admin handle is the processed like any other transfer, but has a special case in `multi_runsingle()`. Simplifies all other multi processing parts.  Closes #19604",https://github.com/curl/curl/commit/16b44f6a3ad13386a25dfc005794696a69f949b0
curl/curl,https://github.com/curl/curl,208a6ae,Stefan Eissing,2025-11-25T09:00:23Z,"lib: timer stats improvements  * move the TIMER_POSTQUEUE to the time a connection is chosen,   so that TIMER_NAMELOOKUP always happens afterwards * client writer: do not trigger TIMER_STARTTRANSFER on CLIENTWRITE_INFO   as ftp and other pingpong protocols write that before starting anything   that is the tranfer itself * Elimnating debug trancing of ""closed stream/connection - bailing""   as confusing, as connection is not really closed on most cases. * Setting 'data->req.upload_done` correctly, so that no ""abort upload""   is happening at the end of a perfectly fine download. * Adding test cases with up-/download of 0-length files. * pytest: add a ""timeline"" of timer value checks to Resulst in curl.py,   so that this can be used in several test cases, replacing the local   stuff in test_16 * add timeline checks to ftp test cases  Closes #19269",https://github.com/curl/curl/commit/208a6aebf223200293a5f0c1bdc3cced36d5af1f
curl/curl,https://github.com/curl/curl,fc09a2d,Yedaya Katsman,2025-11-23T19:29:46Z,tool: log when loading .curlrc in verbose mode  Inspired by @vszakats in https://github.com/curl/curl/pull/19631#issuecomment-3560803674  Closes #19663,https://github.com/curl/curl/commit/fc09a2da4ad0595292ecabda6f50f5d415b70527
curl/curl,https://github.com/curl/curl,2b0ca15,Stefan Eissing,2025-11-25T10:39:04Z,ratelimit: remove a debug mprintf  Follow-up to 24b36fdd1585ea22e5e  Closes #19694,https://github.com/curl/curl/commit/2b0ca15c49e2f437741603d6de29aaa7a7928d18
curl/curl,https://github.com/curl/curl,4f807db,Viktor Szakats,2025-11-25T09:42:07Z,INTERNALS.md: add more dependency versions and dates  Closes #19691,https://github.com/curl/curl/commit/4f807db155815800fde49c3ef8291a3f7c345429
curl/curl,https://github.com/curl/curl,62683ad,Viktor Szakats,2025-11-25T02:35:40Z,curlx: replace `sprintf` with `snprintf`  To avoid using a deprecated function on Windows.  Also: de-dupe `SNPRINTF` definition in curlx.  Closes #19681,https://github.com/curl/curl/commit/62683ad3f49aeb60ab311cf52aacc5630116418a
curl/curl,https://github.com/curl/curl,74bd3e2,Patrick Monnerat,2025-11-24T13:57:38Z,"slist: constify Curl_slist_append_nodup() string argument  Although finally stored as a non-const pointer, the string is intended to be left unchanged.  This change allows using the function without the need of a cast for const pointers.  Closes #19692",https://github.com/curl/curl/commit/74bd3e2f98b26b283dbdb5af543e0c43e61a6155
curl/curl,https://github.com/curl/curl,92e6782,Patrick Monnerat,2025-11-24T18:50:26Z,"doc: some returned in-memory data may not be altered  Some public prototypes do not declare return values or out parameters as const where they should be. Avoid changing the public interface, but document those values as read-only.  Closes #19692",https://github.com/curl/curl/commit/92e6782d1f0dbf0f011fe01ecc4c17b4109561b2
curl/curl,https://github.com/curl/curl,ba65073,Stefan Eissing,2025-11-25T08:30:34Z,"speedlimit: also reset on send unpausing  The low speedlimit currently counts both up- and download speed accumulated. So, when unpausing upload, also reset the counter.  Closes #19687",https://github.com/curl/curl/commit/ba65073037152555aae279a5ef8eae808e3e675e
curl/curl,https://github.com/curl/curl,6069c34,Daniel Stenberg,2025-11-25T09:14:28Z,tool_doswin: clear pointer when thread takes ownership  Attempt to address #19675 Closes #19689,https://github.com/curl/curl/commit/6069c340b42a2a4d05f5dc76c49cd3e20e09ccb7
curl/curl,https://github.com/curl/curl,b8f8373,Daniel Stenberg,2025-11-25T09:07:30Z,asyn-ares: handle Curl_dnscache_mk_entry() OOM error  To avoid leaking memory.  Follow-up to ce06fe7771052549ff430 Closes #19688,https://github.com/curl/curl/commit/b8f83738c3ab01c214a314981626c86c9ffaca72
curl/curl,https://github.com/curl/curl,d0ad652,Daniel Stenberg,2025-11-25T08:09:50Z,progress: remove two redundant variable checks  The entry condition in the function already exits early if either low_speed_time or low_speed_limit is not set.  Pointed out by CodeSonar  Closes #19686,https://github.com/curl/curl/commit/d0ad652552564cbcf5c2f14869db0add4ff4ac50
curl/curl,https://github.com/curl/curl,729f36e,Daniel Stenberg,2025-11-25T07:53:59Z,sendf: fix uninitialized variable in trace output  Initialize *nread early on.  Pointed out by CodeSonar  Closes #19684,https://github.com/curl/curl/commit/729f36e90fa8927ce85c4f1f7b67724988c35f00
curl/curl,https://github.com/curl/curl,ce06fe7,Daniel Stenberg,2025-11-24T13:00:09Z,hostip: make more functions return CURLcode  - Curl_async_getaddrinfo() always returned NULL so it was pointless.   Return proper curlcode instead to distinguish between errors. Same for   Curl_doh(). - simplify the IP address handling - make Curl_str2addr() function return CURLcode  Closes #19669,https://github.com/curl/curl/commit/ce06fe7771052549ff430c86173b2eaca91f8a9c
curl/curl,https://github.com/curl/curl,a075d1c,Sunny,2025-11-25T07:29:32Z,examples: fix minor typo  Closes #19683,https://github.com/curl/curl/commit/a075d1c0d8684c0151cebf50b5cb64be6505c59d
curl/curl,https://github.com/curl/curl,1e7d0ba,Viktor Szakats,2025-11-18T00:32:43Z,"curlx/fopen: replace open CRT functions their with `_s` counterparts (Windows)  - `_wopen`        -> `_wsopen_s` - `_open`, `open` -> `_sopen_s` - `_wfopen`       -> `_wfopen_s` - `fopen`         -> `fopen_s` - `_wfreopen`     -> `_wfreopen_s` - `freopen`       -> `freopen_s`  For better error handling and for using the CRT functions recommended via warnings suppressed by `_CRT_SECURE_NO_WARNINGS`.  Also: - add missing `freopen_s()` prototype when building with mingw-w64 <5.   https://sourceforge.net/p/mingw-w64/mingw-w64/ci/a5d824654cdc57f6eac1bb581b078986f3eb6856/ - tests/server: replace `open()` in the signal handler with `_sopen_s()`   on Windows. - tests/server: reduce scope of a checksrc exception to a single line. - checksrc: ban replaced functions.  Refs: https://learn.microsoft.com/cpp/c-runtime-library/reference/open-wopen https://learn.microsoft.com/cpp/c-runtime-library/reference/sopen-s-wsopen-s https://learn.microsoft.com/cpp/c-runtime-library/reference/freopen-wfreopen https://learn.microsoft.com/cpp/c-runtime-library/reference/fopen-wfopen https://learn.microsoft.com/cpp/c-runtime-library/reference/fopen-s-wfopen-s https://learn.microsoft.com/cpp/c-runtime-library/reference/freopen-s-wfreopen-s  Closes #19643",https://github.com/curl/curl/commit/1e7d0bafc6d25d98ec72ff419df65fda3cf147a7
curl/curl,https://github.com/curl/curl,ee97c2a,Viktor Szakats,2025-11-24T14:55:17Z,"tests/server: use curlx file open/close functions  Replace: - `open()` with `curlx_open()` (1 call). - `fopen()` with `curlx_fopen()`. - `fclose()` with `curlx_fclose()`.  To centralize interacting with the CRT in preparation for using ""safe"" alternatives on Windows. This also adds long-filename and Unicode support for these operations on Windows.  Keep using `open()` in the signal handler to avoid any issues with calling code not allowed in signal handlers.  Cherry-picked from #19643 Closes #19679",https://github.com/curl/curl/commit/ee97c2a96a07bad19504973df1384b18419a8eac
curl/curl,https://github.com/curl/curl,56bfde6,Viktor Szakats,2025-11-24T22:55:57Z,"INTERNALS.md: add release dates to build dependencies  Also: - delete `roffit`, that's not used anymore.   Follow-up to ea0b575dab86a3c44dd1d547dc500276266aa382 #12753  Follow-up to 92d9dbe4c008646dd467d23dea963fa32e16cf85 #19611  Closes #19677",https://github.com/curl/curl/commit/56bfde6554716f302998a29a192c82bf681a62ee
curl/curl,https://github.com/curl/curl,3887069,Viktor Szakats,2025-11-21T19:36:26Z,"lib: rename internal header `share.h` to `curl_share.h` to avoid collision  Windows CRTs have a `share.h`. Before this patch when trying to `#include <share.h>` it, the compiler picked up curl's internal `lib/share.h` instead. Rename it to avoid this issue.  CRT `share.h` has constants necessary for using safe open CRT functions.  Also rename `lib/share.c` to keep matching the header.  Ref: https://learn.microsoft.com/cpp/c-runtime-library/sharing-constants Ref: 625f2c1644da58b9617479775badea21f125ce6d #16949 #16991 Cherry-picked from #19643 Closes #19676",https://github.com/curl/curl/commit/3887069c661b40e76b053a4867eb565d4761ab3e
curl/curl,https://github.com/curl/curl,56f2479,Daniel Stenberg,2025-11-24T11:46:01Z,"manage: expand the 'libcurl support required' message  Example of old text:   --dns-ipv4-addr requires that libcurl is built to support c-ares.  New version:   For --dns-ipv4-addr to work, it requires that the underlying libcurl is  built to support c-ares.  Closes #19665",https://github.com/curl/curl/commit/56f2479c1433bd4f886295fcdce2459d1333eecf
curl/curl,https://github.com/curl/curl,24b36fd,Stefan Eissing,2025-11-11T13:26:48Z,"ratelimit: redesign  Description of how this works in `docs/internal/RATELIMITS.ms`.  Notable implementation changes: - KEEP_SEND_PAUSE/KEEP_SEND_HOLD and KEEP_RECV_PAUSE/KEEP_RECV_HOLD   no longer exist. Pausing is down via blocked the new rlimits. - KEEP_SEND_TIMED no longer exists. Pausing ""100-continue"" transfers   is done in the new `Curl_http_perform_pollset()` method. - HTTP/2 rate limiting implemented via window updates. When   transfer initiaiting connection has a ratelimit, adjust the   initial window size - HTTP/3 ngtcp2 rate limitin implemnented via ack updates - HTTP/3 quiche does not seem to support this via its API - the default progress-meter has been improved for accuracy   in ""current speed"" results.  pytest speed tests have been improved.  Closes #19384",https://github.com/curl/curl/commit/24b36fdd1585ea22e5e1f00791f1c20423433cde
curl/curl,https://github.com/curl/curl,bfde781,Daniel Stenberg,2025-11-24T22:32:59Z,RELEASE-NOTES: synced,https://github.com/curl/curl/commit/bfde7811213d482789683094510f0680ee0291e4
curl/curl,https://github.com/curl/curl,be4462a,Daniel Stenberg,2025-11-24T17:45:53Z,INTERNALS.md: add brotli and zstd version info  And alpha-sort the dependency list  Closes #19672,https://github.com/curl/curl/commit/be4462a415a96c203be5be9c59d956b24d43f5c2
curl/curl,https://github.com/curl/curl,2b57d41,Viktor Szakats,2025-11-24T18:38:34Z,content_encoding: drop a guard for brotli 1.0.0+ macro  Also add comment with version requirement for the other guard.  Refs: https://github.com/google/brotli/commit/19d86fb9a60aa7034d4981b69a5b656f5b90017e https://github.com/google/brotli/commit/03739d2b113afe60638069c4e1604dc2ac27380d  Ref: #19672 Follow-up to e639d4ca4d794c222dde4680d9ff35053f501042 Closes #19673,https://github.com/curl/curl/commit/2b57d415e5a0d0afceeb90c54b45a1644a4f8a40
curl/curl,https://github.com/curl/curl,2b7515a,Viktor Szakats,2025-11-24T13:51:18Z,tftpd: fix/tidy up `open()` mode flags  - replace 0777 with `S_I*` macros. - fix to not pass invalid flags on Windows.  Follow-up to 537987d8c66aac6ec96cde098ab45525e156b54e #19645  Closes #19671,https://github.com/curl/curl/commit/2b7515ae8e1d448fd6da2fddb74d36c4867cca80
curl/curl,https://github.com/curl/curl,fa1270a,Viktor Szakats,2025-11-24T13:43:49Z,vquic: do not pass invalid mode flags to `open()` (Windows)  Follow-up to 82013066a6149aa906b1fda3f8f1f27bd272a6c2 #19647  Closes #19670,https://github.com/curl/curl/commit/fa1270a0d1c8234929e1d399ff06ef8f31a2b0b9
curl/curl,https://github.com/curl/curl,3696ac4,renovate[bot],2025-11-24T10:43:14Z,GHA: update dependency ngtcp2/nghttp3 to v1.13.1  Closes #19664,https://github.com/curl/curl/commit/3696ac4e29836dd3e5e3b2101d53294846a6ec1b
curl/curl,https://github.com/curl/curl,1eca08a,Viktor Szakats,2025-11-21T14:55:33Z,"curlx/strerr: use `strerror_s()` on Windows  To replace deprecated, unsafe `sys_nerr`, `sys_errlist` global variables with the function suggested by the CRT warning silenced via `_CRT_SECURE_NO_WARNINGS`: ``` lib/curlx/strerr.c(291): warning C4996: '__sys_nerr': This function or variable may be unsafe. Consider using strerror instead. lib/curlx/strerr.c(292): warning C4996: '__sys_errlist': This function or variable may be unsafe. Consider using strerror instead. ``` (where `strerror` in turn suggests `strerror_s`...)  Upside: returns an error and has a Unicode variant. Downaside: happy to return success when passing unrecognized error codes. Work it around by looking for the string ""Unknown error"" returned in such cases and falling back to other methods to retrieve a description.  Refs: https://learn.microsoft.com/cpp/c-runtime-library/errno-doserrno-sys-errlist-and-sys-nerr https://learn.microsoft.com/cpp/c-runtime-library/reference/strerror-s-strerror-s-wcserror-s-wcserror-s  Closes #19646",https://github.com/curl/curl/commit/1eca08a5417740320501448b64e8584de349126c
curl/curl,https://github.com/curl/curl,8201306,Viktor Szakats,2025-11-22T00:42:15Z,file: do not pass invalid mode flags to `open()` on upload (Windows)  Ref: https://learn.microsoft.com/cpp/c-runtime-library/reference/open-wopen  Ref: #19645 Cherry-picked from #19643 Closes #19647,https://github.com/curl/curl/commit/82013066a6149aa906b1fda3f8f1f27bd272a6c2
curl/curl,https://github.com/curl/curl,537987d,Viktor Szakats,2025-11-22T00:20:44Z,"curl_fopen: do not pass invalid mode flags to `open()` on Windows  The safe (`_s`) variants of the Windows `open()` reject these flags, while the classic ones silently accepted them.  Also: - also drop the now unused `stat()` call on Windows. - replace magic number with their equivalent Windows and Unix-specific   `S_*` macros.  Refs: https://learn.microsoft.com/cpp/c-runtime-library/reference/open-wopen https://learn.microsoft.com/cpp/c-runtime-library/reference/fstat-fstat32-fstat64-fstati64-fstat32i64-fstat64i32  Cherry-picked from #19643 Closes #19645",https://github.com/curl/curl/commit/537987d8c66aac6ec96cde098ab45525e156b54e
curl/curl,https://github.com/curl/curl,d037121,Viktor Szakats,2025-11-24T11:49:15Z,"cmake: add support for libbacktrace, fix two build issues  Also: - memdebug: fix symbol collision in unity builds. - memdebug: fix compiler warning by making a variable static.  Follow-up to c77bed81a2e1325ffdebc223c27e3d1355147529 #19657  Closes #19666",https://github.com/curl/curl/commit/d03712169b7a02e3a9b3c3a5c060395ed37b626e
curl/curl,https://github.com/curl/curl,039fb84,Daniel Stenberg,2025-11-24T12:08:37Z,tool_writeout: bail out proper on OOM  Closes #19667,https://github.com/curl/curl/commit/039fb84cb4e05cc899bb00b2c8456677516529c1
curl/curl,https://github.com/curl/curl,c77bed8,Daniel Stenberg,2025-11-18T13:29:09Z,"memdebug: produce stack trace dump with libbacktrace  Enable with ""configure --enable-backtrace"", inserts a backtrace in the memdump log when a torture test limit is reached.  Closes #19657",https://github.com/curl/curl/commit/c77bed81a2e1325ffdebc223c27e3d1355147529
