项目名称,项目URL,提交ID,提交者,提交时间,提交信息,提交链接
flipperdevices/flipperzero-firmware,https://github.com/flipperdevices/flipperzero-firmware,c9ab2b6,WillyJL,2025-12-01T13:01:35Z,Infrared: Fix infrared CLI plugin MissingImports (#4312),https://github.com/flipperdevices/flipperzero-firmware/commit/c9ab2b6827fc4d646e98ad0fc15a264240b58986
flipperdevices/flipperzero-firmware,https://github.com/flipperdevices/flipperzero-firmware,cd79d4f,RebornedBrain,2025-11-25T13:58:10Z,Fix Felica standard loading from nfc file (#4311),https://github.com/flipperdevices/flipperzero-firmware/commit/cd79d4f689857c1cfcef6114f39606c07e180469
flipperdevices/flipperzero-firmware,https://github.com/flipperdevices/flipperzero-firmware,7518dc7,Mykhailo Shevchuk,2025-11-06T19:54:50Z,Returning fix for reading PWD locked MFUL (#4295)  Co-authored-by: hedger <hedger@users.noreply.github.com>,https://github.com/flipperdevices/flipperzero-firmware/commit/7518dc73c285faa3528095874bfefde3c1386cfd
flipperdevices/flipperzero-firmware,https://github.com/flipperdevices/flipperzero-firmware,f4c92dc,Nathan N,2025-11-06T19:34:21Z,Fix MIFARE Plus SL1 sector overrun issue in state machine (#4288)  Co-authored-by: hedger <hedger@users.noreply.github.com>,https://github.com/flipperdevices/flipperzero-firmware/commit/f4c92dcd76d9c29e184d245cb493d0aa86809c40
flipperdevices/flipperzero-firmware,https://github.com/flipperdevices/flipperzero-firmware,c873eb5,Nathan N,2025-11-06T19:05:16Z,Fix Ultralight EV1 regression (#4287)  * Fix EV1 regression introduced in e7634d7  * ./fbt format  ---------  Co-authored-by: hedger <hedger@users.noreply.github.com> Co-authored-by: hedger <hedger@nanode.su>,https://github.com/flipperdevices/flipperzero-firmware/commit/c873eb5e3692c18369e732390c280288e2eae3cc
flipperdevices/flipperzero-firmware,https://github.com/flipperdevices/flipperzero-firmware,a42e30f,Zinong Li,2025-11-06T18:45:52Z,"NFC FeliCa Minor Fix: `FelicaPollerEventType` should only be `Incomplete` if the tag is FeliCa Lite (#4279)  * poller read is only incomp if in Lite workflow  * another small fix for the ""255/28 pages read"" bug  ---------  Co-authored-by: hedger <hedger@users.noreply.github.com>",https://github.com/flipperdevices/flipperzero-firmware/commit/a42e30f394b809ad3df10586fc3148193f37cc41
flipperdevices/flipperzero-firmware,https://github.com/flipperdevices/flipperzero-firmware,6d93a90,Zinong Li,2025-11-06T18:37:33Z,NFC lib: Expose `nfc_common.h` (#4283)  * expose nfc_common.h  * Update api_symbols.csv  ---------  Co-authored-by: hedger <hedger@users.noreply.github.com>,https://github.com/flipperdevices/flipperzero-firmware/commit/6d93a90a0a94a14674bda691e850c7d1f3f9e769
flipperdevices/flipperzero-firmware,https://github.com/flipperdevices/flipperzero-firmware,6c83a67,Zinong Li,2025-11-06T18:30:02Z,"NFC FeliCa Improvement: Dump All Systems (#4293)  * polling system code done  * select service done  * select system fixes. works fine now  * clean up select sys by idx  * reading, saving, loading done. render wrong  * render first layer works  * render fixed  * fix Lite Render triage  * regression Lite rendering  * sync API with 1.40 release  * clean up and lint  ---------  Co-authored-by: hedger <hedger@users.noreply.github.com>",https://github.com/flipperdevices/flipperzero-firmware/commit/6c83a67173858cda38ed66fef0d7c197d5afac2e
flipperdevices/flipperzero-firmware,https://github.com/flipperdevices/flipperzero-firmware,b54d630,hedger,2025-11-06T16:40:18Z,lib: infrared: fixed doxygen declarations to match implementation (#4305),https://github.com/flipperdevices/flipperzero-firmware/commit/b54d63037b1764268cf16191d79dadc9e4fcd089
flipperdevices/flipperzero-firmware,https://github.com/flipperdevices/flipperzero-firmware,6a5ae6c,MMX,2025-11-06T16:23:59Z,"Infrared Universal remote DBs unit test & move infrared_signal / infrared_brute_force into lib (#4284)  * make infrared db unit tests  * fix the tests, no assets are in asset folder oh no  * fix formate  * ship ir app along with unit_test pkg  * libify ir signal and bruteforce parts  * small cleanup  * api: removed infrared methods (you can link with the lib if needed), unit_tests, infrared: adjusted to link with ir lib; api: added `__aeabi_f2d`  ---------  Co-authored-by: hedger <hedger@users.noreply.github.com> Co-authored-by: hedger <hedger@nanode.su>",https://github.com/flipperdevices/flipperzero-firmware/commit/6a5ae6cc0dee6ade5803905ec75d831be5ee5102
flipperdevices/flipperzero-firmware,https://github.com/flipperdevices/flipperzero-firmware,67b906e,an5t,2025-11-06T15:31:17Z,github: fail submit_sdk on catalog api error (#4294)  Co-authored-by: hedger <hedger@users.noreply.github.com>,https://github.com/flipperdevices/flipperzero-firmware/commit/67b906e6ba8a09aee1cf6a0230e5879aa1dd0a7d
flipperdevices/flipperzero-firmware,https://github.com/flipperdevices/flipperzero-firmware,772c944,Alexey Zakharov,2025-11-06T13:21:44Z,"Devboard docs update (#4301)  Wi-Fi devboard pinout added, updated devboard hardware image, fixed the schematics link, and corrected typos.  Co-authored-by: hedger <hedger@users.noreply.github.com>",https://github.com/flipperdevices/flipperzero-firmware/commit/772c944163b3d82b2aebba1b3e497080b6c74578
flipperdevices/flipperzero-firmware,https://github.com/flipperdevices/flipperzero-firmware,468cc45,RebornedBrain,2025-10-08T13:26:48Z,Fix wrbl command tooltip (#4291)  Co-authored-by: hedger <hedger@users.noreply.github.com>,https://github.com/flipperdevices/flipperzero-firmware/commit/468cc45f90757b15a05ae804699a29b45dd5246f
flipperdevices/flipperzero-firmware,https://github.com/flipperdevices/flipperzero-firmware,8ae710e,WillyJL,2025-10-08T11:13:36Z,VSCode: Reduce file watcher resource usage (#4292),https://github.com/flipperdevices/flipperzero-firmware/commit/8ae710edecc2538ef5137c132d9123794331eda5
flipperdevices/flipperzero-firmware,https://github.com/flipperdevices/flipperzero-firmware,85b6b2b,Zinong Li,2025-10-01T14:54:08Z,"NFC FeliCa: Service Directory Traverse + Dump All Unencrypted-Readable Services' Blocks (#4254)  * SimpleArray attached to FelicaData  * tx rx done. response parsing done (in log)  * dynamic vector as buffer. rendering begin  * On screen render for directory tree  * flags in render to indicate is_public_readable  * beautify render flags  * format  * offload dynamic vector into individual files  * saving. exposed dir tree writing for double use  * save: additional formatting  * save: clean up and some additional notes  * load done  * delete unnecessary debug log  * Load: safer way to handle backward compatibility  `parsed` being true is only contingent on whether the header (device type, UID, etc) are correctly read. The detailed data can be absent if saved from previous versions.  Side effects: 1. The data format version number must not increment. 2. Newer sections of dumps must be appended in the end of the file.  * format  * handle block reading according to IC type  Old version was aimed for FeliCa Lite dumping, which doesn't apply to FeliCa standard. Thus they need to be diverged in the poller run workflow.  * read block content works. rendering begin  * Render Refactor: dir & dump view from submenu  * Render: show IC type name  * IC parsing function cleanup  * Revert ""IC parsing function cleanup""  This reverts commit ee3f7bf125b54b10d238b0aeb657ba15f27f93ba.  * Load: Standard dump. Fully backward compatible  * format  * sync API version  * format saved file  * delete unused variable  * clean ups  * IC type addition  * correction  * beautify attribute parsing  * correction  * Lite save: delete extra line  * correction: FeliCa link in Lite-S mode  * format  * Save: simplify printing  * update IC type parsing  * conform to api standard: const resp ptr to ptr  also slightly faster and more readable block dump loop  * disambiguate workflow type vs ic type  It was too confusing to have the ic name string telling you one thing and ic_type enum saying the other. Might as well use better naming to indicate the use case for the two things  * beautify on device render  * reject dynamic_vector, embrace m-array  * lint  * use full variable name  * partial fix: poller context's data proper init  * edit unit test dump IC code  and a small bug fix for the Lite auth workflow  * unit test felica dump PMm correction  * Fixes for static analysis warnings  ---------  Co-authored-by: hedger <hedger@nanode.su> Co-authored-by: hedger <hedger@users.noreply.github.com>",https://github.com/flipperdevices/flipperzero-firmware/commit/85b6b2b8966552a3cd49bf29eae7b0da771dcfa8
flipperdevices/flipperzero-firmware,https://github.com/flipperdevices/flipperzero-firmware,fad487d,MMX,2025-10-01T14:05:50Z,"SubGHz: Added 9 new protocols, fixes to existing protocols (#4255)  * Fix Typos  * Tune decoders  * Better parsing, show more data in existing protocols  * Add new protocols  * Update keeloqs  * Add unit tests & raws  * Add honeywell unittest  * Comment until better solution is found  Adding GAPs to be sent first to make signal better suitable for decoder (decoding from only one signal sample) does nothing, needs something else TODO: Fix encoders?  * suppressed missing issue warning  * subghz: re-enabled failing encoder tests  * Fix two?  3 left  * properly do gangqi and marantec for unit test and real use  * fix unit tests now  * fix possible memory leak  * reset decoder step too  * subghz: extra encoder safety; report random signal test results on failure  * unit_tests: subghz: renamed test file for consistency  * subghz: more explicit buffer position resets  * Fix gangqi samples  ---------  Co-authored-by: hedger <hedger@users.noreply.github.com> Co-authored-by: hedger <hedger@nanode.su>",https://github.com/flipperdevices/flipperzero-firmware/commit/fad487df0ebbf7b7ab41b70e7240a9299b7c6230
flipperdevices/flipperzero-firmware,https://github.com/flipperdevices/flipperzero-firmware,df4bf69,Null,2025-09-30T11:39:58Z,IR: Add Onn Roku TV control to universal remote (#4201)  * added ONN brand roku TV to ir lib  * pvs: fixed warning  ---------  Co-authored-by: hedger <hedger@users.noreply.github.com> Co-authored-by: hedger <hedger@nanode.su>,https://github.com/flipperdevices/flipperzero-firmware/commit/df4bf6981857bcafb0c755d6818da9ab6688b0be
flipperdevices/flipperzero-firmware,https://github.com/flipperdevices/flipperzero-firmware,1e0f3a6,Ivan Barsukov,2025-09-29T17:53:10Z,cli: Buzzer command (#4006)  * Add args_read_float_and_trim function  * Add args_read_duration function  * Add notes_frequency_from_name function  * Add cli_sleep function and sleep CLI command  * Update CLI top command to use cli_sleep  * Add buzzer CLI command  * toolbox: make args_read_duration less convoluted  * notification: make notification_messages_notes_frequency_from_name less convoluted  * unit_tests: better float checking  * fix formatting and f18  ---------  Co-authored-by: Anna Antonenko <portasynthinca3@gmail.com> Co-authored-by: hedger <hedger@nanode.su>,https://github.com/flipperdevices/flipperzero-firmware/commit/1e0f3a606f654bd9047b271aadaa6d028199100c
flipperdevices/flipperzero-firmware,https://github.com/flipperdevices/flipperzero-firmware,f78a832,Leptopt1los,2025-09-29T17:13:33Z,tm01x dallas write support (#4230)  Co-authored-by: hedger <hedger@nanode.su>,https://github.com/flipperdevices/flipperzero-firmware/commit/f78a8328d190bd651d7065038697e604841d7316
flipperdevices/flipperzero-firmware,https://github.com/flipperdevices/flipperzero-firmware,e7634d7,Nathan N,2025-09-29T17:05:06Z,"NFC: Ultralight C App Key Management, Dictionary Attack (#4271)  * Upstream Ultralight C dictionary attack (squashed)  * linter: formatting  * unit_tests: nfc: split nfc data to named var  * Fix mf_ultralight_poller_sync_read_card  * linter: suppressed warnings on TODOs  ---------  Co-authored-by: hedger <hedger@users.noreply.github.com> Co-authored-by: hedger <hedger@nanode.su>",https://github.com/flipperdevices/flipperzero-firmware/commit/e7634d7563cd807caf5f522806e83c1d7393340b
flipperdevices/flipperzero-firmware,https://github.com/flipperdevices/flipperzero-firmware,eea5349,RebornedBrain,2025-09-29T10:34:49Z,"[FL-3569] NFC CLI commands (#4158)  * feat: FuriThread stdin  * ci: fix f18  * feat: stdio callback context  * feat: FuriPipe  * POTENTIALLY EXPLOSIVE pipe welding  * fix: non-explosive welding  * Revert welding  * docs: furi_pipe  * feat: pipe event loop integration  * update f18 sdk  * f18  * docs: make doxygen happy  * fix: event loop not triggering when pipe attached to stdio  * fix: partial stdout in pipe  * allow simultaneous in and out subscription in event loop  * feat: vcp i/o  * feat: cli ansi stuffs and history  * feat: more line editing  * working but slow cli rewrite  * restore previous speed after 4 days of debugging 🥲  * fix: cli_app_should_stop  * fix: cli and event_loop memory leaks  * style: remove commented out code  * ci: fix pvs warnings  * fix: unit tests, event_loop crash  * ci: fix build  * ci: silence pvs warning  * feat: cli gpio  * ci: fix formatting  * Fix memory leak during event loop unsubscription  * Event better memory leak fix  * feat: cli completions  * Merge remote-tracking branch 'origin/dev' into portasynthinca3/3928-cli-threads  * merge fixups  * temporarily exclude speaker_debug app  * pvs and unit tests fixups  * feat: commands in fals  * move commands out of flash, code cleanup  * ci: fix errors  * fix: run commands in buffer when stopping session  * speedup cli file transfer  * fix f18  * separate cli_shell into modules  * fix pvs warning  * fix qflipper refusing to connect  * remove temp debug logs  * remove erroneous conclusion  * Fix memory leak during event loop unsubscription  * Event better memory leak fix  * unit test for the fix  * improve thread stdio callback signatures  * pipe stdout timeout  * update api symbols  * fix f18, formatting  * fix pvs warnings  * increase stack size, hope to fix unit tests  * cli completions  * more key combos  * commands in fals  * move commands out of flash  * ci: fix errors  * speedup cli file transfer  * merge fixups  * fix f18  * cli: revert flag changes  * cli: fix formatting  * cli, fbt: loopback perf benchmark  * thread, event_loop: subscribing to thread flags  * cli: signal internal events using thread flags, improve performance  * fix f18, formatting  * event_loop: fix crash  * storage_cli: increase write_chunk buffer size again  * cli: explanation for order=0  * thread, event_loop: thread flags callback refactor  * cli: increase stack size  * cli: rename cli_app_should_stop -> cli_is_pipe_broken_or_is_etx_next_char  * cli: use plain array instead of mlib for history  * cli: prepend file name to static fns  * cli: fix formatting  * cli_shell: increase stack size  * Now cli_shell can be customized with another motd and another command set  * Added custom motd callback definition  * Now user can alloc and free his own cli command set  * cli_vcp can now restart shell with another command set  * Help command modified to show available commands from different command sets  * Api adjustement  * Reworked nfc_cli to start new shell with another command set  * Revert custom shell changes from vcp  * Custom motd callback moved to cli_shell  * Cli Shell now can be started from ongoing cli command  * Help command moved to a separate function so it can be used for custom shell  * Now nfc command spawns separate shell for further nfc commands  * cli_shell: give up pipe to command thread  * fix formatting  * cli_shell: separate into toolbox  * speaker_debug: fix  * fix: format  * Merge branch 'portasynthinca3/3928-3929-cli-fals-threads' into portasynthinca3/3965-cli_shell-toolbox  * fix merge  * fix. merge.  * fix formatting  * fix: cmd flags  * fix: formatting  * Added basic command descriptor structs and macros  * Basic nfc commands definitions added  * Nfc cli commands collection and functions added  * Raw skeleton of nfc cli processor added  * cli: increase default stack depth  * New callbacks for ctx alloc / free added  * nfc_cli moved to cli folder  * Some more logic for command processor  * Scanner command no works via command_processor  * plugin manifest adj  * Argument descriptors were removed, now only keys left  * Some helper command function implemented  * Command processor logic now mostly works  * Added all parsers and dummy implementation of raw cmd  * Now processor checks duplicated keys and treat them as errors  * Some renamings  * Arguments processing moved to separate function  * Now command processor can reuse context of previuos command for the next one if it's allowed  * can_reuse callback added for checking if context can be reused  * command processor is now freed on nfc cli exit  * Some cleanups  * First working version of raw command  * Now input data are placed directly to bit buffer  * Added tag  * Introduced request/response structs  * Moved raw command to a separate folder  * Moved some common types to header  * Added protocol specific handlers for iso14a and felica  * Opened felica crc header for referencing  * Added handler for iso14443_3b  * Opened iso15693_3_poller for referencing  * Added iso15693_3 handler for raw command  * NfcCliRawError enum introduced for response result  * Refactored handlers implementation  * Formatting functions now added as helpers  * New printing result logic  * Not present error value added to enum  * Timeout added to raw command  * Command processor now supports multivalue keys  * Apdu command implementation added  * NfcScanner moved to helpers and command now uses it  * Helper now can format protocol names  * Dump command added  * Added some more functions to scanner helper  * Dump main logic simplified  * Dump handlers moved to protocols folder  * Protocol parser added to simplify searching protocol by name  * Protocol and key arguments added to dump command  * Cleanups  * Apdu now parses protocol using helper parser  * Raw now parses protocol using helper parser  * Wrong naming fix  * Emulate command added to cli  * Description added to action descriptor and command macros  * Description field added to all commands  * Removed unnecessary enum for commands  * Added functions for formatting command and action info  * Proper error messages and help added  * Fix for unsupported single action command  * Function renamed to more appropriate  * Field command moved to all other commands  * Cleanups  * Nfc commands modified with new cli shell  * Removed previous nfc_cli.c after merge  * Removed nfc_cli.h header  * Some renamings and cleanups  * Some comments and instructions added  * Some comments and instructions added  * TODOs removed  * Fix for missing parse callback  * Added not implemented dummy for mfu actions, for now  * Fix name mismatch  * Remove unneeded header  * Mfu command moved to separate folder, also raw info action logic added  * Dictionary with id/vendors added to assets. It is used by nfc_cli_mfu_info_get_vendor function  * One more unneeded header removed  * Moved mfu info action to a separate file  * Info action now uses sync mfu poller  * mfu rdbl action added  * wrbl action added for mfu command  * Some formatting for rdbl command  * Function for formatting mfu errors added  * All mfu actions now show errors in the same way  * Fix error with sync poller. Previously when read failed function returned ErrorNone, now it processes iso14a error to get proper value  * Make PVS happy  * Nfc cli now doesn't start if desktop app is running  * Make action description look more common  * Scanner now has -t key and can show detected protocol hierarchies  * Apdu now checks max input payload data  * Proper format  * Proper error handling added to dump command  * Timeout key added dump command  * Fix merge issue  * formatting  * Pragma pack replaced with FURI_PACKED  * Fix felica memory leak  ---------  Co-authored-by: Anna Antonenko <portasynthinca3@gmail.com> Co-authored-by: Georgii Surkov <georgii.surkov@outlook.com> Co-authored-by: あく <alleteam@gmail.com> Co-authored-by: hedger <hedger@users.noreply.github.com> Co-authored-by: hedger <hedger@nanode.su>",https://github.com/flipperdevices/flipperzero-firmware/commit/eea53491de6180710438ab7c19e84c4f98564329
flipperdevices/flipperzero-firmware,https://github.com/flipperdevices/flipperzero-firmware,2ef556d,Axum,2025-09-25T18:05:29Z,Update demo_windows.txt (#4211)  Fix for newer version of ai enabled Windows Notepad not able to keep up with default fast input text.  Co-authored-by: hedger <hedger@users.noreply.github.com>,https://github.com/flipperdevices/flipperzero-firmware/commit/2ef556d45646a406066fdbefe7f1163d03cb1d5b
flipperdevices/flipperzero-firmware,https://github.com/flipperdevices/flipperzero-firmware,8c0c7f1,Zinong Li,2025-09-25T17:22:56Z,LFRFID: Show ISO-3166 Country Names For Pet Chips (#4091)  * Country list header and printf  * off load country list to asset  * lint  * Field specific getters  * check string length before cutting  * lfrfid: minor iso3166 cleanup  ---------  Co-authored-by: hedger <hedger@users.noreply.github.com> Co-authored-by: hedger <hedger@nanode.su>,https://github.com/flipperdevices/flipperzero-firmware/commit/8c0c7f1bb9c4f7f5ed75989bfd244cab52b44b06
flipperdevices/flipperzero-firmware,https://github.com/flipperdevices/flipperzero-firmware,013c5ff,WillyJL,2025-09-25T14:34:06Z,"BadUSB: Fix case sensitive key combos, fix modifiers in HOLD/RELEASE (#4216)  * BadUSB: Fix key combos main keys being case sensitive  * BadUSB: Fix modifier keys with HOLD/RELEASE commands  ---------  Co-authored-by: hedger <hedger@users.noreply.github.com>",https://github.com/flipperdevices/flipperzero-firmware/commit/013c5ffa52e5c78f018c820f2e77a984cc1d26a9
flipperdevices/flipperzero-firmware,https://github.com/flipperdevices/flipperzero-firmware,d17fd8e,Aerosnail,2025-09-25T12:15:43Z,SubGhz: fix TIM17 config not applied immediately (#4205)  Co-authored-by: hedger <hedger@users.noreply.github.com>,https://github.com/flipperdevices/flipperzero-firmware/commit/d17fd8ed7f63fdb424c4afd0c0a2ed07875e8154
flipperdevices/flipperzero-firmware,https://github.com/flipperdevices/flipperzero-firmware,d036062,Anna Antonenko,2025-09-24T19:24:28Z,"[FL-3925] JS views finished (#4155)  * js: value destructuring and tests  * js: temporary fix to see size impact  * js_val: reduce code size 1  * i may be stupid.  * test: js_value args  * Revert ""js: temporary fix to see size impact""  This reverts commit f51d726dbafc4300d3552020de1c3b8f9ecd3ac1.  * pvs: silence warnings  * style: formatting  * pvs: silence warnings?  * pvs: silence warnings??  * js_value: redesign declaration types for less code  * js: temporary fix to see size impact  * style: formatting  * pvs: fix helpful warnings  * js_value: reduce .rodata size  * pvs: fix helpful warning  * js_value: reduce code size 1  * fix build error  * style: format  * Revert ""js: temporary fix to see size impact""  This reverts commit d6a46f01794132e882e03fd273dec24386a4f8ba.  * style: format  * js: move to new arg parser  * style: format  * feat: all js views done  * js, toolbox: generalize string owning  * toolbox: silence pvs warning  ---------  Co-authored-by: hedger <hedger@nanode.su> Co-authored-by: hedger <hedger@users.noreply.github.com>",https://github.com/flipperdevices/flipperzero-firmware/commit/d0360625d6e1344eb87c80cd47f699717721f9ec
flipperdevices/flipperzero-firmware,https://github.com/flipperdevices/flipperzero-firmware,0d5beed,hedger,2025-09-24T18:36:45Z,BLE: improved pairing security (#4240)  * ble: use unique root security keys for new pairings after pairing reset; added migrations for existing pairing data; unit_tests: added migration tests  * bt: lower logging level  * hal: bt: updated doxygen strings  * hal: ble: Added checks for root_keys ptr  * service: ble: bt_keys_storage minor cleanup,https://github.com/flipperdevices/flipperzero-firmware/commit/0d5beedb012f1a676b48106c7a21996d83906081
flipperdevices/flipperzero-firmware,https://github.com/flipperdevices/flipperzero-firmware,30077dd,MMX,2025-09-24T17:00:39Z,Fix PVS warnings (#4277)  * Fixing PVS warns  * pvs: additional fixes  ---------  Co-authored-by: hedger <hedger@nanode.su>,https://github.com/flipperdevices/flipperzero-firmware/commit/30077dd512deb6e0c8033025e4413e755507296e
flipperdevices/flipperzero-firmware,https://github.com/flipperdevices/flipperzero-firmware,5c54be4,Alexander Bays,2025-09-24T15:45:40Z,Infrared: Add text scroll to remote buttons (#4210)  * Infrared: Add text scroll to universal remote buttons  Replaces center aligned text in the infrared universal remote with scrollable text if wider than the button and is cut off. Allows long descriptive button functions to be seen in some remotes.  * linter fixes  ---------  Co-authored-by: hedger <hedger@users.noreply.github.com> Co-authored-by: hedger <hedger@nanode.su>,https://github.com/flipperdevices/flipperzero-firmware/commit/5c54be4d9c241b1244da8487944f7b13c96bae95
flipperdevices/flipperzero-firmware,https://github.com/flipperdevices/flipperzero-firmware,973fb26,minchogaydarov,2025-09-24T15:23:01Z,Add Daikin FTXN25LV1B9 and Toyotomi KTN22-12R32 (#4232)  Co-authored-by: hedger <hedger@users.noreply.github.com>,https://github.com/flipperdevices/flipperzero-firmware/commit/973fb26f575b70083f328bfc56e409d15a972fd0
