项目名称,项目URL,提交ID,提交者,提交时间,提交信息,提交链接
iovisor/bcc,https://github.com/iovisor/bcc,7da5916,Jerome Marchand,2025-11-27T13:53:16Z,libbpf-tools/cpufreq: Print a more informative message when CPU Frequency Scaling isn't available  The cpufreq tool relies on CPU Frequency Scaling. Display a more informative message to the user when the feature isn't available than just complaining about a missing sysfs file.  Signed-off-by: Jerome Marchand <jmarchan@redhat.com>,https://github.com/iovisor/bcc/commit/7da5916622dc3a581e4c4adc3003e588657f66fa
iovisor/bcc,https://github.com/iovisor/bcc,380ee01,Jian Zhao,2025-11-12T07:21:27Z,"tools/offwaketime: Add raw tracepoint support to reduce overhead  This patch adds support for raw tracepoints in offwaketime tool to reduce overhead compared to kprobes. Raw tracepoints have lower overhead because they don't require function entry/exit instrumentation.  The implementation: - Adds RAW_TRACEPOINT_PROBE handlers for sched_switch and sched_wakeup - Creates kprobe wrapper functions for backward compatibility - Automatically selects raw tracepoints when supported, falls back to   kprobes otherwise - Refactors oncpu() function to accept both prev and next task_struct   parameters for raw tracepoint compatibility  This follows the same pattern used in other BCC tools like wakeuptime.py and runqlat.py.  Signed-off-by: Jack Zhao <jackjzhao@tencent.com>",https://github.com/iovisor/bcc/commit/380ee018bbd04e0300c811bebd88c84da59f715f
iovisor/bcc,https://github.com/iovisor/bcc,9691c56,xixiliguo,2025-11-08T16:12:24Z,Add support for fuse to fsdist and fsslower tools,https://github.com/iovisor/bcc/commit/9691c56891fb833351d3cfe69bda4a57076c3b62
iovisor/bcc,https://github.com/iovisor/bcc,fb8910a,Jerome Marchand,2025-10-09T10:23:53Z,"tools/javaobjnew: Use MIN macro instead of min function  The function min() is called among the arguments of bpf_probe_read_user(). Depending on kernel version, the expansion of the macro may emmit a fake function that prevent the compilation of the BPF code.  Replace the min() function by the MIN() macro to solve the issue. This is safe since both members of the comparison are unsigned integer.  Solves the following error: /virtual/main.c:48:36: error: cannot call non-static helper function    48 |     bpf_probe_read_user(&key.name, min(sizeof(key.name), (size_t)length), (void *)classptr);       |                                    ^ include/linux/minmax.h:129:19: note: expanded from macro 'min'   129 | #define min(x, y)       __careful_cmp(min, x, y)       |                         ^ include/linux/minmax.h:105:2: note: expanded from macro '__careful_cmp'   105 |         __careful_cmp_once(op, x, y, __UNIQUE_ID(x_), __UNIQUE_ID(y_))       |         ^ include/linux/minmax.h:100:2: note: expanded from macro '__careful_cmp_once'   100 |         BUILD_BUG_ON_MSG(!__types_ok(x,y,ux,uy),        \       |         ^ note: (skipping 2 expansions in backtrace; use -fmacro-backtrace-limit=0 to see all) include/linux/compiler_types.h:418:2: note: expanded from macro '_compiletime_assert'   418 |         __compiletime_assert(condition, msg, prefix, suffix)       |         ^ include/linux/compiler_types.h:411:4: note: expanded from macro '__compiletime_assert'   411 |                         prefix ## suffix();                             \       |                         ^ <scratch space>:91:1: note: expanded from here    91 | __compiletime_assert_317       | ^ 1 error generated. Traceback (most recent call last):   File ""/usr/share/bcc/tools/lib/uobjnew"", line 178, in <module>     bpf = BPF(text=program, usdt_contexts=[usdt])   File ""/usr/lib/python3.9/site-packages/bcc/__init__.py"", line 507, in __init__     raise Exception(""Failed to compile BPF module %s"" % (src_file or ""<text>"")) Exception: Failed to compile BPF module <text>  Signed-off-by: Jerome Marchand <jmarchan@redhat.com>",https://github.com/iovisor/bcc/commit/fb8910a8bc6e0bf6de8351318309e8638818a9db
iovisor/bcc,https://github.com/iovisor/bcc,c351210,Hoyeon Lee,2025-10-23T05:08:54Z,"tests: add coverage for versioned SONAME resolution  Add tests for bcc_procutils_which_so{_in_process}() to verify correct behavior when resolving versioned SONAME fragments.  Use library with long-stable SONAME version (libc.so.6), which have remained unchanged for over a decade and ensure deterministic results across systems.  Signed-off-by: Hoyeon Lee <hoyeon.lee@suse.com>",https://github.com/iovisor/bcc/commit/c3512104c23baff0385f9d45999ac4c09378a635
iovisor/bcc,https://github.com/iovisor/bcc,beb1fe4,Hoyeon Lee,2025-10-23T05:01:23Z,"cc: support versioned SONAME in shared library resolution  bcc_procutils_which_so() and related helpers previously handled only short library names (e.g. ""ssl""), constructing ""lib%s.so"" and selecting the first cache entry from /etc/ld.so.cache.  This change makes to recognize versioned SONAME fragments that contain "".so.x"" (e.g. ""ssl.so.3.5.3"", ""crypto.so.3""), treating such names as exact matches instead of appending another "".so"". This enables correct resolution of versioned libraries (e.g. libssl.so.3 vs libssl.so.59) while maintaining compatibility with existing short-name lookups.  This improves correctness on systems where multiple SONAME variants coexist in the cache (e.g. OpenSSL vs LibreSSL).  Related: #5412  Signed-off-by: Hoyeon Lee <hoyeon.lee@suse.com>",https://github.com/iovisor/bcc/commit/beb1fe40e1183a9068c93640e4687342d822c4e3
iovisor/bcc,https://github.com/iovisor/bcc,c208d0e,Jerome Marchand,2025-10-07T14:58:04Z,tools/tcpaccept: Fix tcpaccept on recent kernel  The tcpaccept use the relative offset of gso_max_segs and sk_lingertime_offset to check whether sk_protocol is its own field of part of a bitfield and find it's location. This is not very robust.  Use BPF.kernel_struct_has_field() to find out whether it's its own field and revert to the old workaround if it's part of a bitfield or BTF is unavailable.  Closes: #5316  Signed-off-by: Jerome Marchand <jmarchan@redhat.com>,https://github.com/iovisor/bcc/commit/c208d0e67ff8ee7ae88885d0eedb82abe6824934
iovisor/bcc,https://github.com/iovisor/bcc,1cc15c3,Jerome Marchand,2025-10-07T12:05:56Z,tools: Don't use the old bpf_probe_read() helper.  The old bpf_probe_read() helper doesn't work on s390 arch. Use bpf_probe_read_user/kernel() instead.  Signed-off-by: Jerome Marchand <jmarchan@redhat.com>,https://github.com/iovisor/bcc/commit/1cc15c3db556d2f61d0bc7cd8aedeb245ef532a1
iovisor/bcc,https://github.com/iovisor/bcc,b63d7e3,Stefan Walter,2025-10-11T08:35:41Z,re-generate syscall list (add file_getattr / file_setattr),https://github.com/iovisor/bcc/commit/b63d7e38e8a0f6339fbd57f3a1ae7297e1993d92
iovisor/bcc,https://github.com/iovisor/bcc,b3f4d6d,Jerome Marchand,2025-10-07T13:32:36Z,"libbpf-tools/javagc: Include usdt.bpf.h header  Include usdt.bpf.h header to javagc.bpf.c.  Fixes the following error: libbpf: usdt: failed to find USDT support BPF maps, did you forget to include bpf/usdt.bpf.h? attach usdt mem__pool__gc__begin failed: No such process  Signed-off-by: Jerome Marchand <jmarchan@redhat.com>",https://github.com/iovisor/bcc/commit/b3f4d6d2fc421952e8115fcf70f2551e6791f7ef
iovisor/bcc,https://github.com/iovisor/bcc,212540c,Aiden Grossman,2025-10-14T23:54:09Z,Avoid using deprecated string triple TargetRegistry overloads (#5401)  These functions calls are deprecated and will most likely be removed in LLVM version 23.,https://github.com/iovisor/bcc/commit/212540ca898fc220f848acadafa6f1b415d909ae
iovisor/bcc,https://github.com/iovisor/bcc,e58d680,Hoyeon Lee,2025-09-17T15:23:44Z,"tools: return error code on invalid options  Many tools were exiting with code 0 when given invalid or conflicting options (e.g. mutually exclusive arguments, zero intervals). This patch updates those cases to exit(1), ensuring argument errors propagate as failures to the caller.  Signed-off-by: Hoyeon Lee <hoyeon.lee@suse.com>",https://github.com/iovisor/bcc/commit/e58d68063637393e01a7788215f0ddc6e479e6b4
iovisor/bcc,https://github.com/iovisor/bcc,a07d117,Hoyeon Lee,2025-09-17T14:58:43Z,"tools: return error code when required kallsyms symbols are missing  When symbols such as *_file_operations or vm_zone_stat are not found in /proc/kallsyms, the scripts exited with code 0. Change these cases to exit(1) so that missing symbol errors are reported correctly, rather than appearing as successful termination.  Signed-off-by: Hoyeon Lee <hoyeon.lee@suse.com>",https://github.com/iovisor/bcc/commit/a07d1177d69c6deb2f7433a0cb79d208cf165def
iovisor/bcc,https://github.com/iovisor/bcc,bc6a98a,Hoyeon Lee,2025-09-17T15:03:36Z,"tools: return error code when no trace events matched  Several tools were using plain exit() when no kprobes or tracepoints could be attached. This returned 0 to the shell, incorrectly signaling success. Update these cases to use exit(1) so the failure is properly reported to the caller.  Signed-off-by: Hoyeon Lee <hoyeon.lee@suse.com>",https://github.com/iovisor/bcc/commit/bc6a98a02d65504289e835c71419492cd1f60cc8
iovisor/bcc,https://github.com/iovisor/bcc,2b73f76,Ism Hong,2025-09-08T09:43:16Z,"libbpf-tools: Fix list_syscalls() prototype return type  The function list_syscalls() in syscall_helpers.c returns an integer value, but its prototype in syscall_helpers.h declared a void return type.  This commit corrects the function prototype in syscall_helpers.h to match its implementation, changing the return type from void to int.  Fixes: f3fbeb46cb52 (""libbpf-tools: convert BCC syscount to BPF CO-RE version"") Signed-off-by: Ism Hong <ism.hong@gmail.com>",https://github.com/iovisor/bcc/commit/2b73f76eab440111a717f53290636f8233f15306
iovisor/bcc,https://github.com/iovisor/bcc,791bf81,Hoyeon Lee,2025-09-01T15:57:07Z,"tools/filetop: fix DNAME_INLINE_LEN by folding to integer constant (#5390)  Since Linux v6.14 (commit 61bc24ac974a), DNAME_INLINE_LEN is defined as an expression instead of a constant integer:  	#define DNAME_INLINE_LEN (DNAME_INLINE_WORDS * sizeof(unsigned long))  This causes the name array in struct info_t to be shown in map metadata as [""name"", ""char""""unsigned long"", [40]] instead of the correct [""name"", ""char"", [40]], breaking dumping of the counts map.  Rather than modifying AST handling, fix by storing DNAME_INLINE_LEN in an enum constant after including kernel headers. Enum values are compile-time integer constants, so the expression is folded to a literal and no longer carries the sizeof() expression into the AST.  Closes: iovisor/bcc#5337  Signed-off-by: Hoyeon Lee <hoyeon.lee@suse.com>",https://github.com/iovisor/bcc/commit/791bf81ad9ec18ce2899f79509e4de96ddc21e9d
iovisor/bcc,https://github.com/iovisor/bcc,a665f31,Hoyeon Lee,2025-09-01T15:40:55Z,"doc: Fix the build guide for openSUSE (#5393)  On openSUSE, LLVM/Clang static libraries are not provided by default. This causes CMake to fail with ""unknown component LLVMBitWriter"" when building bcc. To fix this, add `-DENABLE_LLVM_SHARED=1` in the build instructions for openSUSE.  Signed-off-by: Hoyeon Lee <hoyeon.lee@suse.com>",https://github.com/iovisor/bcc/commit/a665f31399e7184ab2967f9000f800c75460478c
iovisor/bcc,https://github.com/iovisor/bcc,52d2d09,Ism Hong,2025-08-26T07:03:55Z,"libbpf-tools/biotop: Fix segmentation fault with musl libc build  When building with musl libc, biotop would crash with a segmentation fault due to an uninitialized local variable line in the parse_disk_stat() function.  This commit initializes the line variable to NULL to prevent the crash.  Fixes: ca5fd8ee6fe0 (""libbpf-tools: Add biotop tool) Signed-off-by: Ism Hong <ism.hong@gmail.com>",https://github.com/iovisor/bcc/commit/52d2d098a7d69b6477df1a71ebd56bd4bfc6d81a
iovisor/bcc,https://github.com/iovisor/bcc,f55a2f6,Bojun Seo,2025-08-06T04:15:29Z,"Removing trailing white spaces and fixing typo (#5383)  * Remove trailing white spaces Trailing whitespaces are removed from all files, empty lines and image files are preserved. This patch is created using the following shell commands:    find . -type f -not -path '*/\.*' -exec sed -i '/^$/!s/[ \t]*$//' {} \;  * docs/reference_guide.md: Fix typo",https://github.com/iovisor/bcc/commit/f55a2f67e05d7cea44f3d850000fd6123caeeda0
iovisor/bcc,https://github.com/iovisor/bcc,0b53e33,Francois Lesueur,2025-08-06T04:11:02Z,tools/tcpconnect: fix iov field for DNS with Linux>=6.4 (#5382)  Tcpconnect with DNS (-d flag) does not work with Linux>=6.4. The kernel representation of struct iov_iter changed in 6.4.  This PR adapts the iov field depending on the structure. It also removes inet_sk() which did not work on a recent kernel (6.6).,https://github.com/iovisor/bcc/commit/0b53e3396c7eed6c20394a683c06b8eeaaa6be4e
iovisor/bcc,https://github.com/iovisor/bcc,bfa05d2,Rong Tao,2025-07-29T08:25:55Z,"python: tcp.py: add state2str() and apply to tools  There are two tools/{tcpretrans.py,tcpstates.py,tcpdrop.py} display the TCP state, and those code already exist in bcc/tcp.py, thus, this patch remove the duplicate code and add bcc.tcp.state2str() function.  Signed-off-by: Rong Tao <rongtao@cestc.cn>",https://github.com/iovisor/bcc/commit/bfa05d28cfead816f59e616dfaaf31b9644a8a08
iovisor/bcc,https://github.com/iovisor/bcc,7676954,Matt Pelland,2025-07-28T18:41:21Z,tools/kvmexit: silence compiler warnings  Depending on the environment that the kvmexit tool is used in various BPF compiler warnings may be emitted when running the tool. Silence these warnings unless the --debug argument is passed in order to make it easier to consume the tool's output.  Signed-off-by: Matt Pelland <mpelland@akamai.com>,https://github.com/iovisor/bcc/commit/7676954937b1b89c5e99c6bc2e64aa9dcf066feb
iovisor/bcc,https://github.com/iovisor/bcc,b7f6d0e,Matt Pelland,2025-07-28T18:32:04Z,tools/kvmexit: reformat header to match other tools  Most of the other tools implement a small changelog as the last part of the header comment. Reformat the header for kvmexit to match and add items covering AMD support and postprocessing parallelization.  Signed-off-by: Matt Pelland <mpelland@akamai.com>,https://github.com/iovisor/bcc/commit/b7f6d0ea7e89ea8c9eec02e1ec2ee9610265e1c1
iovisor/bcc,https://github.com/iovisor/bcc,c2af2ee,Matt Pelland,2025-07-28T18:16:29Z,"tools/kvmexit: implement parallel post processing  Post processing VM exit counts on high core count machines can take a very long time. Speed the process up by taking advantage of multiple cores where possible while also limiting the amount of parallelism to conserve resources.  Prior to this patch, running kvmexit.py against a 32 core VM on a 640 core machine took:  real    36m54.137s user    2m58.306s sys     33m45.453s  Afterwards:  real	5m14.744s user	36m57.590s sys	220m40.339s  Signed-off-by: Matt Pelland <mpelland@akamai.com>",https://github.com/iovisor/bcc/commit/c2af2eea25ba906ad3c9db0ef8d31fc64b86d191
iovisor/bcc,https://github.com/iovisor/bcc,13a4e5a,Matt Pelland,2025-07-28T17:52:40Z,tools/kvmexit: support amd processors  AMD's virtualization extensions (SVM) implement their own set of VM exit reasons. Import these from arch/x86/include/uapi/asm/svm.h in the upstream Linux kernel and change the supported vendor logic to work with either AMD or Intel.  Signed-off-by: Matt Pelland <mpelland@akamai.com>,https://github.com/iovisor/bcc/commit/13a4e5a462352a1ca8a8e9ff3b421bafce44bc7b
iovisor/bcc,https://github.com/iovisor/bcc,b81b93e,Bojun Seo,2025-07-28T06:42:30Z,tools/solisten_example.txt: fix typo,https://github.com/iovisor/bcc/commit/b81b93e4a44936586c5de8023b0f9053646ab397
iovisor/bcc,https://github.com/iovisor/bcc,da3a474,Ze Huang,2025-07-20T14:16:51Z,tools/tcptop: use fentry/fexit to trace TCP receive  Replace kprobe on tcp_cleanup_rbuf with fentry/fexit on tcp_recvmsg. Adds a dedicated sock_recv map to track receive-side sockets.  Signed-of-by: Ze Huang <huang.ze@linux.dev>,https://github.com/iovisor/bcc/commit/da3a474656ae6bc5d5e7a4b88caf00cfe4d75d6e
iovisor/bcc,https://github.com/iovisor/bcc,d786eaa,Ze Huang,2025-07-20T13:57:33Z,tools/tcptop: unify send/recv stats in tcp_stat()  Rename tcp_sendstat() to tcp_stat() and extend it to support receive-side statistics based on is_send flag.  Signed-off-by: Ze Huang <huang.ze@linux.dev>,https://github.com/iovisor/bcc/commit/d786eaa3388c2a543cb2d19b4e6f445f65b37b9f
iovisor/bcc,https://github.com/iovisor/bcc,e2c7917,Ze Huang,2025-07-20T13:47:07Z,tools/tcptop: Use fentry/fexit for tcp_sendmsg  Replace kprobe/kretprobe with fentry/fexit hooks for tcp_sendmsg.  Signed-off-by: Ze Huang <huang.ze@linux.dev>,https://github.com/iovisor/bcc/commit/e2c79176af4c420772d9d8f5ec40b4c67f5b8c98
iovisor/bcc,https://github.com/iovisor/bcc,75bb73a,Ze Huang,2025-07-20T13:20:18Z,"tools/tcptop: Move original tcptop to old directory  The original tcptop uses kprobes on tcp_sendmsg and tcp_cleanup_rbuf to trace TCP-level send and receive statistics. However, the current receive side tracing via tcp_cleanup_rbuf can result in overcounting due to the way `copied` is used:      int tcp_recvmsg(...) {          ...          int copied = 0;          ...          do {              ...              tcp_cleanup_rbuf(sk, copied);              ...              copied += used;              ...          } while (len > 0);           tcp_cleanup_rbuf(sk, copied);          return copied;          ...     }      Same data in ""copied"" might be taken into account several times  Fixing this requires tracing tcp_recvmsg entry/exit, which kretprobe can't reliably handle due to maxactive limits. fentry/fexit is needed, but only available on kernels >= 5.5 with BTF.  Move the old version to tools/old/, and introduce a new version using fentry/fexit.  Reported-by: @sc07kvm <github.com/sc07kvm> Signed-off-by: Ze Huang <huang.ze@linux.dev>",https://github.com/iovisor/bcc/commit/75bb73a594a6083977652d6c26ec59cde8816d5a
iovisor/bcc,https://github.com/iovisor/bcc,867f4a0,zcy,2025-07-23T23:30:55Z,"tools: add softirqslower (#5356)  Summary ======= Adds softirqslower tool to trace softirq execution performance issues by measuring:     SoftIRQ Runtime: Handler execution duration     HardIRQ-to-SoftIRQ Latency: Delay between wakeup (trigger) and execution start  Motivation ======== Diagnosing network latency/stalls requires observing:     Slow softirq executions (e.g., >10ms NET_RX processing)     Scheduling delays where softirqs get preempted after wakeup  Signed-off-by: chenyuezhou <zcy.chenyue.zhou@gmail.com>",https://github.com/iovisor/bcc/commit/867f4a08d0d1f0c103dba9b442607910293e503f
iovisor/bcc,https://github.com/iovisor/bcc,e12cf0f,vongosling,2025-07-23T22:10:55Z,Update INSTALL.md (#5376)  Fix the bug according to Windows branch regulation,https://github.com/iovisor/bcc/commit/e12cf0f11dc78d1503e3e2bb7f5149779587dd85
iovisor/bcc,https://github.com/iovisor/bcc,982b7d3,Jerome Marchand,2025-07-18T12:15:46Z,"libbpf-tools/klockstat: Disable *_nested kprobes in the fentry code  Commit 789e923f (""libbpf-tools/klockstat: Allows kprobe fallback to work with lock debugging (#5359)"") add new kprobes to be enabled on debug kernel and disabled on normal kernel. But it forgot to disable them in the fentry code, along with other kprobes.  Disable *_nested kprobes in the fentry code.  Fixes: 789e923f (""libbpf-tools/klockstat: Allows kprobe fallback to work with lock debugging (#5359)"") Signed-off-by: Jerome Marchand <jmarchan@redhat.com>",https://github.com/iovisor/bcc/commit/982b7d357f344934f796e0808d65af245cfc485a
iovisor/bcc,https://github.com/iovisor/bcc,694de9f,Rong Tao,2025-06-30T08:11:20Z,"libbpf-tools: trace_helpers: add str_loadavg() and str_timestamp()  There are many tools read /proc/loadavg and timestamp, this commit add two common function str_loadavg() and str_timestamp().  And fix bashreadline timestamp's wrong format, %m is month, should be %M (min).  Signed-off-by: Rong Tao <rongtao@cestc.cn>",https://github.com/iovisor/bcc/commit/694de9f98ec4b98b55bfb1df08bb528ff30be38d
iovisor/bcc,https://github.com/iovisor/bcc,8d066f0,yonghong-song,2025-07-16T19:00:09Z,Add @ekyooo as the official bcc reviewer (#5372),https://github.com/iovisor/bcc/commit/8d066f03f5f5a8618441827f3da46b8c8794785f
iovisor/bcc,https://github.com/iovisor/bcc,8c5c96a,yonghong-song,2025-07-15T03:21:59Z,"Fix a build failure with clang21 (#5369)  The build error message:   src/cc/frontends/clang/loader.cc:400:73: error: no matching function for    call to ‘clang::TextDiagnosticPrinter::TextDiagnosticPrinter(      llvm::raw_fd_ostream&, clang::DiagnosticOptions*)’   400 |   auto diag_client = new TextDiagnosticPrinter(llvm::errs(), &*diag_opts);       |                                                                         ^ The llvm commit   https://github.com/llvm/llvm-project/pull/139584 caused the build failure.  Adjust the code properly and the error is fixed.",https://github.com/iovisor/bcc/commit/8c5c96ad3beeed2fa827017f451a952306826974
iovisor/bcc,https://github.com/iovisor/bcc,b8b76e9,Yuzhou-Fang,2025-07-15T00:31:15Z,add descriptions for using pid in attach_uprobe and attach_uretprobe. (#5367)  Add descriptions in docs/reference_guide.md for using pid in attach_uprobe and attach_uretprobe functions that allows uprobes to be attached to a specific process. The introduced contents were mainly referred by the comments of attach_probe function in bcc/src/python/bcc/__init__.py.,https://github.com/iovisor/bcc/commit/b8b76e9a65df3ba772716522d5f4c944c6d43e4a
iovisor/bcc,https://github.com/iovisor/bcc,3630581,Jerome Marchand,2025-07-15T00:25:38Z,"tools/{biolatency,biosnoop,biotop}: use TRACEPOINT_PROBE() for tracepoints (#5366)  When support for block_io_* tracepoint was added, it used attach_tracepoint() since it was closer to the existing code that attached to kprobes. However, that meant we have to rely on a local prototype of the args structure and  the tool can be broken by a change of the tracepoints format, which is what happens with kernel commit aa6ff4eb7c10d (""block: Add ioprio to block_rq tracepoint"") which added a new argument to block tracepoints.  Replace attach_tracepoint() by TRACEPOINT_PROBE() so we don't have to deal with the tracepoint format changes.  Signed-off-by: Jerome Marchand <jmarchan@redhat.com>",https://github.com/iovisor/bcc/commit/36305815b927828592ae3b4f7f5a26aa82bc13ba
iovisor/bcc,https://github.com/iovisor/bcc,c8ad35a,yonghong-song,2025-07-14T23:54:22Z,Cleanup CODEOWNERS file (#5368),https://github.com/iovisor/bcc/commit/c8ad35aab9d6209f98021ea68f248182c5b805ad
iovisor/bcc,https://github.com/iovisor/bcc,78423e1,rockyxing,2025-07-14T17:52:24Z,"Add support for executing a program and tracing it (#5362)  For short-lived processes, specify '-p pid' is difficult to trace. Add support for executing a program and tracing it. When the newly child process exits, tool itself exists subsequently.  Added to syscount/opensnoop tools this time, other tools as needed.  For example: ./syscount.py -i 1 --exec ls -l /tmp",https://github.com/iovisor/bcc/commit/78423e1667db202012bbb032c567589175a2796c
iovisor/bcc,https://github.com/iovisor/bcc,21143df,Rong Tao,2025-07-14T16:32:35Z,libbpf-tools/ksnoop: Remove useless and white lines (#5365)  Remove useless and white lines in libbpf-tools/ksnoop.  Signed-off-by: Rong Tao <rongtao@cestc.cn>,https://github.com/iovisor/bcc/commit/21143df6abdb8ccb2be7df85a3a36e037239ddd5
iovisor/bcc,https://github.com/iovisor/bcc,a9c6650,Stefan Walter,2025-07-13T17:24:03Z,syscall_helpers.c / syscall.py: update syscall list (#5363)  Based on the Linux x86_64 source code (arch/x86/entry/syscalls/syscall_64.tbl).,https://github.com/iovisor/bcc/commit/a9c6650e391e812c03689ba706cf426dd2b234d4
iovisor/bcc,https://github.com/iovisor/bcc,5640952,yonghong-song,2025-07-13T16:14:32Z,"Fix potential verification failure for opensnoop.py (#5364)  When testing https://github.com/iovisor/bcc/pull/5362, I found the following verification failure for fentry progs:    ...   44: (b7) r0 = 0                       ; R0_w=0 refs=3   45: (95) exit   Unreleased reference id=3 alloc_insn=10  The reason is missing `ringbuf_discard` for certain conditionals for fentry progs since it used `ringbuf_reserve`. Adding `ringbuf_discard` in proper places can fix verification failure.",https://github.com/iovisor/bcc/commit/564095260aab156782128ea1d04b1eca66167fd1
