项目名称,项目URL,提交ID,提交者,提交时间,提交信息,提交链接
iovisor/bcc,https://github.com/iovisor/bcc,d7667cf,Sumanth Korikkar,2025-05-20T16:13:37Z,"clang: Fix pointer dereference on big-endian machines (#5287)  When pointer is dereferenced, it ends up with bpf_probe_read_kernel(). However, the data type of source and destination might differ in size for genParamIndirectAssign() and this can cause endianness issue.  Fix the pointer dereference by adjusting offsets of source and destination, when there is a size disparity. Also, as a small optimization, perform memset() only on the required destination part, considering the endianness.  * This is specifically needed for the genParamIndirectAssign(), where size disparity could happen. With the patch, the code generated is shown below:  __attribute__((section("".bpf.fn.syscall__kill""))) int syscall__kill(struct pt_regs *ctx) {  struct pt_regs * __ctx = (void *)ctx->gprs[2];  int tpid; BCC_PROBE_READ(&tpid, &__ctx->orig_gpr2, bpf_probe_read_kernel);  int sig; BCC_PROBE_READ(&sig, &__ctx->gprs[3], bpf_probe_read_kernel); ...  Here ctx->gprs[3] is 64 bit and sig is 32 bit and there is a size disparity.  * However, in other usecases like VisitMemberExpr() etc, The code generated is as below: if (flags & O_CREAT || (flags & O_TMPFILE) == O_TMPFILE) mode = ({     typeof(__u64) _val; __builtin_memset(&_val, 0, sizeof(_val));     bpf_probe_read_kernel(&_val, sizeof(_val), (void *)&how->mode); _val; });  The code uses typeof(__u64) to create a temporary variable (_val) that matches the size of the data being read. This prevents mismatch between the source and destination sizes and hence changes are not necessary in these usecases.  The fix is based on linux commit: 2e2c6d3fb383 (""selftests/bpf: Fix test_core_reloc_mods on big-endian machines"")  Signed-off-by: Sumanth Korikkar <sumanthk@linux.ibm.com>",https://github.com/iovisor/bcc/commit/d7667cf92ed841fec467ce4b701adf42bb9422f6
iovisor/bcc,https://github.com/iovisor/bcc,78580e0,ekyooo,2025-05-20T16:03:40Z,libbpf-tools/memleak: Extract print_headers (#5313)  Extract the print_headers logic into a separate function to improve code maintainability and extensibility.,https://github.com/iovisor/bcc/commit/78580e029896bcea31299e630a4ca6e9c26d25f3
iovisor/bcc,https://github.com/iovisor/bcc,a434ee5,yonghong-song,2025-05-19T06:34:10Z,"ci: Install python3-setuptools for ubuntu 24.04 (#5312)  For ubuntu 24.04, setuptools is not installed by default. So let us install it during Dockerfile.ubuntu preparation. Also, pip3 installation is replaced with package installation  so we do not need venv any more.  Co-authored-by: Yonghong Song <yonghong.song@linux.dev>",https://github.com/iovisor/bcc/commit/a434ee50522ee73b79468a88880b9cae28de53bd
iovisor/bcc,https://github.com/iovisor/bcc,82c212f,GengWu,2025-05-19T04:09:50Z,"Fix the issue where xfsslower cannot track write operations on files opened with the O_SYNC flag (#5310)  This patch fixes an issue in xfsslower where write operation traces are overwritten when files are opened with O_SYNC flag. Currently, when a file is opened with O_SYNC, xfsslower fails to track write operations and only shows sync operations. For example, when testing XFS I/O using this fio command:  [xxx@yyy ~]# fio --name=dsync-write --group_reporting --ioengine=psync --filename=./test --direct=1 --sync=1 --rw=write --bs=32k --size=4G --iodepth=1 --thread=1 --numjobs=1  And tracing with:  [xxx@yyy ~]# /usr/share/bcc/tools/xfsslower 0 The output only shows fsync operations without any write traces: 14:57:16 fio 189921 S 0 0 0.00 test 14:57:16 fio 189921 S 0 0 0.00 test 14:57:16 fio 189921 S 0 0 0.04 test  The root cause is that for O_SYNC files, xfs_file_write_iter calls xfs_file_fsync internally. This causes both trace_rw_entry and trace_fsync_entry to execute sequentially in the same process context.Since xfsslower uses BPF_HASH(entryinfo, u64, struct val_t) where entryinfo only uses pid and tid as keys, the entryinfo entry created by trace_rw_entry gets overwritten by trace_fsync_entry, making it impossible to track xfs_file_write_iter latency.  The solution introduces a new key structure:  struct key_t { u64 ptid; // pid and tid u32 type; // operation type };  All kprobe trace functions in xfsslower have been updated to work with the new key structure. After this change, xfsslower correctly tracks both xfs_file_write_iter and xfs_file_fsync latencies: 15:22:13 fio 190028 S 0 0 0.00 test 15:22:13 fio 190028 W 32768 2293504 0.05 test 15:22:13 fio 190028 S 0 0 0.00 test 15:22:13 fio 190028 W 32768 2293536 0.05 test  See the code changes in this commit for implementation details.",https://github.com/iovisor/bcc/commit/82c212fafd7c2dd2af786169ffc994f04036ecc2
iovisor/bcc,https://github.com/iovisor/bcc,10eb683,yonghong-song,2025-05-19T00:19:17Z,ci: Upgrade ubuntu 20.04 to 24.04 (#5311)  Currently CI does not work since ubuntu 20.04 is end-of-service. This patch upgraded ubuntu 20.04 to 24.04.  Co-authored-by: Yonghong Song <yonghong.song@linux.dev>,https://github.com/iovisor/bcc/commit/10eb683eec54e27faff0f512874785c39db02a0e
iovisor/bcc,https://github.com/iovisor/bcc,ed54880,Yonghong Song,2025-05-18T23:54:05Z,"Revert ""Use ubuntu 24.04 and fedora 41 for CI testing (#5301)""  This reverts commit 21b0b7668c2a8f7b3bedbfa3f01f87587be98b25.",https://github.com/iovisor/bcc/commit/ed548809a918621870e119f41f2a42d3dc2eec04
iovisor/bcc,https://github.com/iovisor/bcc,612e750,Yonghong Song,2025-05-18T23:53:51Z,"Revert ""Use correct nickname for github publish-build-containers.yml (#5305)""  This reverts commit f2d3803272fcd39888b75bb508df8f095ad02411.",https://github.com/iovisor/bcc/commit/612e7508855d24a257ebdd3da42dd001b43706a0
iovisor/bcc,https://github.com/iovisor/bcc,5a507f7,Rong Tao,2025-05-18T15:56:07Z,"uninstall: use execute_process() instead of exec_program() (#5285)  exec_program() is deprecated since 3.28, see: 'cmake --help-policy CMP0153', and cmake support execute_process() since CMake 2.6.0.      $ sudo make uninstall     ....     -- Uninstalling /usr/share/bcc/examples/networking/distributed_bridge/tunnel.py     CMake Warning (dev) at /home/rongtao/Git/bcc/build/CmakeUninstall.cmake:14 (exec_program):       Policy CMP0153 is not set: The exec_program command should not be called.       Run ""cmake --help-policy CMP0153"" for policy details.  Use the cmake_policy       command to set the policy and suppress this warning.        Use execute_process() instead.     Call Stack (most recent call first):       /home/rongtao/Git/bcc/build/CmakeUninstall.cmake:28 (UninstallManifest)     This warning is for project developers.  Use -Wno-dev to suppress it.  Link: https://cmake.org/cmake/help/v3.12/command/execute_process.html  Signed-off-by: Rong Tao <rongtao@cestc.cn>",https://github.com/iovisor/bcc/commit/5a507f7fc77f45825606a2753e6fa211edbde67c
iovisor/bcc,https://github.com/iovisor/bcc,00effe7,Eunseon Lee,2025-04-23T06:45:10Z,"libbpf-tools/biotop: Use dump_hash for map processing  Replace biotop's two-loop map lookup and deletion with a single dump_hash call, using bpf_map_lookup_and_delete_batch for atomic processing to prevent potential concurrency issues. Simplify code using dump_hash.",https://github.com/iovisor/bcc/commit/00effe7eecf24dd00e21dba8119b5b8baa34c0af
iovisor/bcc,https://github.com/iovisor/bcc,c4e8f3a,Eunseon Lee,2025-04-23T05:59:04Z,"libbpf-tools/map_helpers: Add bpf_map_lookup_and_delete_batch to dump_hash  Add support for bpf_map_lookup_and_delete_batch in dump_hash to enable atomic lookup and deletion, aiding tools like biotop with concurrency issues.",https://github.com/iovisor/bcc/commit/c4e8f3a39b97d8ac1a6e7424619ae544de1ad082
iovisor/bcc,https://github.com/iovisor/bcc,819c217,Harish sadineni,2025-05-18T04:07:28Z,"bcc: Fix for test bpf_stack_id when running on custom image in yocto (#5292)  The test for `bpf_stack_id` was failing due to the system being unable to locate `libc.so.6`. Upon investigation using `strace`, the following error was observed:   newfstatat(AT_FDCWD, ""/lib/x86_64-linux-gnu/libc.so.6"", 0x7ffdcd475420, 0) = -1 ENOENT (No such file or directory)   newfstatat(AT_FDCWD, ""/lib64/libc.so.6"", 0x7ffdcd475420, 0) = -1 ENOENT (No such file or directory)  This issue occurs because `libc.so.6` was not found in the expected locations. To resolve this, the location of `libc.so.6` has been added to the custom Yocto images. It is now accessible at: /lib/libc.so.6  This change ensures proper linking and access to `libc.so.6` during runtime in the Yocto custom image.  Signed-off-by: Harish Sadineni <Harish.Sadineni@windriver.com>",https://github.com/iovisor/bcc/commit/819c2170a77451df206cc79d1cd0603216f65ef7
iovisor/bcc,https://github.com/iovisor/bcc,7ca71ba,Jerome Marchand,2025-05-18T02:17:34Z,"clang: Define DCONFIG_CC_IS_CLANG in KBuildHelper::get_flags() (#5172) (#5293)  On powerpc, many tools fail with an ""invalid output constraint '=YZ<>' in asm"" error. This come from the following code in arch/powerpc/include/asm/asm-compat.h:  Because CONFIG_CC_IS_CLANG is not defined in the headers, we end up using a constraint that is not understoog by clang.  Defining CONFIG_CC_IS_CLANG in KBuildHelper::get_flags() fixes this error and possibly other similar error.  Suggested-by: Shung-Hsi Yu <shung-hsi.yu@suse.com> Signed-off-by: Jerome Marchand <jmarchan@redhat.com>",https://github.com/iovisor/bcc/commit/7ca71ba7a2a6db09451c5339e23e9b6e96b3963b
iovisor/bcc,https://github.com/iovisor/bcc,f08c41d,Ilya Leoshkevich,2025-05-18T02:09:36Z,"Fix running cmake outside of the source subtree (#5299)  Configuring bcc in a build directory that is not in the source subtree causes the following warning:      warning: Not a git repository. Use --no-index to compare two paths outside a working tree  This is caused by a subcommand running in the current working directory. Run it in the source directory instead.  Fixes: 3df26a542f80 (""cmake: sync submodule libbpf when do cmake."")  Signed-off-by: Ilya Leoshkevich <iii@linux.ibm.com>",https://github.com/iovisor/bcc/commit/f08c41d5963e26d3b0d2db62acbf75cee4abb2bd
iovisor/bcc,https://github.com/iovisor/bcc,5504a05,bin-101,2025-05-17T23:51:36Z,tests/python: support finish_task_switch.isra.* (#5302)  Follow the approach introduced in https://github.com/iovisor/bcc/pull/3315.  Signed-off-by: Hitoshi Murakami <bin101bb@gmail.com>,https://github.com/iovisor/bcc/commit/5504a0529e0d21d48e4dd565b53b5cf05f88c1b5
iovisor/bcc,https://github.com/iovisor/bcc,9e6c020,Youngsuk Kim,2025-05-17T23:14:38Z,"Delete outdated comment (INSTALL.md; Ubuntu) (#5308)  Attached `bash` block has no direct references to `xenial`. Minor docs clean-up.",https://github.com/iovisor/bcc/commit/9e6c02036cae2e9f4a6ae8fe0b33e71cf4ac316a
iovisor/bcc,https://github.com/iovisor/bcc,9216aad,Jerome Marchand,2025-05-17T23:12:30Z,"tools/biosnoop: Fix biosnoop pattern option (#5304)  The code to support the block_io tracepoints failed to update some code that is used with the -P option. That code changed the second argument of __trace_req_completion from 'req' to 'key', but in the ""#ifdef INCLUDE_PATTERN"" block, the use of 'req' remained unchanged. Of course, 'key' should be use here too.  Also remove the commented out line of code related to rq_disk.  It fixes the following error: $ biosnoop -P /virtual/main.c:213:24: error: use of undeclared identifier 'req'   213 |         data.pattern = req->__sector == *sector ? SEQUENTIAL : RANDOM;       |                        ^ /virtual/main.c:216:19: error: use of undeclared identifier 'req'   216 |     last_sector = req->__sector + data.len / 512;       |                   ^ 2 errors generated. Traceback (most recent call last):   File ""/usr/share/bcc/tools/biosnoop"", line 335, in <module>     b = BPF(text=bpf_text)   File ""/usr/lib/python3.13/site-packages/bcc/__init__.py"", line 505, in __init__     raise Exception(""Failed to compile BPF module %s"" % (src_file or ""<text>"")) Exception: Failed to compile BPF module <text>  Signed-off-by: Jerome Marchand <jmarchan@redhat.com>",https://github.com/iovisor/bcc/commit/9216aad6cadd42436eac28541a9c1f5b51446a6a
iovisor/bcc,https://github.com/iovisor/bcc,af8258c,Tiezhu Yang,2025-05-17T02:50:01Z,"bcc: import subprocess in __init__.py  When executing the bcc script, there exists the following fatal error on LoongArch:  $ sudo /usr/share/bcc/tools/filetop  In file included from <built-in>:4: In file included from /virtual/include/bcc/helpers.h:54: In file included from arch/loongarch/include/asm/page.h:9: In file included from arch/loongarch/include/asm/addrspace.h:16: arch/loongarch/include/asm/loongarch.h:13:10: fatal error: 'larchintrin.h' file not found    13 | #include <larchintrin.h>       |          ^~~~~~~~~~~~~~~ 1 error generated.  git log shows that it has been fixed in the commit 8aa9f7072d53 (""Fix larchintrin.h not found error for loongarch64""), but the same error still exists in the latest mainline bcc.  This is because both clang_include_path_str and gcc_include_path_str are False due to subprocess.check_output() failed, import subprocess in __init__.py to fix it.  How to reproduce:  git clone https://github.com/iovisor/bcc.git mkdir bcc/build; cd bcc/build cmake .. make sudo make install  Fixes: 8aa9f7072d53 (""Fix larchintrin.h not found error for loongarch64"") Signed-off-by: Tiezhu Yang <yangtiezhu@loongson.cn>",https://github.com/iovisor/bcc/commit/af8258c21004f20fffb0e37aebaa0cab61253651
iovisor/bcc,https://github.com/iovisor/bcc,f2d3803,yonghong-song,2025-05-12T18:23:46Z,Use correct nickname for github publish-build-containers.yml (#5305),https://github.com/iovisor/bcc/commit/f2d3803272fcd39888b75bb508df8f095ad02411
iovisor/bcc,https://github.com/iovisor/bcc,21b0b76,yonghong-song,2025-05-12T01:46:05Z,Use ubuntu 24.04 and fedora 41 for CI testing (#5301)  The ubuntu 20.04 and fedora 38 are not supported any more. So let us upgrade to new releases for CI testing.,https://github.com/iovisor/bcc/commit/21b0b7668c2a8f7b3bedbfa3f01f87587be98b25
iovisor/bcc,https://github.com/iovisor/bcc,27dee08,Gang Yan,2025-04-17T09:54:15Z,"BCC: python: add a useful tool for mptcp  Multipath TCP (MPTCP) is an extension of the standard TCP protocol that allows a single transport connection to use multiple network interfaces or paths. MPTCP is useful for applications like bandwidth aggregation, failover, and more resilient connections.  Linux kernel starts to support MPTCP since v5.6, this patch provides a method which can easily force applications use MPTCP socket without modifing its code.  Co-developed-by: Geliang Tang <geliang@kernel.org> Signed-off-by: Geliang Tang <geliang@kernel.org> Signed-off-by: Gang Yan <yangang@kylinos.cn>",https://github.com/iovisor/bcc/commit/27dee085feaa0af7a878cd298b373c1a33c573e8
iovisor/bcc,https://github.com/iovisor/bcc,18bc672,Gang Yan,2025-04-05T05:36:10Z,"BCC: Python: Support 'fmod_ret' method for eBPF  In kernel, there exists a lot of 'fmod_ret' functions, such as 'update_socket_protocol'. But it cannot attached in BCC-python directly, so this patch provides an interface for python to use 'fmod_ret' attaching method.  This patch is suggested by Yonghong:  ''' On Sun, 2024-08-25 at 21:05 -0700, Yonghong Song wrote: ... > Gang Yan, could you explore to add fmod_ret support in bcc? It should > be similar to kfunc/kretfunc support. I am happy to review your patches. '''  And the method to check 'fmod_ret' support in kernel is from Hengqi.  Co-developed-by: Geliang Tang <geliang@kernel.org> Signed-off-by: Geliang Tang <geliang@kernel.org> Signed-off-by: Gang Yan <yangang@kylinos.cn>",https://github.com/iovisor/bcc/commit/18bc672d52a91928d1e83724c7c0d5e884c7cca2
iovisor/bcc,https://github.com/iovisor/bcc,7e6a4a4,Gang Yan,2025-04-14T03:19:35Z,"BCC: libbpf: add an interface 'kernel_enum_has_val'  Followed by the suggestions of Hengqi, which judging the kernel whether supported 'fmod_ret' by using 'kernel_struct_has_field' to check the existence of enum 'BPF_MODIFY_RETURN'.  But, the 'kernel_struct_has_filed' is not supported the 'enum' type, so this patch provides an interface 'kernel_enum_has_val' to achieve this.  Co-developed-by: Geliang Tang <geliang@kernel.org> Signed-off-by: Geliang Tang <geliang@kernel.org> Signed-off-by: Gang Yan <yangang@kylinos.cn>",https://github.com/iovisor/bcc/commit/7e6a4a4b3eb7247687a3134e99366f3912cb341c
iovisor/bcc,https://github.com/iovisor/bcc,6e76832,Feng Yang,2025-04-30T08:33:55Z,libbpf-tools: Fix the issue of unreleased resources  Fix the issue of unreleased resources  Signed-off-by: Feng Yang <yangfeng@kylinos.cn>,https://github.com/iovisor/bcc/commit/6e7683262d53677e680ca4ae77d12f768155eff7
iovisor/bcc,https://github.com/iovisor/bcc,018ea04,Shubh Pachchigar,2025-04-27T07:30:15Z,fix typo in reference_guide.md,https://github.com/iovisor/bcc/commit/018ea04b5d7f8aa5179f270d4568f8604b681bad
iovisor/bcc,https://github.com/iovisor/bcc,5043759,Amaindex,2025-04-27T12:40:09Z,Sync with latest libbpf repo The top libbpf commit is:   4659eaafa480  sync: latest libbpf changes from kernel  Signed-off-by: Lance Yang <lance.yang@linux.dev> Signed-off-by: Amaindex <amaindex@outlook.com>,https://github.com/iovisor/bcc/commit/50437596253987298b3fc9d82675bd4c785b26aa
iovisor/bcc,https://github.com/iovisor/bcc,1dcfcec,Tanel Poder,2025-04-16T06:15:59Z,"fix typo in ""*precpu* cgroup storage""",https://github.com/iovisor/bcc/commit/1dcfcec51c89713d243247ad7abea654a6dc7b20
iovisor/bcc,https://github.com/iovisor/bcc,1f63ae6,yonghong-song,2025-04-11T15:24:06Z,"Update debian changelog for release v0.34.0 (#5277)  * Support for kernel up to 6.13   * Bump cmake minimum version to 3.12   * statsnoop: Display syscall name with -s   * readahead: Fix incorrect page accessed count since kernel 5.16   * libbpf-tools/opensnoop: Add new fields   * libbpf-tools: hardirqs/softirqs: Fix logarithmic calculation issue   * libbpf-tools/hardirqs: have better default display and add CPU column   * libbpf-tools/klockstat: Better stack dump and summary info   * libbpf-tools/sigsnoop: Support real-time signals and thread comm   * libbpf-tools/statsnoop: Support more syscalls   * libbpf-tools/memleak: Some fixes and better messages   * tools/opensnoop: Add new fields and fix bad mode value   * tools/profile: Prioritize using the cpu-cycles hardware event   * tools/tcpdrop: Add support for dumping TCP drop reasons   * Fix event name too long error in python source   * doc update, other bug fixes and example improvement.  Signed-off-by: Yonghong Song <yonghong.song@linux.dev> Co-authored-by: Yonghong Song <yonghong.song@linux.dev>",https://github.com/iovisor/bcc/commit/1f63ae6e1c34c9ca3d5dcf339abecd16651593c2
iovisor/bcc,https://github.com/iovisor/bcc,f25ee31,Rong Tao,2025-04-11T14:34:20Z,"Adapt to gcc 7.3.0 std::string.replace() (#5275)  compile bcc on gcc (GCC) 7.3.0:      $ make     ...     [  1%] Building CXX object src/cc/CMakeFiles/bpf-static.dir/common.cc.o     /home/rongtao/Git/bcc/src/cc/common.cc: In function ‘ebpf::field_kind_t ebpf::_get_field_kind(const string&, std::__cxx11::string&, std::__cxx11::string&, int*)’:     /home/rongtao/Git/bcc/src/cc/common.cc:178:59: error: no matching function for call to ‘std::__cxx11::basic_string<char>::replace(long unsigned int, long unsigned int, std::__cxx11::basic_string<char>&, int)’            field_name.replace(pos1 + 1, pos2 - pos1 - 1, dim, 0);                                                                ^     In file included from /usr/include/c++/7.3.0/string:52:0,                      from /usr/include/c++/7.3.0/bits/locale_classes.h:40,                      from /usr/include/c++/7.3.0/bits/ios_base.h:41,                      from /usr/include/c++/7.3.0/ios:42,                      from /usr/include/c++/7.3.0/istream:38,                      from /usr/include/c++/7.3.0/fstream:38,                      from /home/rongtao/Git/bcc/src/cc/common.cc:16:     /usr/include/c++/7.3.0/bits/basic_string.h:1861:7: note: candidate: std::__cxx11::basic_string<_CharT, _Traits, _Alloc>& std::__cxx11::basic_string<_CharT, _Traits, _Alloc>::replace(std::__cxx11::basic_string<_CharT, _Traits, _Alloc>::size_type, std::__cxx11::basic_string<_CharT, _Traits, _Alloc>::size_type, const std::__cxx11::basic_string<_CharT, _Traits, _Alloc>&) [with _CharT = char; _Traits = std::char_traits<char>; _Alloc = std::allocator<char>; std::__cxx11::basic_string<_CharT, _Traits, _Alloc>::size_type = long unsigned int]            replace(size_type __pos, size_type __n, const basic_string& __str)            ^~~~~~~  Signed-off-by: Rong Tao <rongtao@cestc.cn>",https://github.com/iovisor/bcc/commit/f25ee31b6a74b11fc51304560f55ae2241a29474
iovisor/bcc,https://github.com/iovisor/bcc,c6eb562,yonghong-song,2025-04-11T14:20:17Z,"Fix llvm compilation failure (#5276)  Upstream patch [1] caused bcc build failure:   ...   /home/yhs/work/bcc/src/cc/bcc_debug.cc: In member function ‘void ebpf::SourceDebugger::dump()’:   /home/yhs/work/bcc/src/cc/bcc_debug.cc:117:43: error: no matching function for call to       ‘std::__cxx11::basic_string<char>::basic_str’     117 |   string TripleStr(mod_->getTargetTriple());         |                                           ^   ...   /home/yhs/work/bcc/src/cc/bpf_module.cc: In member function ‘int ebpf::BPFModule::finalize()’:   /home/yhs/work/bcc/src/cc/bpf_module.cc:546:24: error: cannot convert ‘const char [13]’ to ‘llvm::Triple’     546 |   mod->setTargetTriple(""bpf-pc-linux"");         |                        ^~~~~~~~~~~~~~         |                        |         |                        const char [13]   ...  This patch fixed the above compilation failure.    [1] https://github.com/llvm/llvm-project/pull/129868",https://github.com/iovisor/bcc/commit/c6eb562f47c030ddcf319df2bf45e28e7ec95967
iovisor/bcc,https://github.com/iovisor/bcc,dd08f0f,Feng Yang,2025-04-11T04:03:26Z,"hardirqs: Optimize output information and increase CPU display (#5228)  Combine the previous count and time into one, and increase CPU independent statistics and maximum interrupt time  Before: ./hardirqs Tracing hard irq event time... Hit Ctrl-C to end. ^C HARDIRQ                    TOTAL_usecs enp0s3                             254 snd_intel8x0                       368  ./hardirqs -C Tracing hard irq events... Hit Ctrl-C to end. ^C HARDIRQ                    TOTAL_count enp0s3                              14 ata_piix                             2  After: ./hardirqs Tracing hard irq event time... Hit Ctrl-C to end. ^C HARDIRQ                   TOTAL_count TOTAL_usecs MAX_usecs ata_piix                            2          32        21 enp0s3                             19         318        42  ./hardirqs -C Tracing hard irq event time... Hit Ctrl-C to end. ^C HARDIRQ                   TOTAL_count TOTAL_usecs MAX_usecs CPU enp0s3                         111375     1420732       303   2 enp0s3                           1546       21826        39   9 ata_piix                            8         162        33   8  Signed-off-by: Feng Yang <yangfeng@kylinos.cn>",https://github.com/iovisor/bcc/commit/dd08f0ff062407cbf0cad334f516905a50b9561b
iovisor/bcc,https://github.com/iovisor/bcc,d124144,Rong Tao,2025-04-11T03:48:28Z,"libbpf-tools: llcstat: Fix error: redefinition of 'key_info' on aarch64 (#5265)  Rename key_info to llcsta_key_info, at the same time, in order to ensure the consistency of key-value naming, rename value_info to llvstat_value_info.      $ make     ...       BPF      llcstat.bpf.o     In file included from llcstat.bpf.c:7:     ./llcstat.h:13:8: error: redefinition of 'key_info'        13 | struct key_info {           |        ^     arm64/vmlinux.h:140310:8: note: previous definition is here      140310 | struct key_info {             |        ^     llcstat.bpf.c:27:6: error: no member named 'cpu' in 'struct key_info'        27 |         key.cpu = bpf_get_smp_processor_id();           |         ~~~ ^     llcstat.bpf.c:28:6: error: no member named 'pid' in 'struct key_info'        28 |         key.pid = pid_tgid >> 32;           |         ~~~ ^     llcstat.bpf.c:30:7: error: no member named 'tid' in 'struct key_info'        30 |                 key.tid = (u32)pid_tgid;           |                 ~~~ ^     llcstat.bpf.c:32:7: error: no member named 'tid' in 'struct key_info'        32 |                 key.tid = key.pid;           |                 ~~~ ^     llcstat.bpf.c:32:17: error: no member named 'pid' in 'struct key_info'        32 |                 key.tid = key.pid;           |                           ~~~ ^     6 errors generated.     make: *** [Makefile:207: /home/rongtao/Git/bcc/libbpf-tools/.output/llcstat.bpf.o] Error 1  Signed-off-by: Rong Tao <rongtao@cestc.cn>",https://github.com/iovisor/bcc/commit/d124144e7f9c16972f04a97fbdca4ebe98a657f8
iovisor/bcc,https://github.com/iovisor/bcc,97eaeca,Feng Yang,2025-04-11T03:43:34Z,"Fix event name too long error in python source (#5271)  When the event name is too long, such as p:uprobes/p__proc_124566_root_usr_lib64_libruby_so_3_2_2_0xda3ac_124566_bcc_131967, an error will occur when executing the write function of function create_probe_event.  The kernel error path is probes_write   trace_parse_run_command     create_or_delete_trace_uprobe       trace_uprobe_create         trace_probe_create           __trace_uprobe_create             traceprobe_parse_event_name 		else if (len >= MAX_EVENT_NAME_LEN) Requires less than 64 bytes. Signed-off-by: Feng Yang <yangfeng@kylinos.cn>",https://github.com/iovisor/bcc/commit/97eaeca75b7b906a95be306689032b9bb6064ffc
