项目名称,项目URL,提交ID,提交者,提交时间,提交信息,提交链接
obsproject/obs-studio,https://github.com/obsproject/obs-studio,7e2fd72,PatTheMav,2025-07-25T22:06:05Z,"libobs-opengl: Improve macOS error handling for swapchain code  OpenGL swapchain code has been the subject of obscure crashes on macOS for quite some time, mainly because updates to the swapchain need to take place on the main thread (because the operations involve the NSView instances of the application), which introduces possible race conditions.  This commit adds more error checking to the related functions and makes OpenGL-related code use copies of data from the graphics thread (instead of accessing that data as nested data within a global heap object) and limit ""deep"" access to a swap-and-delete update of the texture pointer for the associated frame buffer object.",https://github.com/obsproject/obs-studio/commit/7e2fd72ddf0fbe27b9fc0bd8cb33164a13d0c959
obsproject/obs-studio,https://github.com/obsproject/obs-studio,813c95f,PatTheMav,2025-06-20T19:59:49Z,"libobs: Update sharpness effect to enable compilation for Metal  A boolean comparison that involves at least one vector type will result in a boolean vector (not a boolean scalar) for Direct3D and Metal, whereas OpenGL returns a scalar boolean.  To avoid unnecessary code complexity, use the ""distance"" function instead, which treats the color values as vectors and returns a non-zero value if they are any different, achieving the same result.",https://github.com/obsproject/obs-studio/commit/813c95f4ca0816873584463afa3dd9a289427860
obsproject/obs-studio,https://github.com/obsproject/obs-studio,87698b1,PatTheMav,2025-08-09T14:44:48Z,"libobs: Fix clear color mismatch in Metal and OpenGL on Apple Silicon  The OpenGL frontend is implemented in Metal for Apple Silicon Macs.  Metal does not provide a direct ""clear"" command (neither do D3D12 or Vulkan) and instead a clear is a load command for a render target of a render pass.  All writes (and color calculations) in Metal happen in linear space, with appropriate gamma encoding and decoding happening automatically depending on the pixel format of the the textures attached to the pipeline.  Thus setting a clear color with linear gamma is the correct approach to avoid the SRGB gamma curve being applied twice for both scenarios.",https://github.com/obsproject/obs-studio/commit/87698b1e0106024cf51d0af6056faf1bf52134ec
obsproject/obs-studio,https://github.com/obsproject/obs-studio,95ea651,PatTheMav,2024-05-07T10:15:16Z,plugins: Update plugins to use default draw effect for Metal,https://github.com/obsproject/obs-studio/commit/95ea65136f02dd74d8d67ba49b2a25d1533a3104
obsproject/obs-studio,https://github.com/obsproject/obs-studio,966f086,derrod,2024-12-22T15:11:51Z,obs-outputs: Use packet time callback for frame-accurate chapter markers,https://github.com/obsproject/obs-studio/commit/966f086c96fbda45d674c146a2e55f4e02a2f805
obsproject/obs-studio,https://github.com/obsproject/obs-studio,345700b,"Huts, Roman",2025-05-14T20:49:29Z,obs-ffmpeg: Add Pre-Analysis checkbox for AMD encoder,https://github.com/obsproject/obs-studio/commit/345700b199be98561ec4c4a283e33c2f713ab6d5
obsproject/obs-studio,https://github.com/obsproject/obs-studio,4fb20ee,"Huts, Roman",2024-10-30T20:35:35Z,obs-ffmpeg: Update default AMD encoding settings,https://github.com/obsproject/obs-studio/commit/4fb20ee9ad5ef054aea3d198396a7545149c4a2c
obsproject/obs-studio,https://github.com/obsproject/obs-studio,a7d5721,derrod,2025-01-25T18:27:33Z,frontend: Remove channel change signal handler from transform dialog,https://github.com/obsproject/obs-studio/commit/a7d5721c2ccd341430775895a19a6cfd7b288c94
obsproject/obs-studio,https://github.com/obsproject/obs-studio,033c740,Exeldro,2024-11-12T10:06:26Z,obs-transitions: Fix stinger showing count for update during transition,https://github.com/obsproject/obs-studio/commit/033c740d139c208b2ed4c8657f9c1125ab4c01bc
obsproject/obs-studio,https://github.com/obsproject/obs-studio,33e8a23,cg2121,2025-06-01T02:03:32Z,frontend: Auto release OBSDataArray objects  Makes sure that all obs data array objects in cpp files are using auto release RAII wrappers.,https://github.com/obsproject/obs-studio/commit/33e8a23386fadefb722d8e103e40674ae792fa14
