项目名称,项目URL,提交ID,提交者,提交时间,提交信息,提交链接
obsproject/obs-studio,https://github.com/obsproject/obs-studio,8d9bd44,pkv,2025-05-13T18:43:18Z,"obs-ffmpeg: Fix reconnection for SRT protocol  This is the first part of a fix for reconnection issues with SRT protocol. This part implements the logic on the side of the protocol. The fixes are as follows: - a cleanup of return values of the various functions used. The main libsrt_open function returns OBS_OUTPUT_XXX enum members. But the other functions return now only AVERROR(xxx). - an explicit check of the socket state before returning OBS_OUTPUT_SUCCESS. This fixes an issue due to relying on socket non-blocking mode; in caller mode, the srt_connect function will return a success even before a connection has succeeded since it relies on notifications by srt_epoll_wait. This would prompt obs UI to display a successful reconnection in spite of a failure.  Signed-off-by: pkv <pkv@obsproject.com>",https://github.com/obsproject/obs-studio/commit/8d9bd44179ee91e5b77ed139ea59f281e2926e39
obsproject/obs-studio,https://github.com/obsproject/obs-studio,3ae9d6a,pkv,2025-05-17T01:01:20Z,obs-ffmpeg: Cleanup for mpegts muxer  The do_log function defined for the muxer expects that the struct is named stream rather than output. So rename output to stream. This also avoids confusion with stream->output which is an obs_output_t pointer.  Signed-off-by: pkv <pkv@obsproject.com>,https://github.com/obsproject/obs-studio/commit/3ae9d6a10612ee5ca210c15beb28997ff1ee8e63
obsproject/obs-studio,https://github.com/obsproject/obs-studio,2eabfda,derrod,2025-01-30T09:42:51Z,obs-outputs: Allow enabling BPM for Hybrid MP4 output,https://github.com/obsproject/obs-studio/commit/2eabfdad550b70800ceeb72bc3a16874acf6bd3a
obsproject/obs-studio,https://github.com/obsproject/obs-studio,505b76e,Norihiro Kamae,2022-08-02T19:17:19Z,libobs: Reject plugins compiled with newer libobs  Check obs_module_ver and reject if the plugin is built with a newer libobs major/minor version.,https://github.com/obsproject/obs-studio/commit/505b76e8a723ae5b671bb8ae776d3e08b969f227
obsproject/obs-studio,https://github.com/obsproject/obs-studio,ffcc3ac,tytan652,2025-02-18T16:25:00Z,frontend: Replace transition duration spinbox direct access,https://github.com/obsproject/obs-studio/commit/ffcc3acd9d5e94cbe59ffbec435f73d378cc6a50
obsproject/obs-studio,https://github.com/obsproject/obs-studio,d22ddfd,tytan652,2025-02-18T15:07:03Z,frontend: Reduce reliance on transition indexes,https://github.com/obsproject/obs-studio/commit/d22ddfd3957cde26a09144ce5c9e7ec79a291791
obsproject/obs-studio,https://github.com/obsproject/obs-studio,2962770,tytan652,2025-02-08T10:06:30Z,frontend: Replace transitions combobox direct access,https://github.com/obsproject/obs-studio/commit/29627708137d5c3e05cdbac0a147f82a4a2679c6
obsproject/obs-studio,https://github.com/obsproject/obs-studio,11562b6,tytan652,2025-02-09T14:21:19Z,frontend: Remove some shadowing,https://github.com/obsproject/obs-studio/commit/11562b66969d2fd2b8732d3492851d40e8418fb6
obsproject/obs-studio,https://github.com/obsproject/obs-studio,d097ff2,Sebastian Beckmann,2025-05-28T20:34:38Z,shared/idian: Rename OBSIdianUtils,https://github.com/obsproject/obs-studio/commit/d097ff24ada8ae20e7316b18d87a0b11661b4052
obsproject/obs-studio,https://github.com/obsproject/obs-studio,872ea5f,Sebastian Beckmann,2025-05-28T17:20:03Z,shared/idian: Rename component classes,https://github.com/obsproject/obs-studio/commit/872ea5fb911319cdf5574b1cc07d8fd00632c828
obsproject/obs-studio,https://github.com/obsproject/obs-studio,edb2c9c,Sebastian Beckmann,2025-05-28T12:37:52Z,shared/idian: Rename widget classes,https://github.com/obsproject/obs-studio/commit/edb2c9ca4818caf254a7d6674fc329902c0d19b2
obsproject/obs-studio,https://github.com/obsproject/obs-studio,5cda3d4,Sebastian Beckmann,2025-05-28T16:24:39Z,shared/idian: Rename all-in-one include to Idian.hpp,https://github.com/obsproject/obs-studio/commit/5cda3d4e8e7f34d20977bad4a95c59f71865dfd0
obsproject/obs-studio,https://github.com/obsproject/obs-studio,9e0c321,Sebastian Beckmann,2025-05-26T13:57:31Z,frontend: Move idian widgets to shared/qt,https://github.com/obsproject/obs-studio/commit/9e0c3219ff8b0d20ae92c2cf7ae4e1572cd09873
obsproject/obs-studio,https://github.com/obsproject/obs-studio,de9fcd6,Sebastian Beckmann,2025-05-28T20:52:52Z,frontend: Unify naming of Idian Playground  It's called Idian Playground in some places and Widget Playground in others. Idian Playground is more precise so let's use that.,https://github.com/obsproject/obs-studio/commit/de9fcd6b42d7f75b5dbe284961a6d8d14487efa9
obsproject/obs-studio,https://github.com/obsproject/obs-studio,c527f9e,Sebastian Beckmann,2025-05-28T12:37:23Z,cmake: Don't add Idian playground when feature is disabled,https://github.com/obsproject/obs-studio/commit/c527f9e34c4d21583c92cdd4bde9adbbd66ae496
obsproject/obs-studio,https://github.com/obsproject/obs-studio,e8f6143,Warchamp7,2025-03-19T02:56:16Z,frontend: Add new Idian widgets  Co-Authored-By: derrod <rodney@rodney.io>,https://github.com/obsproject/obs-studio/commit/e8f6143769d77d76b9bda9cb5e5966fffe8b3198
obsproject/obs-studio,https://github.com/obsproject/obs-studio,50cdabb,pkv,2025-05-14T05:52:45Z,"libobs: Fix audio duplication  This fixes the following bug: - a source might be copied into the same scene or through a nested scene. The audio level will then increase by +6 dBFS. An earlier fix [1] dealt with this bug at the scene audio rendering level, which leaves some edge cases since the fix is not located directly in the core audio callback. The current fix consists in: - tagging individual sources which appear several times in the audio tree at each tick; - promote them to root_nodes sources; - bypass their mixing in scenes and transitions. Due to being mixed as root_nodes, the audio of duplicated sources appears only once in the final audio mix.  [1] https://github.com/obsproject/obs-studio/pull/10537  Signed-off-by: pkv <pkv@obsproject.com>",https://github.com/obsproject/obs-studio/commit/50cdabbb5f1578796a459801b44d131f6509da97
obsproject/obs-studio,https://github.com/obsproject/obs-studio,f027f62,pkv,2025-05-07T08:06:58Z,"Revert libobs: Mix audio of each source in a scene only once  This reverts commit: 8a38e33 [1]. This also reverts commit: 72924ac [2]. (in favour of a fix in core audio pipeline, which allows to address edge cases).  [1] libobs: Mix audio of each source in a scene only once https://github.com/obsproject/obs-studio/commit/8a38e3375b63692b01e5088d37f531f36a5d39f9 [2] libobs: Deduplicate audio for nested scenes/groups if not transitioning https://github.com/obsproject/obs-studio/commit/72924ac1f3c4c55de038fe1f03a0e197a155d5e7  Signed-off-by: pkv <pkv@obsproject.com>",https://github.com/obsproject/obs-studio/commit/f027f62f90c4d1765b63c11132625c51be2df29d
obsproject/obs-studio,https://github.com/obsproject/obs-studio,de997b1,PatTheMav,2025-03-29T17:36:34Z,"frontend: Update crash handling and log upload functionality  Updates include:  * Use of CrashHandler to provide automatic uploads of the most recent crash log if an unclean shutdown was detected and it has not been uploaded yet. * Detection and handling of unclean shutdowns is delegated entirely to the CrashHandler class * Use of OBSLogReply has been replaced with the LogUploadDialog, which asks for confirmation before new uploads of log files (confirmation is skipped for files with available upload URLs already - only available for crash logs with this change)  Architectural changes: * OBSApp is the layer responsible for application launch and shutdown states, as well as crash logs and application logs * The actual handling is delegated to purpose-made classes which OBSApp owns instances of * OBSBasic in turn refers to OBSApp for all this functionality, and can subscribe/connect to appropriate events exposed by OBSApp to this purpose * Implementation details (like the existence of the CrashHandler class) are not exposed to OBSBasic or the LogUploadDialog  The amount of changes for normal log file upload have been purposefully limited. A proper refactoring of the application log file handling will move this code out of OBSBasic as well.",https://github.com/obsproject/obs-studio/commit/de997b1e2fb31659b778465b0b874423377ac973
obsproject/obs-studio,https://github.com/obsproject/obs-studio,e4e3035,PatTheMav,2025-03-29T17:38:45Z,frontend: Add LogUploadDialog class,https://github.com/obsproject/obs-studio/commit/e4e3035661677f26af8c361098046983d3bba89a
obsproject/obs-studio,https://github.com/obsproject/obs-studio,272825b,PatTheMav,2025-03-31T14:36:09Z,"frontend: Add CrashHandler class  The CrashHandler class encapsulates all functionality around unsafe shutdown detection as well as crash log discovery and log upload.  Each (functional) CrashHandler should be initialized with an app launch UUID, which enables the handler to disambiguate a sentinel file for the current app launch from those of prior app launches.",https://github.com/obsproject/obs-studio/commit/272825b46af1cc7e709044638a77e2ea21bb643e
obsproject/obs-studio,https://github.com/obsproject/obs-studio,0717682,PatTheMav,2024-10-12T15:55:38Z,cmake: Enable interprocedural optimization for Release configuration  The built-in CMake variable will set the appropriate compiler flags for supported compilers and compiler versions.,https://github.com/obsproject/obs-studio/commit/07176822ad481fdaba01360b323439bbd93d62c7
obsproject/obs-studio,https://github.com/obsproject/obs-studio,2fe0385,tytan652,2025-04-02T06:06:05Z,linux-pipewire: Add aspect ratio to video capture format name,https://github.com/obsproject/obs-studio/commit/2fe0385d13b2b9ccd810a503d8b71c8d97202911
obsproject/obs-studio,https://github.com/obsproject/obs-studio,3cce28a,tytan652,2025-01-28T06:29:55Z,linux-pipewire: Add framerates to video capture format name,https://github.com/obsproject/obs-studio/commit/3cce28a1d3eef8dde2f1887501c0f898ae1ad5ca
obsproject/obs-studio,https://github.com/obsproject/obs-studio,c11253b,tytan652,2025-01-18T12:55:01Z,linux-pipewire: Use list-based format selector for video capture  Negotiation is now made with the user selected format.  Also fixes a typo in the name of a structure.,https://github.com/obsproject/obs-studio/commit/c11253bb088bd501b12998fb37fdcd6bf4743c35
obsproject/obs-studio,https://github.com/obsproject/obs-studio,8e2da12,Norihiro Kamae,2025-04-16T10:10:13Z,frontend: Fix multiview not decrementing showing state count  Also replaced a variable `numSrcs` with `multiviewNewScenes.size()` because they are always identical.,https://github.com/obsproject/obs-studio/commit/8e2da12c2a4720e04d29a2cb364c6db2e21f5197
obsproject/obs-studio,https://github.com/obsproject/obs-studio,86f98be,derrod,2024-10-18T16:40:37Z,obs-nvenc: Add SDK 13.0 features,https://github.com/obsproject/obs-studio/commit/86f98beaf14d6ba9d20cb864b3cd38e2e3ad40d6
obsproject/obs-studio,https://github.com/obsproject/obs-studio,c6650e2,derrod,2024-10-18T16:40:26Z,obs-nvenc-test: Add SDK 13.0 features and Blackwell,https://github.com/obsproject/obs-studio/commit/c6650e212caeff56432b8117e318c9fce46d774d
obsproject/obs-studio,https://github.com/obsproject/obs-studio,fd757d6,derrod,2024-10-03T17:24:46Z,obs-nvenc-test: Add error message for session limit being hit,https://github.com/obsproject/obs-studio/commit/fd757d6eddea4334796ecf455c1cc21d6df4b600
obsproject/obs-studio,https://github.com/obsproject/obs-studio,43e8d02,derrod,2024-10-03T16:03:17Z,obs-nvenc-test: Query device info even if NVENC fails,https://github.com/obsproject/obs-studio/commit/43e8d021172f79a498ecb9c886bbf2a16c709947
obsproject/obs-studio,https://github.com/obsproject/obs-studio,666b2c7,derrod,2024-10-03T16:02:56Z,obs-nvenc-test: Add device architecture to device info,https://github.com/obsproject/obs-studio/commit/666b2c7141b4431f86449a77105d7c25df8bb723
obsproject/obs-studio,https://github.com/obsproject/obs-studio,4c05fee,derrod,2024-12-29T16:56:33Z,frontend: Make Hybrid MOV the default for beta builds on macOS,https://github.com/obsproject/obs-studio/commit/4c05feed694c657736ddee1e76b19a6f456a4a57
obsproject/obs-studio,https://github.com/obsproject/obs-studio,0619198,derrod,2024-12-29T16:20:37Z,frontend: Add Hybrid MOV to format list,https://github.com/obsproject/obs-studio/commit/0619198c25ce625479e77f07b29990a2310f89a8
obsproject/obs-studio,https://github.com/obsproject/obs-studio,5f2a4e9,derrod,2024-12-29T16:20:19Z,obs-outputs: Add support for Hybrid MOV,https://github.com/obsproject/obs-studio/commit/5f2a4e976f9556799fbecdcbaf07ddf163350b5c
obsproject/obs-studio,https://github.com/obsproject/obs-studio,3e82c91,derrod,2024-12-29T09:34:30Z,obs-outputs: Remove FFmpeg-style timebase adjustment  Since OBS enforces a constant frame rate and monotonic timestamps this is not necessary for us.,https://github.com/obsproject/obs-studio/commit/3e82c919e55a4d4158b8d03f97318cc138256901
obsproject/obs-studio,https://github.com/obsproject/obs-studio,ef4c542,"Huts, Roman",2025-08-21T15:41:59Z,obs-ffmpeg: Add missing color range property setting for AMD AV1 encoder,https://github.com/obsproject/obs-studio/commit/ef4c5428508dcbba526f2c60084e29841361bf3f
obsproject/obs-studio,https://github.com/obsproject/obs-studio,164c921,pkv,2025-08-07T23:41:24Z,nv-filters: Remove from video fx header redundant define  These defines were defined twice ... due to a botched rebase. Formatting fixes too.  Signed-off-by: pkv <pkv@obsproject.com>,https://github.com/obsproject/obs-studio/commit/164c92100678db24e0674e29745e800855085d3a
obsproject/obs-studio,https://github.com/obsproject/obs-studio,50b0943,pkv,2025-08-09T13:51:55Z,"obs-filters: Purge NVIDIA Noise suppression  This completely removes what remained in obs-filters of NVIDIA FX, which have been moved to their own project.  Signed-off-by: pkv <pkv@obsproject.com>",https://github.com/obsproject/obs-studio/commit/50b0943cec648529e96354886f9b49d8cf13d983
obsproject/obs-studio,https://github.com/obsproject/obs-studio,8ae7693,pkv,2025-08-09T11:31:34Z,nv-filters: Premultiply correctly for Blur FX  Signed-off-by: pkv <pkv@obsproject.com>,https://github.com/obsproject/obs-studio/commit/8ae76937e0c794982c05cde704082126e3d583cb
obsproject/obs-studio,https://github.com/obsproject/obs-studio,f3ebb86,pkv,2025-08-09T08:20:52Z,nv-filters: Fix for size changes with video fx  The && should be a || when sizes are changed.  Signed-off-by: pkv <pkv@obsproject.com>,https://github.com/obsproject/obs-studio/commit/f3ebb86396caec4d89f1dc4dbb4599e09825309e
obsproject/obs-studio,https://github.com/obsproject/obs-studio,3baf045,pkv,2025-08-08T00:02:42Z,"nv-filters: For Blur FX, do not set mask image  It is not necessary to set the mask parameter for Blur FX. Setting it to NULL, will apply the blur to the whole image. This is not documented in the SDK but is returned when info about the FX is requested by the plugin to the SDK library.  Signed-off-by: pkv <pkv@obsproject.com>",https://github.com/obsproject/obs-studio/commit/3baf0456ba929060e88b37f2e20194426fac302f
obsproject/obs-studio,https://github.com/obsproject/obs-studio,ea96f87,pkv,2025-08-07T23:59:50Z,"nv-filters: Fix load of video FX during reset  The video FX must be reloaded whenever any of its settings have changed, including its the temporal state.  Signed-off-by: pkv <pkv@obsproject.com>",https://github.com/obsproject/obs-studio/commit/ea96f87ca1d277355d93e8eaa9e56cff0ead5a7c
obsproject/obs-studio,https://github.com/obsproject/obs-studio,ab55bb4,pkv,2025-08-08T01:56:31Z,nv-filters: Set NvVFX_Run to SYNC mode  The NvVFX_Run function can be run in SYNC or ASYNC mode; the SDK sample uses SYNC. This defines the magic numbers in an enum and sets the NvVFX_Run function to SYNC.  Signed-off-by: pkv <pkv@obsproject.com>,https://github.com/obsproject/obs-studio/commit/ab55bb46ead30a8fd9e905b37ba26e465aaa49f3
obsproject/obs-studio,https://github.com/obsproject/obs-studio,9475276,pkv,2025-08-07T23:55:49Z,nv-filters: Process Background Blur FX on same CudaStream as Background Removal FX  The SDK samples uses the same CudaStream for both FX. Do likewise which simplifies the code. (The Background Blur calls the Background Removal.)  Signed-off-by: pkv <pkv@obsproject.com>,https://github.com/obsproject/obs-studio/commit/94752762c796b2edd562691f11376cc4e3f414c6
obsproject/obs-studio,https://github.com/obsproject/obs-studio,2ad2367,pkv,2025-03-12T08:41:35Z,"nv-filters: Change Background Blur to perf mode  In order to alleviate the demands on GPU, the Background Blur is now set to Perf mode.  Signed-off-by: pkv <pkv@obsproject.com>",https://github.com/obsproject/obs-studio/commit/2ad236740f19f90a531bfc19602cbf3013428715
obsproject/obs-studio,https://github.com/obsproject/obs-studio,ffd3a2a,pkv,2025-03-09T09:21:12Z,obs-filters: Remove unused NVIDIA effect  The greenscreen effect was moved to nv-filters project. But this file failed to be removed.  Signed-off-by: pkv <pkv@obsproject.com>,https://github.com/obsproject/obs-studio/commit/ffd3a2a34e3017cd2cd1b4ac63d13a9014f173b8
obsproject/obs-studio,https://github.com/obsproject/obs-studio,cf6eb3f,pkv,2025-02-25T22:54:58Z,"nv-filters: Add chair removal option to background removal  This adds the following new options for background removal effect, namely the ability to remove the chair or leave it with the talking head. Requires sdk >= 0.7.6.  Signed-off-by: pkv <pkv@obsproject.com>",https://github.com/obsproject/obs-studio/commit/cf6eb3fd8950d64e51139c4124e34c452a16348d
obsproject/obs-studio,https://github.com/obsproject/obs-studio,b9f13cc,pkv,2025-02-25T22:36:18Z,"nv-filters: Add voice optimization for audio filters  This adds a new property for the audio filters: VAD (Voice Audio Data). When it is toggled, the effect will be optimized for voice processing. Noise suppression will ""remove low-volume noise and all non-speech data"" in the words of the SDK. Requires SDK >= 1.6.0.  Signed-off-by: pkv <pkv@obsproject.com>",https://github.com/obsproject/obs-studio/commit/b9f13cc360a48a2589bd6dd17602f1e7562ef4d1
obsproject/obs-studio,https://github.com/obsproject/obs-studio,5c57cb1,pkv,2025-02-25T21:44:56Z,"nv-filters: Enable new logger function for audio effects  This enables a new logger function introduced in SDK >= 1.6.0, which gives much more details about what is going on during the effect processing.  Signed-off-by: pkv <pkv@obsproject.com>",https://github.com/obsproject/obs-studio/commit/5c57cb1d8b790482362337eff42b6481d7bb1e34
obsproject/obs-studio,https://github.com/obsproject/obs-studio,a8b8abe,pkv,2025-02-25T19:07:05Z,"nv-filters: Enable new logger function for Video Effects  This enables a new logger function introduced in SDK >= 0.7.5, which gives much more details about what is going on during the effect processing.  Signed-off-by: pkv <pkv@obsproject.com>",https://github.com/obsproject/obs-studio/commit/a8b8abe69165ae7d77c75e07fa60e0bead084e8d
obsproject/obs-studio,https://github.com/obsproject/obs-studio,5e60e19,pkv,2025-01-14T19:28:39Z,nv-filters: Disable audio filter instead of destroying in case of issues  The audio filters are now disabled if an issue is detected; the filter is no longer destroyed. This avoids a call to destroy function within the filter. Signed-off-by: pkv <pkv@obsproject.com>,https://github.com/obsproject/obs-studio/commit/5e60e19de3559f7f8be8c7403d7a81529256feb1
obsproject/obs-studio,https://github.com/obsproject/obs-studio,1d01fe8,derrod,2024-05-18T19:30:16Z,libobs: Include all audio priming packets if closest is start,https://github.com/obsproject/obs-studio/commit/1d01fe85844201097569e1b01ac4dd0d0b392451
obsproject/obs-studio,https://github.com/obsproject/obs-studio,2bd23cd,tytan652,2024-07-09T13:21:27Z,"libobs,cmake: Replace vendored SIMD Everywhere by prefix/system install  SIMD Everywhere finder needs to be installed alongside libobs CMake package since its headers depends on it.  C++ cmath header is included on Windows on ARM to ensure that all math functions are correctly defined when included in C++ code. https://github.com/simd-everywhere/simde/issues/1304  macOS intrinsics is included to make sure that no redefinition error happens.",https://github.com/obsproject/obs-studio/commit/2bd23cd50d786d1c9eb160cbfabb004b327b37fa
obsproject/obs-studio,https://github.com/obsproject/obs-studio,570f264,tytan652,2024-07-09T13:20:48Z,cmake: Add a finder for SIMD Everywhere,https://github.com/obsproject/obs-studio/commit/570f2641f4ae0d9ec6accae9dea0d5ff80fd5a81
obsproject/obs-studio,https://github.com/obsproject/obs-studio,c1a6590,Dennis Sädtler,2025-08-04T08:26:23Z,obs-ffmpeg: Correct P-frame packet priority in AMF encoder,https://github.com/obsproject/obs-studio/commit/c1a65901f5fa9a13ff07dffee597dee7970dc750
obsproject/obs-studio,https://github.com/obsproject/obs-studio,8279094,Dennis Sädtler,2025-08-04T08:22:38Z,obs-nvenc: Set packet priority,https://github.com/obsproject/obs-studio/commit/8279094885fad58b0864bd6f6a098b81012fa5eb
obsproject/obs-studio,https://github.com/obsproject/obs-studio,b0b84ad,Dennis Sädtler,2025-08-04T07:45:21Z,libobs: Improve HEVC packet priority determination,https://github.com/obsproject/obs-studio/commit/b0b84ad4c9214604bc808e4f7211da25b6af9e25
obsproject/obs-studio,https://github.com/obsproject/obs-studio,01e7b78,Ryan Foster,2025-08-18T19:51:53Z,"libobs: Use os_oom() for out of memory crash  This change will make the crash stack clearer when OBS is crashing due to ""out of memory"" rather than an explicit bmalloc/brealloc(0) call.",https://github.com/obsproject/obs-studio/commit/01e7b78929f448f7947ec077e6d0c97809b39352
obsproject/obs-studio,https://github.com/obsproject/obs-studio,94a736f,Ryan Foster,2025-08-18T19:50:23Z,"libobs: Duplicate os_breakpoint to os_oom  Create a specific ""out of memory"" variant of os_breakpoint to facilitate troubleshooting and to differentiate an ""out of memory"" crash from a more generic crash.",https://github.com/obsproject/obs-studio/commit/94a736f1795c21afd0baa10c0692543b70c17dc5
obsproject/obs-studio,https://github.com/obsproject/obs-studio,e4c39eb,Dennis Sädtler,2025-06-26T17:26:41Z,"libobs: Allow interleaver to recover from temporary stalls  The interleaver requires packets with sufficiently high timestamps from all encoders to be available to send out before it outputs a packet. This means that if one encoder stalls and does not submit packets for a while the interleaver can end up with a permanent increase to its delay due to multiple packets being received from the other encoders without being able to send any.  This change introduces a recovery mechanism that relies on an upper bound for the amount of packets that may become ""streamable"" at a time being calculated, and flushing additional packets if that bound is violated.  The upper bound is based on the largest expected interval between packets and how many packets for each encoder could arrive within double that interval (to give us a bit of wiggle room since not all encoders will deliver frames 100% consistently).  This ensures that we still send data at a steady rate but allow the buffer to drain if it becomes larger than it needs to be.",https://github.com/obsproject/obs-studio/commit/e4c39eb648cf8a400f035386bfe7a7204a042ab6
obsproject/obs-studio,https://github.com/obsproject/obs-studio,5730f86,Sebastian Beckmann,2025-08-09T16:46:13Z,frontend/api: Remove obs_frontend_add_dock  Deprecated since cde5545f8f6c882187124a880403f0df48bef33c (30.0).,https://github.com/obsproject/obs-studio/commit/5730f860509ef8147792e4b23cc910d8c10b934f
obsproject/obs-studio,https://github.com/obsproject/obs-studio,b7c399f,Sebastian Beckmann,2025-08-09T16:45:05Z,libobs: Remove v1 scene item transform API  Deprecated since 4b138f674f982c1b85487ff0cf6e3cabd27a76b4 (30.1).,https://github.com/obsproject/obs-studio/commit/b7c399f6d801d210a565ad888455d9da9620ebc4
obsproject/obs-studio,https://github.com/obsproject/obs-studio,d283181,Sebastian Beckmann,2025-08-09T16:43:30Z,libobs: Remove obs_scene_sceneitem_from_source  Use obs_scene_enum_items to find sources instead.  Deprecated since 4dd3cf675834bbbd786a638f4427766021dd976d (31.0).,https://github.com/obsproject/obs-studio/commit/d283181c837a020913c58db8b4c509fa391974dd
obsproject/obs-studio,https://github.com/obsproject/obs-studio,163493d,Sebastian Beckmann,2025-08-09T16:42:28Z,libobs: Remove obs_view_get_video_info  Deprecated since fc891295b69c7a079d6168d686a222bf726ff171 (30.1).,https://github.com/obsproject/obs-studio/commit/163493d1e1c75facec65ed930e20c0bb36c7db60
obsproject/obs-studio,https://github.com/obsproject/obs-studio,be66c8a,Sebastian Beckmann,2025-08-09T16:41:35Z,libobs: Remove circlebuf  Deprecated since a4b8e1a6a987bf396fe49e0ad793405e78c89fca (30.1).,https://github.com/obsproject/obs-studio/commit/be66c8a7016cdb1f3872919106ceaa4144f807b8
obsproject/obs-studio,https://github.com/obsproject/obs-studio,53ad05d,PatTheMav,2025-07-25T22:08:45Z,libobs-opengl: Clean up macOS code with better error handling  Adds more error handling to macOS code and also updates the code to use more ObjC-appropriate code styling.  Variable names have been changed to be more expressive and platform- specific constants are used instead of custom FourCharCodes.,https://github.com/obsproject/obs-studio/commit/53ad05db9fa07ede1578787b9c3c30031f597a92
