项目名称,项目URL,提交ID,提交者,提交时间,提交信息,提交链接
valkey-io/valkey,https://github.com/valkey-io/valkey,6774d17,zhaozhao.zz,2025-08-29T02:47:10Z,"Fix the issue of incorrect commandlog metrics in the script (#2565)  In script, client will be replaced with its caller, so commandlog needs to use the metrics of the client that currently executing the command.  Signed-off-by: zhaozhao.zz <zhaozhao.zz@alibaba-inc.com>",https://github.com/valkey-io/valkey/commit/6774d173c4a3b931dae953158beb1f85af43e972
valkey-io/valkey,https://github.com/valkey-io/valkey,3db75f5,withRiver,2025-08-29T02:21:23Z,"Reset cluster related stats in CONFIG RESETSTATS (#2458)  Previously CONFIG RESETSTATS only resets the slot statistics in cluster part, this PR makes it reset cluster bus messages at well. Additionally, we also reset stat_cluster_links_buffer_limit_exceeded.  Now we will reset: - cluster_stats_messages_sent* - cluster_stats_messages_received* - total_cluster_links_buffer_limit_exceeded  Closes #2439.  Signed-off-by: Hongrui <2086160503@qq.com>",https://github.com/valkey-io/valkey/commit/3db75f5551cdf6da8aa27b719d52cce598fd0b54
valkey-io/valkey,https://github.com/valkey-io/valkey,88cd208,Binbin,2025-08-29T02:20:50Z,"Split SLOT_EXPORT_AUTHENTICATING into SEND and READ to avoid synchronous reading of auth response (#2494)  The old SLOT_EXPORT_AUTHENTICATING added in #1949, when processed by the source node, we will send the AUTH command and then reads the response. If the target node is blocked during this process, the source node will also be blocked. We should use a read handler to handle this. We split SLOT_EXPORT_AUTHENTICATING into SLOT_EXPORT_SEND_AUTH and SLOT_EXPORT_READ_AUTH_RESPONSE to avoid this issue.  Signed-off-by: Binbin <binloveplay1314@qq.com>",https://github.com/valkey-io/valkey/commit/88cd2086aef25183ae0c5fb8bc154d8206dd07f1
valkey-io/valkey,https://github.com/valkey-io/valkey,cf90acb,Marc Jakobi,2025-08-29T02:19:46Z,Correct path to gen-test-certs.sh in README.md (#2554)  Signed-off-by: Marc Jakobi <marc.jakobi@tiko.energy>,https://github.com/valkey-io/valkey/commit/cf90acbc6137ede7ae17fb1450c8aa19a62d163c
valkey-io/valkey,https://github.com/valkey-io/valkey,39fade4,Binbin,2025-08-29T02:18:45Z,"Do not migrate function in new atomic slot migration (#2547)  If all cluster nodes have functions, slot migration will fail since the target will return the function already exists error when doing the FUNCTION LOAD.  And in addition, the target's replica could panic when it executes the FUNCTION LOAD propagated from the primary (see propagation-error-behavior).  Introduced in #1949.  Signed-off-by: Binbin <binloveplay1314@qq.com>",https://github.com/valkey-io/valkey/commit/39fade42d11a22d4a13beb98d6e36adaa12ecba3
valkey-io/valkey,https://github.com/valkey-io/valkey,682fc0b,Binbin,2025-08-29T02:17:10Z,"Remove the trailing chars of the --cluster reshard log message in valkey-cli (#2560)  It prints an extra "": "" after the message, which is a bit weird, i thought it was printing cluster-bus port information, but it was not. ``` Moving slot 5458 from 127.0.0.1:30001 to 127.0.0.1:30003: Moving slot 5459 from 127.0.0.1:30001 to 127.0.0.1:30003: Moving slot 5460 from 127.0.0.1:30001 to 127.0.0.1:30003: ```  Signed-off-by: Binbin <binloveplay1314@qq.com>",https://github.com/valkey-io/valkey/commit/682fc0b4197311a2bc0ea2512151ee29a2b1d327
valkey-io/valkey,https://github.com/valkey-io/valkey,06cefc1,Viktor Söderqvist,2025-08-27T05:24:00Z,"Attempt to fix sub-replica getting out of sync (#2548)  Try to fix the failures seen for `test ""PSYNC2 #3899 regression: verify consistency""`.  This change resets the query buffer parser state in `replicationCachePrimary()` which is called when the connection to the primary is lost. Before #2092, this was done by `resetClient()`.  The solution was inspired by the discussion about the regression mentioned (discussion from 2017) and the related commits from that time: 6bc6bd4c384d2b87353c3f2bb552e3b44dd53a5b, 469d6e2b37e2913ecb673f910cdb7dbd3af18a67, c180bc7d98061fd59be54ca83b67abfd6ce65414.  Signed-off-by: Viktor Söderqvist <viktor.soderqvist@est.tech>",https://github.com/valkey-io/valkey/commit/06cefc181abbe458d59a0c4865670810a9cb65d3
valkey-io/valkey,https://github.com/valkey-io/valkey,1ba622b,Binbin,2025-08-27T02:17:48Z,Update tests/xxx/tmp/.gitignore to ignore everything (#2542)  Ingore everything on its own directory.  Signed-off-by: Binbin <binloveplay1314@qq.com>,https://github.com/valkey-io/valkey/commit/1ba622bad5369ece4e88946e7a9b1d65541bc8db
valkey-io/valkey,https://github.com/valkey-io/valkey,40fe422,Rain Valentine,2025-08-26T07:02:14Z,"deflake test: relax time requirement in hash ttl test (#2537)  tiny change. It failed once for me (a little time passed and it returned 2 seconds instead of 3), so I figured it's probably a little flaky for others too  ---------  Signed-off-by: Rain Valentine <rsg000@gmail.com>",https://github.com/valkey-io/valkey/commit/40fe4228992f39e31f1481f052ed6bc5c090353d
valkey-io/valkey,https://github.com/valkey-io/valkey,3086e61,Adam Fowler,2025-08-26T07:01:12Z,Update reply schema for LMOVE and BLMOVE (#2541)  Both LMOVE and BLMOVE can return null values because the source key is empty. PR changes include  - change the LMOVE reply_schema to include the possibility of a nil return value - Add comment to BLMOVE reply_schema to indicate it can return nil because the source does not exist  This fixes #2532  ---------  Signed-off-by: Adam Fowler <adamfowler71@gmail.com> Co-authored-by: Ran Shidlansik <ranshid@amazon.com>,https://github.com/valkey-io/valkey/commit/3086e61d4b06a81602fc74163eb7d4eb6b6bfe41
valkey-io/valkey,https://github.com/valkey-io/valkey,9d682ba,Ted Lyngmo,2025-08-25T10:24:34Z,bio.c: Organize all worker data in a struct (#2530)  This gets rid of the need to use a void* as a carrier for the worker number. Instead a pointer to the relevant worker data is passed to the started thread.  Fixes #2529  ---------  Signed-off-by: Ted Lyngmo <ted@lyncon.se>,https://github.com/valkey-io/valkey/commit/9d682bad0bb731de8e21e15e4a1795c73aee9d0d
valkey-io/valkey,https://github.com/valkey-io/valkey,9aeab8c,Madelyn Olson,2025-08-24T12:59:13Z,"Consistently use static_assert across code (#2538)  In C99, we had to use `#define static_assert(expr, lit) extern char __static_assert_failure[(expr) ? 1 : -1]` for static assertions. However, we now have native support for static_assert with _Static_assert. Previously one of the correct #defines was getting called first, setting it to _Static_assert, however after https://github.com/valkey-io/valkey/commit/65215e5378db7b47c3460567da134ab7f0bfeb58 the first import defining the symbol was ""serverassert.h"", which included the old style.  This change removes all unnecessary imports and always defines static_assert as _Static_assert.  Signed-off-by: Madelyn Olson <madelyneolson@gmail.com>",https://github.com/valkey-io/valkey/commit/9aeab8ccbac0ca4923676c749c98d0de4718c872
valkey-io/valkey,https://github.com/valkey-io/valkey,8c55547,Binbin,2025-08-22T19:08:20Z,"Don't allow slot migration to myself node (#2497)  This may result in meaningless slot migration job, we should return an error to user in advance to avoid operation error. Also `by myself` is not correct English grammar and `myself` is a internal code terminology, changed to `by this node`.  Was introduced in #1949.  ---------  Signed-off-by: Binbin <binloveplay1314@qq.com>",https://github.com/valkey-io/valkey/commit/8c55547999a980680997a2c0c2bd292a7112da9c
valkey-io/valkey,https://github.com/valkey-io/valkey,09fb436,Viktor Söderqvist,2025-08-22T14:02:27Z,"Optimize pipelining by parsing and prefetching multiple commands (#2092)  Instead of parsing only one command per client before executing it, parse multiple commands from the query buffer and batch-prefetch the keys accessed by the commands in the queue before executing them.  This is an optimization for pipelined commands, both with and without I/O threads. The optimization is currently disabled for the replication stream, due to failures (probably caused by how the replication offset is calculated based on the query buffer offset).  * When parsing commands from the input buffer, multiple commands are parsed and stored in a command queue per client. * In single-threaded mode (I/O threads off) keys are batch-prefetched before the commands in the queue are executed. Multi-key commands like MGET, MSET and DEL benefit from this even if pipelining is not used. * Prefetching when I/O threads are used does prefetching for multiple clients in parallel. This code takes client command queues into account, improving prefetching when pipelining is used. The batch size is controlled by the existing config `prefetch-batch-max-size` (default 16), which so far only was used together with I/O threads. The config is moved to a different section in `valkey.conf`. * When I/O threads are used and the maximum number of keys are prefetched, a client's command is executed, then the next one in the queue, etc. If there are more commands in the queue for which the keys have not been prefetched (say the client sends 16 pipelined MGET with 16 keys in each) keys for the next few commands in the queue are prefetched before the commands is executed if prefetching has not been done for the next command. (This utilizes the code path used in single-threaded mode.)  Code improvements:  * Decoupling of command parser state and command execution state:   * The variables reqtype, multibulklen and bulklen refer to the current     position in the query buffer. These are no longer reset in resetClient     (which runs after each command being executed). Instead, they are     reset in the parser code after each completely parsed command.   * The command parser code is partially decoupled from the client struct.     The query buffer is still one per client, but the resulting argument     vector is stored in caller-defined variables.  Fixes #2044  ---------  Signed-off-by: Viktor Söderqvist <viktor.soderqvist@est.tech> Signed-off-by: Madelyn Olson <madelyneolson@gmail.com> Co-authored-by: Madelyn Olson <madelyneolson@gmail.com>",https://github.com/valkey-io/valkey/commit/09fb436cf0e8804b1e16c8d83ccf9c27775e8742
valkey-io/valkey,https://github.com/valkey-io/valkey,ac51515,Binbin,2025-08-22T09:19:44Z,"Remove debug logging from cluster-flush-slot.tcl (#2535)  I believe this was a debug log at the time, and its printing was quite annoying locally. The test is quite simple so i think we can just remove it.  Signed-off-by: Binbin <binloveplay1314@qq.com>",https://github.com/valkey-io/valkey/commit/ac515159a1e79ada6e43ed49c9ed9cb11178c50d
valkey-io/valkey,https://github.com/valkey-io/valkey,a680407,Roshan Khatri,2025-08-22T00:31:17Z,"Adds benchmark on demand workflow (#2442)  # Adds On-demand Benchmark Workflow  This PR introduces a new GitHub Actions workflow that enables on-demand performance benchmarking for pull requests through label-based triggers. This uses the new framework [valkey-perf-benchmark](https://github.com/valkey-io/valkey-perf-benchmark) developed for standard benchmarks and PR benchmarking.  ## What is being added by this PR  - **Workflow File**: `.github/workflows/benchmark_on_label.yml` - **Trigger**: Activated when specific labels are added to PRs - **Supported Labels**:   - `run-benchmark` - Runs standard benchmarks    ## Features  ### On-Demand Execution - Benchmarks run only when explicitly requested via PR labels - No automatic execution to avoid unnecessary resource usage  ### Performance Comparison - Compares PR performance against the `unstable` baseline - Generates detailed comparison reports - Posts results directly as PR comments for easy review  ### Flexible Configuration - Currently uses github runners by will use dedicated performance runners (`ec2-perf-ubuntu-24`) - Configurable benchmark suites via JSON config files  ### Artifact Management - Uploads benchmark results as workflow artifacts - Preserves both baseline and PR metrics for analysis - Includes comparison markdown for offline review  ### Automatic Cleanup - Removes trigger labels after execution (success or failure) - Prevents accidental re-runs from stale labels  ## Usage  To run benchmarks on a PR:  1. Add the `run-benchmark` label for standalone and cluster, non-tls mode 2. Wait for the workflow to complete 3. Review results in the automated PR comment  This workflow enhances our CI/CD pipeline by providing easy access to performance testing without impacting regular development workflows.  ---------  Signed-off-by: Roshan Khatri <rvkhatri@amazon.com> Signed-off-by: Roshan Khatri <117414976+roshkhatri@users.noreply.github.com> Co-authored-by: Harkrishn Patro <bunty.hari@gmail.com>",https://github.com/valkey-io/valkey/commit/a68040789e7566ab2aabad28459fa07dad43db60
valkey-io/valkey,https://github.com/valkey-io/valkey,d2eee78,Allen Samuels,2025-08-21T20:09:22Z,"Module API: Add READONLY flag to ClientInfo.flags output structure (#2522)  * Add a flag `VALKEYMODULE_CLIENTINFO_FLAG_READONLY` to   `ValkeyModuleClientInfo.flags` and set it in   `ValkeyModule_GetClientInfoById()`. * Add an optimization for accessing the current client by ID, to avoid   looking it up in a radix tree.  Closes #2487  ---------  Signed-off-by: Allen Samuels <allenss@amazon.com>",https://github.com/valkey-io/valkey/commit/d2eee78a151884518441572c53fc378bf6689e81
valkey-io/valkey,https://github.com/valkey-io/valkey,85a0a01,Hanxi Zhang,2025-08-21T19:34:27Z,"Wait for log message occurrence in module test on message received (#2517)  ## Problem Test `Cluster module receive message API - VM_RegisterClusterMessageReceiver` fails sporadically in CI with ""Expected '2' to be equal to '1'"". The test failed in Daily CI 4 days ago but hasn't failed since, indicating flaky behavior that I cannot reproduce locally.   ## Hypothesis The failing line `assert_equal 2 [count_log_message 0 ""* <cluster> DONG (type 2) RECEIVED*""]` counts DONG message entries in node 0's log file and expects exactly 2. The failure suggests a possible race condition where there's a timing gap between when cluster statistics are updated and when the corresponding log entries become visible in the log file.   ## Solution Add `wait_for_condition` to ensure log messages are written before checking count:  ```tcl wait_for_condition 50 100 {     [count_log_message 0 ""* <cluster> DONG (type 2) RECEIVED*""] eq 2 } else {     fail ""node 1 didn't log 2 DONG messages"" }  ---------  Signed-off-by: Hanxi Zhang <hanxizh@amazon.com> Co-authored-by: Harkrishn Patro <bunty.hari@gmail.com>",https://github.com/valkey-io/valkey/commit/85a0a017d28c1471885a0e10c3c9c3be64c3e4e8
valkey-io/valkey,https://github.com/valkey-io/valkey,b8357e5,Sarthak Aggarwal,2025-08-21T18:02:29Z,"Fix slot range lists overlap to rewind the nested list again  (#2527)  In the current implementation, the second list was never rewound again once it was iterated. So for the first element of `ranges1`, `ranges2` was iterated fully. But when the second element of `ranges1` was processed, the `ranges2` was not rewound again.  With this change, for every element of `ranges1`, we start from the beginning for `ranges2`  Signed-off-by: Sarthak Aggarwal <sarthagg@amazon.com>",https://github.com/valkey-io/valkey/commit/b8357e5be83dd19411c77a4e5f1052a3f863e8c9
valkey-io/valkey,https://github.com/valkey-io/valkey,2db4eeb,Björn Svensson,2025-08-21T08:18:29Z,Remove temporary build correction for RDMA and libvalkey 0.1.0  Signed-off-by: Björn Svensson <bjorn.a.svensson@est.tech>,https://github.com/valkey-io/valkey/commit/2db4eeb1fcd8316a792476c3023e705be24fdd70
valkey-io/valkey,https://github.com/valkey-io/valkey,11780db,Björn Svensson,2025-08-21T08:30:55Z,Update deps/libvalkey to version 0.2.1  Squashed 'deps/libvalkey/' changes from abcd27fbf..b012f8e85  b012f8e85 Release 0.2.1 9e10acbf7 Fix duplicate Acks for RDMA events. (#229) 1eadedf48 Remove the unused valDup API from dict a449f0ea1 Don't expose internal functions in shared libraries (#205) 178e350c7 Cluster code cleanup (#216) 4020396c8 Fix `unused-parameter` warning when building with `NDEBUG` (#212) 99aa158bc Use existing connections for blocking slotmap updates (#199) 969a8c546 Fix dependency issue with RDMA (#201) ...  git-subtree-dir: deps/libvalkey git-subtree-split: b012f8e85a9cc2c68bc2be982a4f6545c15042f0  Signed-off-by: Björn Svensson <bjorn.a.svensson@est.tech>,https://github.com/valkey-io/valkey/commit/11780db513b14034b3a314d4d4e5f52a3be44477
valkey-io/valkey,https://github.com/valkey-io/valkey,84fd626,asagegeLiu,2025-08-21T00:18:44Z,Refactor scanLaterList to fix latency issue (#2514),https://github.com/valkey-io/valkey/commit/84fd6264190094c045de488308b905853683d135
valkey-io/valkey,https://github.com/valkey-io/valkey,c6c91d1,Ted Lyngmo,2025-08-20T20:48:31Z,Fix assumptions that pthread functions set errno (#2526)  pthread functions return the error instead of setting errno.  Fixes #2525  Signed-off-by: Ted Lyngmo <ted@lyncon.se>,https://github.com/valkey-io/valkey/commit/c6c91d152fb706da9c7d40b7ed5dfd7216a88b5d
valkey-io/valkey,https://github.com/valkey-io/valkey,ab3ee2c,Sarthak Aggarwal,2025-08-20T18:16:37Z,Fix total test count while running over loop (#2524)  Command: `./runtest --single unit/bitops --loops 3`  Unstable  ``` [ignore]: large memory flag not provided [-1/1 done]: unit/bitops (4 seconds) [ignore]: large memory flag not provided [0/1 done]: unit/bitops (4 seconds) [ignore]: large memory flag not provided [1/1 done]: unit/bitops (4 seconds)                     The End  Execution time of different units:   4 seconds - unit/bitops   4 seconds - unit/bitops   4 seconds - unit/bitops ```  After fix  ``` [1/3 done]: unit/bitops (4 seconds) [ignore]: large memory flag not provided [2/3 done]: unit/bitops (4 seconds) [ignore]: large memory flag not provided [3/3 done]: unit/bitops (4 seconds)                     The End  Execution time of different units:   4 seconds - unit/bitops   4 seconds - unit/bitops   4 seconds - unit/bitops ```  Signed-off-by: Sarthak Aggarwal <sarthagg@amazon.com>,https://github.com/valkey-io/valkey/commit/ab3ee2ca9530ba527959fa36b1c3b0222a2675a6
valkey-io/valkey,https://github.com/valkey-io/valkey,23112fa,Ran Shidlansik,2025-08-20T11:54:11Z,fix hsetex handling of wrong number of fields (#2509)  currently hsetex is verifying the number of fields matches the provided number of fields by using div. instead it can match to the multiplication in order to prevent rounding the verified value down.  ---------  Signed-off-by: Ran Shidlansik <ranshid@amazon.com> Co-authored-by: Madelyn Olson <madelyneolson@gmail.com>,https://github.com/valkey-io/valkey/commit/23112fad87e65380d4774233fc0fa1edb65c9364
valkey-io/valkey,https://github.com/valkey-io/valkey,39d5c6e,Ran Shidlansik,2025-08-20T09:34:58Z,Fix vset unittest compilation warning for bad signedness comparison (#2523)  Signed-off-by: Ran Shidlansik <ranshid@amazon.com>,https://github.com/valkey-io/valkey/commit/39d5c6e6ee46b839c935974eb7ff4de7d87399f7
valkey-io/valkey,https://github.com/valkey-io/valkey,3b69618,Harkrishn Patro,2025-08-20T04:38:46Z,Update pong_received time via gossip only if the node is healthy from our view (#2512),https://github.com/valkey-io/valkey/commit/3b6961814b027b864b340c4e5c7dd41a2fc34cd2
valkey-io/valkey,https://github.com/valkey-io/valkey,e3bfc5f,Harkrishn Patro,2025-08-20T00:28:51Z,"Atomically update cluster and replication layer while marking self node as primary (#2510)  Fixes: #2460  With this change we avoid divergence in cluster and replication layer view. I've observed node can be marked as primary in cluster while it can be marked as replica in replication layer view and have a active replication link. Without this change, we used to end up in a invalid replica chain in replication layer.  ---------  Signed-off-by: Harkrishn Patro <harkrisp@amazon.com>",https://github.com/valkey-io/valkey/commit/e3bfc5f8c7146198ef2eb749866d7226f3b098d8
valkey-io/valkey,https://github.com/valkey-io/valkey,c8548f6,Seungmin Lee,2025-08-19T22:24:26Z,"Skip failure reports for already failed nodes (#2434)  This change avoids additional failure report creation if the node is already marked as failed. The failure report count has never been used after a node has been marked as failed. So, there is no value addition in maintaining it further. This reduces operation of both add and delete failure report. Hence, the performance benefit.  We can observe an avg. of 10% reduction in p99 CPU utilization (in a 2000 nodes cluster (1000 primary/ 1000 replica) with 330 nodes in failed state with this change.  ---------  Signed-off-by: Seungmin Lee <sungming@amazon.com>",https://github.com/valkey-io/valkey/commit/c8548f65d23725bcd70b92f4e06844274a940f40
valkey-io/valkey,https://github.com/valkey-io/valkey,eae23ba,Hanxi Zhang,2025-08-19T20:49:25Z,"Add auto-author-assign workflow (#2410)  Fixes #2372  ## Description  This PR adds an automated workflow that assigns PR authors to their own pull requests when opened or reopened.  ## Changes  - Added `.github/workflows/auto-author-assign.yml` workflow - Uses `toshimaru/auto-author-assign@v2.1.1` action - Triggers on `pull_request_target` events (opened, reopened) - Requires `pull-requests: write` permission  ## Benefits  - Improves PR tracking and organization - Automatically assigns responsibility to PR authors - Reduces manual assignment overhead for maintainers - Helps contributors track their own PRs more easily  ## Testing  ✅ **Tested on my fork before submission:**  1. Merged the workflow into my fork's unstable branch 2. Created a test PR within my fork 3. Verified that I was automatically assigned as the assignee 4. Screenshot showing successful auto-assignment: <img width=""1278"" height=""684"" alt=""Screenshot 2025-08-01 at 3 39 05 PM"" src=""https://github.com/user-attachments/assets/9ad643be-5eac-4ad6-bec7-184cf22e9cbd"" />  The workflow executed successfully and assigned me to the test PR as expected.  ---------  Signed-off-by: Hanxi Zhang <hanxizh@amazon.com>",https://github.com/valkey-io/valkey/commit/eae23babe63e4e32498da3d16e4cb368354c044b
valkey-io/valkey,https://github.com/valkey-io/valkey,a97d584,Binbin,2025-08-19T13:01:56Z,"Fix slot-info expand not working, kvstoreHashtableExpand always creat… (#2466)  If we want to expand kvstoreHashtableExpand, we need to make sure the hashtable exists. Currently, when processing RDB slot-info, our expand has no effect because the hashtable does not exist (we initialize it only when we need it).  We also update kvstoreExpand to use the kvstoreHashtableExpand to make sure there is only one code path. Also see #1199 for more details.  Signed-off-by: Binbin <binloveplay1314@qq.com>",https://github.com/valkey-io/valkey/commit/a97d584cc20013c6797843a30633f0f268874d28
valkey-io/valkey,https://github.com/valkey-io/valkey,bb81f8d,Ran Shidlansik,2025-08-19T08:31:37Z,fix hash ignore ttl management during active expiry (#2505)  several fixes: 1. fix not using bool input type for hashTypeIgnoreTTL - probably lost during the 3 HFE PR merges 2. remove vset change hashtable encoding to single - The current code is a bug. The entry is probably expired (or about to be expired soon) so we can leave it as a hashtable till it does. 3. enable incremental rehashing for volatile item keys kvstore - This is the center issue of this PR. without it the activeexpiry might not scan the kvstore which is very fragmented with lots of empty buckets.  ---------  Signed-off-by: Ran Shidlansik <ranshid@amazon.com>,https://github.com/valkey-io/valkey/commit/bb81f8d14f6b32df7b4798dd8e35f45f257f6968
valkey-io/valkey,https://github.com/valkey-io/valkey,fb9503b,Binbin,2025-08-19T02:26:58Z,CLUSTER SYNCSLOTS ESTABLISH added source node == myself check (#2500)  Minor cleanup.  Signed-off-by: Binbin <binloveplay1314@qq.com>,https://github.com/valkey-io/valkey/commit/fb9503bfd12bf8331647b151c3af0b28fa4d7e7a
