项目名称,项目URL,提交ID,提交者,提交时间,提交信息,提交链接
valkey-io/valkey,https://github.com/valkey-io/valkey,04d0bba,zhaozhao.zz,2025-12-04T17:34:52Z,support whole cluster info for INFO command in cluster section (#2876)  Allow users to more easily get cluster information.  Signed-off-by: zhaozhao.zz <zhaozhao.zz@alibaba-inc.com>,https://github.com/valkey-io/valkey/commit/04d0bba398afe056a7a269ae46a81da574020ada
valkey-io/valkey,https://github.com/valkey-io/valkey,3d65a4a,Ouri Half,2025-12-04T17:10:09Z,"Fix deadlock in IO thread shutdown during panic (#2898)  ## Problem IO thread shutdown can deadlock during server panic when the main thread calls `pthread_cancel()` while the IO thread holds its mutex, preventing the thread from observing the cancellation.  ## Solution   Release the IO thread mutex before cancelling to ensure clean thread termination.  ## Testing Reproducer: ``` bash ./src/valkey-server --io-threads 2 --enable-debug-command yes ./src/valkey-cli debug panic ```  Before: Server hangs indefinitely After: Server terminates cleanly  Signed-off-by: Ouri Half <ourih@amazon.com>",https://github.com/valkey-io/valkey/commit/3d65a4aecdcfdd72ff1657317657a4cd665bba5f
valkey-io/valkey,https://github.com/valkey-io/valkey,c90e634,Roshan Khatri,2025-12-04T16:33:21Z,"Add PR and Release benchmark with new changes in framework (#2871)  This adds the workflow improvements for PR and Release benchmark where it runs on `c8g.metal-48xl` for `ARM64` and `c7i.metal-48xl` for `X86`.  ``` Cluster mode: disabled TLS: disabled io-threads: 1, 9 Pipelining: 1, 10 Clients: 1600 Benchmark Treads: 90 Data size: 16 ,96 Commands: SET, GET ```  c8g.metal-48xl Spec: https://aws.amazon.com/ec2/instance-types/c8g/ c7i.metal.48xl Spec: https://aws.amazon.com/ec2/instance-types/c7i/  ``` vCPU: 192 NUMA nodes: 2 Memory (GiB): 384 Network Bandwidth (Gbps): 50 ```  PR benchmarking will be executed on **ARM64** machine as it has been seen to be more consistent. Additionally, it runs 5 iterations for each tests and posts the average and other statistical metrics like - CI99%: 99% Confidence Interval - range where the true population mean is likely to fall - PI99%: 99% Prediction Interval - range where a single future observation is likely to fall - CV: Coefficient of Variation - relative variability (σ/μ × 100%)  _Note: Values with (n=X, σ=Y, CV=Z%, CI99%=±W%, PI99%=±V%) indicate averages from X runs with standard deviation Y, coefficient of variation Z%, 99% confidence interval margin of error ±W% of the mean, and 99% prediction interval margin of error ±V% of the mean. CI bounds [A, B] and PI bounds [C, D] show the actual interval ranges._  For comparing between versions, it adds a workflow which runs on both **ARM64** and **X86** machine. It will also post the comparison between the versions like this: https://github.com/valkey-io/valkey/issues/2580#issuecomment-3399539615  ---------  Signed-off-by: Roshan Khatri <rvkhatri@amazon.com> Signed-off-by: Roshan Khatri <117414976+roshkhatri@users.noreply.github.com>",https://github.com/valkey-io/valkey/commit/c90e634f114a0ddecf92eacea4f35e269f89e997
valkey-io/valkey,https://github.com/valkey-io/valkey,70196ee,Rain Valentine,2025-12-03T17:15:45Z,"Add safe iterator tracking in hashtable to prevents invalid access on hashtable delete (#2807)  This makes it safe to delete hashtable while a safe iterator is iterating it. This currently isn't possible, but this improvement is required for fork-less replication #1754 which is being actively worked on.  We discussed these issues in #2611 which guards against a different but related issue: calling hashtableNext again after it has already returned false.  I implemented a singly linked list that hashtable uses to track its current safe iterators. It is used to invalidate all associated safe iterators when the hashtable is released. A singly linked list is acceptable because the list length is always very small - typically zero and no more than a handful.  Also, renames the internal functions:      hashtableReinitIterator -> hashtableRetargetIterator     hashtableResetIterator -> hashtableCleanupIterator  ---------  Signed-off-by: Rain Valentine <rsg000@gmail.com> Signed-off-by: Viktor Söderqvist <viktor.soderqvist@est.tech> Co-authored-by: Viktor Söderqvist <viktor.soderqvist@est.tech>",https://github.com/valkey-io/valkey/commit/70196ee20f1b84d5420acfdfe06c354b01c224dd
valkey-io/valkey,https://github.com/valkey-io/valkey,8ec9381,Harkrishn Patro,2025-12-03T16:17:26Z,Send duplicate multi meet packet only for node which supports it (#2840)  This prevents crashes on the older nodes in mixed clusters where some nodes are running 8.0 or older. Mixed clusters often exist temporarily during rolling upgrades.  Fixes: #2341   Signed-off-by: Harkrishn Patro <harkrisp@amazon.com>,https://github.com/valkey-io/valkey/commit/8ec93819746b14b789205ab2115d62f3dd2e3c54
valkey-io/valkey,https://github.com/valkey-io/valkey,c8341d4,Murad Shahmammadli,2025-12-03T16:07:04Z,Replace strcmp with byte-by-byte comparison in valkey-check-aof (#2809)  Fixes #2792  Replace strcmp with byte-by-byte comparison to avoid accidental heap-buffer-overflow errors.  Signed-off-by: murad shahmammadli <shmurad@amazon.com> Co-authored-by: murad shahmammadli <shmurad@amazon.com>,https://github.com/valkey-io/valkey/commit/c8341d416534e219b12daf79fecc93e1fe76f956
valkey-io/valkey,https://github.com/valkey-io/valkey,2e8fba4,Roshan Khatri,2025-12-02T20:40:20Z,[Test Fix] flaky benchmark test for warmup (#2890)  Fixes: https://github.com/valkey-io/valkey/issues/2859 Increased the warmup to 2 sec so we can verify that it runs more number of commands than the actual benchmark.  Signed-off-by: Roshan Khatri <rvkhatri@amazon.com>,https://github.com/valkey-io/valkey/commit/2e8fba49a21b5dcd13defa6b96ad0f4ecad44142
valkey-io/valkey,https://github.com/valkey-io/valkey,1b5f245,Jim Brunner,2025-12-02T18:14:33Z,"Refactor of LFU/LRU code for modularity (#2857)  General cleanup on LRU/LFU code. Improve modularity and maintainability.  Specifically: * Consolidates the mathematical logic for LRU/LFU into `lrulfu.c`, with an API in `lrulfu.h`. Knowledge of the LRU/LFU implementation was previously spread out across `db.c`, `evict.c`, `object.c`, `server.c`, and `server.h`. * Separates knowledge of the LRU from knowledge of the object containing the LRU value. `lrulfu.c` knows about the LRU/LFU algorithms, without knowing about the `robj`. `object.c` knows about the `robj` without knowing about the details of the LRU/LFU algorithms. * Eliminated `server.lruclock`, instead using `server.unixtime`. This also eliminates the periodic need to call `mstime()` to maintain the lru clock. * Fixed a minor computation bug in the old `LFUTimeElapsed` function (off by 1 after rollover). * Eliminate specific IF checks for rollover, using defined behavior for unsigned rollover instead. * Fixed a bug in `debug.c` which would perform LFU modification on an LRU value.  ---------  Signed-off-by: Jim Brunner <brunnerj@amazon.com> Co-authored-by: Ran Shidlansik <ranshid@amazon.com>",https://github.com/valkey-io/valkey/commit/1b5f245eaecf274f655763f20e30ed4f1966ff41
valkey-io/valkey,https://github.com/valkey-io/valkey,853d111,Zhijun Liao,2025-12-02T14:03:47Z,"Build: Support `make test` when PROG_SUFFIX is used (#2885)  Closes #2883  Support a new environment variable `VALKEY_PROG_SUFFIX` in the test framework, which can be used for running tests if the binaries are compiled with a program suffix. For example, if the binaries are compiled using `make PROG_SUFFIX=-alt` to produce binaries named valkey-server-alt, valkey-cli-alt, etc., run the tests against these binaries using `VALKEY_PROG_SUFFIX=-alt ./runtest` or simply using `make test`.  Now the test with the make variable `PROG_SUFFIX` works well.  ``` % make PROG_SUFFIX=""-alt"" 		... 		... 		CC trace/trace_aof.o     LINK valkey-server-alt     INSTALL valkey-sentinel-alt     CC valkey-cli.o     CC serverassert.o     CC cli_common.o     CC cli_commands.o     LINK valkey-cli-alt     CC valkey-benchmark.o     LINK valkey-benchmark-alt     INSTALL valkey-check-rdb-alt     INSTALL valkey-check-aof-alt  Hint: It's a good idea to run 'make test' ;) %  % make test                                                                 cd src && /Library/Developer/CommandLineTools/usr/bin/make test     CC Makefile.dep     CC release.o     LINK valkey-server-alt     INSTALL valkey-check-aof-alt     INSTALL valkey-check-rdb-alt     LINK valkey-cli-alt     LINK valkey-benchmark-alt Cleanup: may take some time... OK Starting test server at port 21079 [ready]: 39435 Testing unit/pubsub ```  Signed-off-by: Zhijun <dszhijun@gmail.com>",https://github.com/valkey-io/valkey/commit/853d111f479043603385aeb674273c7b0099fe82
valkey-io/valkey,https://github.com/valkey-io/valkey,3fd0942,Zhijun Liao,2025-12-02T13:14:28Z,"Refactor TCL reference to support running tests with CMake (#2816)  Historically, Valkey’s TCL test suite expected all binaries (src/valkey-server, src/valkey-cli, src/valkey-benchmark, etc.) to exist under the src/ directory. This PR enables Valkey TCL tests to run seamlessly after a CMake build — no manual symlinks or make build required.  The test framework accepts a new environment variable `VALKEY_BIN_DIR` to look for the binaries.  CMake will copy all TCL test entrypoints (runtest, runtest-cluster, etc.) into the CMake build dir (e.g. `cmake-build-debug`) and insert `VALKEY_BIN_DIR` into these. Now we can either do ./cmake-build-debug/runtest at the project root or ./runtest at the Cmake dir to run all tests.  A new CMake post-build target prints a friendly reminder after successful builds, guiding developers on how to run tests with their CMake binaries:  ``` Hint: It is a good idea to run tests with your CMake-built binaries ;)       ./cmake-build-debug/runtest  Build finished ```  A helper TCL script `tests/support/set_executable_path.tcl` is added to support this change, which gets called by all test entrypoints: `runtest`, `runtest-cluster`, `runtest-sentinel`.  ---------  Signed-off-by: Zhijun <dszhijun@gmail.com>",https://github.com/valkey-io/valkey/commit/3fd0942279cf4f0eb9f7f52659af2901bde84831
valkey-io/valkey,https://github.com/valkey-io/valkey,825d19f,Daniil Kashapov,2025-12-02T12:33:20Z,Make all ACL categories explicit in JSON files (#2887)  Resolves #417  ---------  Signed-off-by: Daniil Kashapov <daniil.kashapov.ykt@gmail.com>,https://github.com/valkey-io/valkey/commit/825d19fb09ad637499d8cd8d851abd58d4929191
valkey-io/valkey,https://github.com/valkey-io/valkey,4a0e20b,Binbin,2025-12-01T02:20:32Z,"Handle failed psync log when there is no replication backlog (#2886)  This crash was introduced in #2877, we will crash when there is no replication backlog.  Signed-off-by: Binbin <binloveplay1314@qq.com>",https://github.com/valkey-io/valkey/commit/4a0e20bbc91da1e776c619df741e0e9377193602
valkey-io/valkey,https://github.com/valkey-io/valkey,a087cc1,Binbin,2025-11-29T04:20:34Z,"Add psync offset range information to the failed psync log (#2877)  Although we can infer this infomartion from the replica logs, i think this still would be useful to see this information directly in the primary logs.  So now we can see the psync offset range when psync fails and then we can analyze and adjust the value of repl-backlog-size.  Signed-off-by: Binbin <binloveplay1314@qq.com>",https://github.com/valkey-io/valkey/commit/a087cc1132cbe2ae17d6063a32c1543f8a31c39e
valkey-io/valkey,https://github.com/valkey-io/valkey,761fba2,Viktor Söderqvist,2025-11-28T09:35:53Z,Fix persisting missing make variables (#2881)  Persist USE_FAST_FLOAT and PROG_SUFFIX to prevent a complete rebuild next time someone types make or make test without specifying variables.  Fixes #2880  Signed-off-by: Viktor Söderqvist <viktor.soderqvist@est.tech>,https://github.com/valkey-io/valkey/commit/761fba2e9de2b1cf4f9081220565f78f1922b7c9
valkey-io/valkey,https://github.com/valkey-io/valkey,d16788e,Binbin,2025-11-27T02:39:42Z,"Fix discarded-qualifiers warnings reported by fedorarawhide (#2874)  fedorarawhide CI reports these warnings: ``` networking.c: In function 'afterErrorReply': networking.c:821:30: error: initialization discards 'const' qualifier from pointer target type [-Werror=discarded-qualifiers]   821 |             char *spaceloc = memchr(s, ' ', len < 32 ? len : 32); ```  Signed-off-by: Binbin <binloveplay1314@qq.com>",https://github.com/valkey-io/valkey/commit/d16788e52dfe1c80627975bb503d5e9ba6ae58ae
valkey-io/valkey,https://github.com/valkey-io/valkey,faac14a,Zhijun Liao,2025-11-26T13:52:17Z,"Cluster: Optimize slot bitmap iteration from per-bit to 64-bit word scan (#2781)  In functions `clusterSendFailoverAuthIfNeeded` and `clusterProcessPacket`, we iterate through **every slot bit** sequentially in the form of `for (int j = 0; j < CLUSTER_SLOTS; j++)`, performing 16384 checks even when only a few bits were set, and thus causing unnecessary loop overhead.  This is particularly wasteful in function `clusterSendFailoverAuthIfNeeded` where we need to ensure the sender's claimed slots all have up-to-date config epoch. Usually healthy senders would meet such condition, and thus we normally need to exhaust the for loop of 16384 checks.  The proposed new implementation loads 64 bits (8 byte word) at a time and skips empty words completely, therefore only performing 256 checks.  ---------  Signed-off-by: Zhijun <dszhijun@gmail.com>",https://github.com/valkey-io/valkey/commit/faac14ab9c8430057490f64ca979492057bb4d40
valkey-io/valkey,https://github.com/valkey-io/valkey,56ab3c4,Roshan Khatri,2025-11-26T13:19:53Z,"Adds HGETDEL Support to Valkey (#2851)  Fixes this: https://github.com/valkey-io/valkey/issues/2850 Adds support for HGETDEL to Valkey and aligns with Redis 8.0 feature. Maintains syntax compatibility Retrieves all the values, and null if fields dont exists and deletes once retrieved. ``` 127.0.0.1:6379> HGETDEL key FIELDS numfields field [ field ... ] ``` ``` 127.0.0.1:6379> HSET foo field1 bar1 field2 bar2 field3 bar3 (integer) 3 127.0.0.1:6379> HGETDEL foo FIELDS 1 field2 1) ""bar2"" 127.0.0.1:6379> HGETDEL foo FIELDS 1 field2 1) (nil) 127.0.0.1:6379> HGETALL foo 1) ""field1"" 2) ""bar1"" 3) ""field3"" 4) ""bar3"" 127.0.0.1:6379>  HGETDEL foo FIELDS 2 field2 field3 1) (nil) 2) ""bar3"" 127.0.0.1:6379> HGETALL foo 1) ""field1"" 2) ""bar1"" 127.0.0.1:6379> HGETDEL foo FIELDS 3 field1 non-exist-field (error) ERR syntax error 127.0.0.1:6379> HGETDEL foo FIELDS 2 field1 non-exist-field 1) ""bar1"" 2) (nil) 127.0.0.1:6379> HGETALL foo (empty array) 127.0.0.1:6379>  ```  ---------  Signed-off-by: Roshan Khatri <rvkhatri@amazon.com> Signed-off-by: Ran Shidlansik <ranshid@amazon.com> Co-authored-by: Ran Shidlansik <ranshid@amazon.com>",https://github.com/valkey-io/valkey/commit/56ab3c4a813564e50a00cb2fd80e1beaea4af506
valkey-io/valkey,https://github.com/valkey-io/valkey,9562bdc,Ran Shidlansik,2025-11-26T08:31:28Z,"Align the complexity description for all multi field HFE commands docs (#2875)  When we added the Hash Field Expiration feature in Valkey 9.0, some of the new command docs included complexity description of O(1) even tough they except multiple arguments. (see discussion in https://github.com/valkey-io/valkey/pull/2851#discussion_r2535684985) This PR does: 1. align all the commands to the same description 2. fix the complexity description of some commands (eg HSETEX and HGETEX)  ---------  Signed-off-by: Ran Shidlansik <ranshid@amazon.com>",https://github.com/valkey-io/valkey/commit/9562bdc0ab185554d013e9406674aea1918dbc30
valkey-io/valkey,https://github.com/valkey-io/valkey,da3c43d,Zhijun Liao,2025-11-26T01:07:21Z,"Additional log information for cluster accept handler and message processing (#2815)  Enhance debugging for cluster logs  [1] Add human node names in cluster tests so that we can easily understand which nodes we are interacting with:  ``` pong packet received from: 92a960ffd62f1bd04efeb260b30fe9ca6b9294ed (R4) from client: :0 node 92a960ffd62f1bd04efeb260b30fe9ca6b9294ed (R4) announces that it is a primary in shard c6d1152caee49a5e70cb4b77d1549386078be603 Reconfiguring node 92a960ffd62f1bd04efeb260b30fe9ca6b9294ed (R4) as primary for shard c6d1152caee49a5e70cb4b77d1549386078be603 Configuration change detected. Reconfiguring myself as a replica of node 92a960ffd62f1bd04efeb260b30fe9ca6b9294ed (R4) in shard c6d1152caee49a5e70cb4b77d1549386078be603 ```    [2] Currently there are logs showing the address of incoming connections:  ``` Accepting cluster node connection from 127.0.0.1:59956 Accepting cluster node connection from 127.0.0.1:59957 Accepting cluster node connection from 127.0.0.1:59958 Accepting cluster node connection from 127.0.0.1:59959 ```  but we have no idea which nodes these connections refer to. I added a logging statement when the node is set to the inbound link connection.  ``` Bound cluster node 92a960ffd62f1bd04efeb260b30fe9ca6b9294ed (R4) to connection of client 127.0.0.1:59956 ```    [3] Add a debug log when processing a packet to show the packet type, sender node name, and sender client port (this also has the benefit of telling us whether this is an inbound or outbound link).  ``` pong packet received from: 92a960ffd62f1bd04efeb260b30fe9ca6b9294ed (R4) from client: :0 ping packet received from: 92a960ffd62f1bd04efeb260b30fe9ca6b9294ed (R4) from client: 127.0.0.1:59973 fail packet received from: 92a960ffd62f1bd04efeb260b30fe9ca6b9294ed (R4) from client: 127.0.0.1:59973 auth-req packet received from: 92a960ffd62f1bd04efeb260b30fe9ca6b9294ed (R4) from client: 127.0.0.1:59973 ```  ---------  Signed-off-by: Zhijun <dszhijun@gmail.com>",https://github.com/valkey-io/valkey/commit/da3c43d76bb8667df43e53227608e1b3344d0f1c
valkey-io/valkey,https://github.com/valkey-io/valkey,e5de417,Leon Anavi,2025-11-25T20:23:32Z,Fix build on 32-bit ARM by only using NEON on AArch64 (#2873)  Only enable `HAVE_ARM_NEON` on AArch64 because it supports vaddvq and all needed compiler intrinsics.  Fixes the following error when building for machine `qemuarm` using the Yocto Project and OpenEmbedded:  ``` | bitops.c: In function 'popcountNEON': | bitops.c:219:23: error: implicit declaration of function 'vaddvq_u16'; did you mean 'vaddq_u16'? [-Wimplicit-function-declaration] |   219 |         uint32_t t1 = vaddvq_u16(sc); |       |                       ^~~~~~~~~~ |       |                       vaddq_u16 | bitops.c:225:14: error: implicit declaration of function 'vaddvq_u8'; did you mean 'vaddq_u8'? [-Wimplicit-function-declaration] |   225 |         t += vaddvq_u8(vcntq_u8(vld1q_u8(p))); |       |              ^~~~~~~~~ |       |              vaddq_u8 ```  More details are available in the following log: https://errors.yoctoproject.org/Errors/Details/889836/  Signed-off-by: Leon Anavi <leon.anavi@konsulko.com>,https://github.com/valkey-io/valkey/commit/e5de417f1e8d2b2bb61257e842f21a74b9352746
valkey-io/valkey,https://github.com/valkey-io/valkey,dd2827a,jiegang0219,2025-11-25T11:25:39Z,"Add support for asynchronous release to replicaKeysWithExpire on writable replica (#2849)  ## Problem When executing `FLUSHALL ASYNC` on a **writable replica** that has a large number of expired keys directly written to it, the main thread gets blocked for an extended period while synchronously releasing the `replicaKeysWithExpire` dictionary.   ## Root Cause `FLUSHALL ASYNC` is designed for asynchronous lazy freeing of core data structures, but the release of `replicaKeysWithExpire` (a dictionary tracking expired keys on replicas) still happens synchronously in the main thread. This synchronous operation becomes a bottleneck when dealing with massive key volumes, as it cannot be offloaded to the lazyfree background thread.  This PR addresses the issue by moving the release of `replicaKeysWithExpire` to the lazyfree background thread, aligning it with the asynchronous design of `FLUSHALL ASYNC` and eliminating main thread blocking.  ## User scenarios In some operations, people often need to do primary-replica switches. One goal is to avoid noticeable impact on the business—like key loss or reduced availability (e.g., write failures).  Here is the process: First, temporarily switch traffic to writable replicas. Then we wait for the primary pending replication data to be fully synced (so primry and replicas are in sync), before finishing the switch. We don't usually need to do the flush in this case, but it's an optimization that can be done.  Signed-off-by: Scut-Corgis <512141203@qq.com> Signed-off-by: jiegang0219 <512141203@qq.com> Co-authored-by: Binbin <binloveplay1314@qq.com>",https://github.com/valkey-io/valkey/commit/dd2827a14ea183389e693255c244e1a7cad2acbb
valkey-io/valkey,https://github.com/valkey-io/valkey,8ea7f13,Binbin,2025-11-23T15:27:50Z,"Update dual channel replication conf to mention the local buffer is imited by COB (#2824)  After introducing the dual channel replication in #60, we decided in #915 not to add a new configuration item to limit the replica's local replication buffer, just use ""client-output-buffer-limit replica hard"" to limit it.  We need to document this behavior and mention that once the limit is reached, all future data will accumulate in the primary side.  Signed-off-by: Binbin <binloveplay1314@qq.com>",https://github.com/valkey-io/valkey/commit/8ea7f1330cbc80fe016fc5110ec91efe2369ecee
valkey-io/valkey,https://github.com/valkey-io/valkey,8189fe5,Binbin,2025-11-21T10:31:31Z,"Add rdb_transmitted to replstateToString so that we can see it in INFO (#2833)  In dual channel replication, when the rdb channel client finish the RDB transfer, it will enter REPLICA_STATE_RDB_TRANSMITTED state. During this time, there will be a brief window that we are not able to see the connection in the INFO REPLICATION.  In the worst case, we might not see the connection for the DEFAULT_WAIT_BEFORE_RDB_CLIENT_FREE seconds. I guess there is no harm to list this state, showing connected_slaves but not showing the connection is bad when troubleshooting.  Note that this also affects the `valkey-cli --rdb` and `--functions-rdb` options. Before the client is in the `rdb_transmitted` state and is released, we will now see it in the info (see the example later).  Before, not showing the replica info ``` role:master connected_slaves:1 ```  After, for dual channel replication: ``` role:master connected_slaves:1 slave0:ip=xxx,port=xxx,state=rdb_transmitted,offset=0,lag=0,type=rdb-channel ```  After, for valkey-cli --rdb-only and --functions-rdb: ``` role:master connected_slaves:1 slave0:ip=xxx,port=xxx,state=rdb_transmitted,offset=0,lag=0,type=replica ```  Signed-off-by: Binbin <binloveplay1314@qq.com>",https://github.com/valkey-io/valkey/commit/8189fe5c42573f96229bea7d427b650a4354be31
valkey-io/valkey,https://github.com/valkey-io/valkey,05540af,Ricardo Dias,2025-11-20T10:23:00Z,"Add script function flags in the module API (#2836)  This commit adds script function flags to the module API, which allows function scripts to specify the function flags programmatically.  When the scripting engine compiles the script code can extract the flags from the code and set the flags on the compiled function objects.  ---------  Signed-off-by: Ricardo Dias <ricardo.dias@percona.com>",https://github.com/valkey-io/valkey/commit/05540af405b05382e700a594ae229ac34056a7bc
valkey-io/valkey,https://github.com/valkey-io/valkey,ed8856b,Hanxi Zhang,2025-11-20T07:07:16Z,"Fix cluster slot migration flaky test (#2756)  The original test code only checks:  The original test code only checks:  1. wait_for_cluster_size 4, which calls cluster_size_consistent for every node. Inside that function, for each node, cluster_size_consistent queries cluster_known_nodes, which is calculated as (unsigned long long)dictSize(server.cluster->nodes). However, when a new node is added to the cluster, it is first created in the HANDSHAKE state, and clusterAddNode adds it to the nodes hash table. Therefore, it is possible for the new node to still be in HANDSHAKE status (processed asynchronously) even though it appears that all nodes “know” there are 4 nodes in the cluster.  2. cluster_state for every node, but when a new node is added, server.cluster->state remains FAIL.   Some handshake processes may not have completed yet, which likely causes the flakiness. To address this, added a --cluster check to ensure that the config state is consistent.  Fixes #2693.  Signed-off-by: Hanxi Zhang <hanxizh@amazon.com> Co-authored-by: Binbin <binloveplay1314@qq.com>",https://github.com/valkey-io/valkey/commit/ed8856bdfce07426b36a75b84cf9ee798024336f
valkey-io/valkey,https://github.com/valkey-io/valkey,e19ceb7,aradz44,2025-11-19T09:33:55Z,"deflake ""Hash field TTL and active expiry propagates correctly"" (#2856)  Fix a little miss in ""Hash field TTL and active expiry propagates correctly through chain replication"" test in `hashexpire.tcl`. The test did not wait for the initial sync of the chained replica and thus  made the test flakey  Signed-off-by: Arad Zilberstein <aradz@amazon.com>",https://github.com/valkey-io/valkey/commit/e19ceb7a6de207d049378a29406cb1763a6e1844
